accession,name,description,Parent study,Study Disease/Focus,Study Design,Study Markerset,Study Molecular Data Type,Study Content,Ancestry (computed),NIH Institute,Study Consent,Release Date,Embargo Release Date,Related Terms,Collections
"phs003348.v1.p1","A genotype-phenotype study of tumors from patients with inherited    mutations in DNA repair genes","This study investigated the genomic landscape of tumors from patients with inherited mutations in DNA repair genes. The aim of this study was to determine the relationship between locus-specific loss  of heterozygosity (LOH) and genomic signatures of homologous recombination-based DNA repair (HR) deficiency in tumors associated with pathogenic","Not Applicable","Neoplasms","Tumor vs. Matched-Normal","Not Provided","WXS","4 phenotype datasets, 25 variables, 39 samples sequenced, 39 subjects, 39 samples","","NCI","GRU --- General Research Use","2024-08-28","2024-08-28","BRCA1- and BRCA2-associated hereditary breast and ovarian cancer; BRCA1- and BRCA2-associated hereditary breast and ovarian cancer (HBOC); Breast and ovarian cancer; Familial Breast and Ovarian Cancer Syndrome; Familial Breast/Ovarian Cancer (BRCA1, BRCA2); HBOC Syndrome",""
"phs003640.v1.p1","The Somatic Mutational Landscape of Thyroid Cancer in Patients with    Germline PTEN Mutations","PTEN hamartoma tumor syndrome (PHTS) is associated with a high rate of thyroid cancer and benign thyroid disease, yet nothing is known of the genomic landscape of PHTS-associated thyroid tumors.  In this study, exome sequencing was performed on 58 thyroid tumors (28 cancers, 30 benign nodules) from 19 patients with PHTS, sequenced in","Not Applicable","Hamartoma Syndrome, Multiple","Tumor vs. Matched-Normal","WES_markerset_grc37","SNV Aggregate (.MAF), WXS","4 phenotype datasets, 16 variables, 1 molecular datasets, 68 samples sequenced, 16 subjects, 68 samples","","NCI","DS-CWDN-COL-NPU --- Disease-Specific (Cowden Syndrome or another condition within the PTEN Hamartoma Tumor Syndrome, COL, NPU), DS-CWDN --- Disease-Specific (Cowden Syndrome or another condition within the PTEN Hamartoma Tumor Syndrome)","2024-08-26","2024-08-26","BANNAYAN-RILEY-RUVALCABA SYNDROME; BANNAYAN-ZONANA SYNDROME; BBRS; BZS; CD; CS",""
"phs003717.v1.p1","Molecular Analysis of Alliance A031201 Study","This is the first study examining the relationship between clonal hematopoiesis and clinical outcomes in prostate cancer patients. We used a targeted gene sequencing panel to identify patients in the  A031201 clinical trial with and without clonal hematopoiesis. We found that clonal hematopoiesis did not affect overall or progression free survival","Not Applicable","Prostatic Neoplasms","Case Set","Not Provided","Targeted-Capture","4 phenotype datasets, 13 variables, 957 samples sequenced, 957 subjects, 957 samples","","NCI","DS-PC --- Disease-Specific (Prostate Cancer)","2024-08-23","2024-08-23","NGP - New growth of prostate; Neoplasm of Prostate; Neoplasm of the Prostate; Neoplasm, Prostate; Neoplasm, Prostatic; Neoplasms, Prostate",""
"phs003704.v1.p1","Botensilimab, an Fc-enhanced Anti-CTLA-4 Antibody, is Effective Against    Tumors Poorly Responsive to Conventional Immunotherapy","This study explores the genomic landscape associated with a novel Fc-engineered anti-CTLA-4 antibody (botensilimab) in advanced solid tumors. We seek to understand if enhancing the Fc-region affinity of anti-CTLA-4 antibodies  can improve anti-tumor efficacy and expand clinical benefit to tumors poorly responsive to conventional immunotherapy. As part of an ongoing","Not Applicable","Immunotherapy","Clinical Trial","Not Provided","RNA-Seq","4 phenotype datasets, 12 variables, 95 samples sequenced, 70 subjects, 95 samples","","NCI","GRU-NPU --- General Research Use (NPU)","2024-08-23","2024-08-23","Sarcoma; CRC; Cancer of Large Bowel; Cancer of Large Intestine; Cancer of the Large Bowel; Cancer of the Large Intestine",""
"phs003683.v1.p1","Somatic Mutations in Individual Skin Cells","Ultraviolet (UV) radiation is the primary cause of melanoma through the acquisition of driver mutations in melanocytes. It also plays a significant role in oncogenesis in other skin cells, such  as keratinocytes. However, the mutational profiles vary widely among different skin cancers, and the early mutational processes in different cell","Not Applicable","Carcinoma, Squamous Cell","Cross-Sectional","Not Provided","RNA-Seq, WXS","4 phenotype datasets, 15 variables, 347 samples sequenced, 16 subjects, 347 samples","","NCI","GRU --- General Research Use","2024-08-22","2024-08-22","Skin Neoplasms; Carcinoma, Epidermoid; Carcinoma, Planocellular; Carcinoma, Squamous; Carcinomas, Epidermoid; Carcinomas, Planocellular",""
"phs003676.v1.p1","Chromothripsis in Small Cell Lung Carcinoma Associated with Carcinoid    Transformation","Small cell lung carcinoma (SCLC) is typically associated with tobacco exposure and inactivation of RB1 and TP53 genes. We performed detailed clinicopathologic, genomic, and transcriptomic profiling of an atypical subset  of SCLC in never/light smokers that lacked RB1 and TP53 co-inactivation and found that most cases were associated with chromothripsis &#x02013;","Not Applicable","Carcinoma, Small Cell","Case Set","Not Provided","RNA-Seq, WGS","4 phenotype datasets, 13 variables, 29 samples sequenced, 12 subjects, 29 samples","","NCI","GRU --- General Research Use","2024-08-22","2024-08-22","Carcinoid Tumor; Chromothripsis; Carcinoid; Carcinoid tumor (disease); Carcinoid tumors; Carcinoid tumour","dbGaP Collection: Compilation of Individual-Level Genomic Data for    General Research Use (phs000688.v1.p1)"
"phs002922.v2.p1","Genomic and Transcriptomic Sequencing of CAR-T-Treated Patients","Chimeric Antigen Receptor (CAR)-T cell therapy has revolutionized the treatment of hematologic malignancies. Approximately half of patients with refractory large B-cell lymphomas achieve durable responses from CD19-targeting CAR-T treatment; however,  failure mechanisms are identified in only a fraction of cases. Here we use next-generation sequencing technologies to characterize the genomic and","Not Applicable","Lymphoma, B-Cell","Prospective Longitudinal Cohort","Not Provided","OTHER","4 phenotype datasets, 16 variables, 95 samples sequenced, 58 subjects, 155 samples","","NCI","HMB --- Health/Medical/Biomedical","2024-08-22","2022-10-06","",""
"phs003697.v1.p1","Evolving Cell States and Oncogenic Drivers during the Progression of    IDH-Mutant Gliomas","The study aims to understand the changes in cell states during the progression of IDH mutant gliomas. We generated scATAC-seq data from tumor samples of patients with IDH mutant gliomas,  ranging from grade 2 to grade 4, including both IDH mutant oligodendroglioma and IDH mutant astrocytoma samples. Additionally, we have generated","Not Applicable","Glioma","Methods","Not Provided","ATAC-seq, RNA-Seq","3 phenotype datasets, 12 variables, 15 samples sequenced, 11 subjects, 15 samples","","NCI","GRU --- General Research Use","2024-08-15","2024-08-15","Glial Cell Tumor; Glial Cell Tumors; Glial Neoplasm; Glial Tumor; Neoplasm of Neuroglia; Neoplasm of the Neuroglia",""
"phs002366.v2.p2","Lung Cancer Genetic Study Among Asian Never Smokers","The Lung Cancer Genetic Study Among Asian Never Smokers includes data from four population-based studies conducted among Asian women: the Shanghai Women's Health Study (SWHS), the Hwasun Cancer Epidemiology Study  (HCES1 and HCES2), the Female Lung Cancer Consortium in Asia (FLCCA, including sFLCA), and the Guangzhou Lung Cancer Study (GLCS). Shanghai Women's","Not Applicable","Lung Neoplasms","Case-Control","WES_markerset_grc37, MEGA_Consortium_Array","SNP Genotypes (Array), SNP/CNV Genotypes (NGS), WXS","4 phenotype datasets, 17 variables, 2 molecular datasets, 1195 samples sequenced, 8310 subjects, 8369 samples","","NCI","HMB-PUB-NPU --- Health/Medical/Biomedical (PUB, NPU), HMB-PUB --- Health/Medical/Biomedical (PUB), DS-LC --- Disease-Specific (Lung Cancer), GRU-NPU --- General Research Use (NPU)","2024-08-13","2024-08-13","Lung Tumor; Lung cancer; Lung neoplasm; Lung tumour; Neoplasm of Lung; Neoplasm of the Lung",""
"phs001524.v3.p2","The Genetic Basis of Aggressive Prostate Cancer, The Role of Rare    Variation","In this study, we will apply a multi-staged approach to reveal genes harboring rare variants that are associated with aggressive PCa. Whole-exome sequencing (Aim 1a) of 2,774 aggressive cases and  2,776 non-aggressive cases of European ancestry will be conducted followed by rare variant analysis of single sites and gene burden testing to","Not Applicable","Prostatic Neoplasms","Case Set","WES_markerset_grc37","SNP/CNV Genotypes (NGS), Targeted-Capture, WXS","4 phenotype datasets, 29 variables, 3 molecular datasets, 21898 samples sequenced, 21745 subjects, 21898 samples","","NCI","GRU --- General Research Use, DS-PC-MDS --- Disease-Specific (Prostate Cancer, MDS), CADM --- Cancer in all age groups, other diseases in adults only, and methods, DS-CA-PUB --- Disease-Specific (Cancer, PUB), HMB-PUB --- Health/Medical/Biomedical (PUB), DS-PC --- Disease-Specific (Prostate Cancer), MHNSI-MDS --- Men's Health and Nutrition in Serious Illnesses (MDS), DS-CA-NPU-GSO --- Disease-Specific (Cancer, NPU, GSO), DS-PC-NPU-MDS --- Disease-Specific (Prostate Cancer, NPU, MDS)","2024-08-12","2024-08-12","NGP - New growth of prostate; Neoplasm of Prostate; Neoplasm of the Prostate; Neoplasm, Prostate; Neoplasm, Prostatic; Neoplasms, Prostate",""
"phs003488.v1.p1","APOLLO-OV: Applied Proteogenomics of High Grade Serous Ovarian Carcinoma","APOLLO is a proteogenomic study seeking to describe the major genome, transcriptome, proteome and phosphoproteome alterations, subtypes, and molecular predictors of patient outcomes. This study includes 70 high grade serous  ovarian carcinoma tissues from the Gynecologic Cancer Center of Excellence","Not Applicable","Ovarian Neoplasms","Tumor vs. Matched-Normal","Not Provided","Not Provided","3 phenotype datasets, 13 variables, 70 subjects, 70 samples","","NCI","GRU --- General Research Use","2024-08-09","2024-08-09","Neoplasm of Ovary; Neoplasm of the Ovary; Neoplasm of the ovaries; Neoplasm, Ovarian; Neoplasm, Ovary; Neoplasms, Ovarian",""
"phs003282.v2.p1","Genetic Analysis of Skin Cells","Cutaneous squamous cell carcinoma (cSCC) is a form of skin cancer originating from keratinocytes in the skin. They have high mutation burdens, primarily driven by UV-radiation-induced DNA damage. The order  in which mutations undergo selection during the evolution of cSCC is not known. A subset of cSCCs grow out of benign neoplasms called actinic","Not Applicable","DNA Copy Number Variations","Methods","Not Provided","RNA-Seq, Targeted-Capture","4 phenotype datasets, 13 variables, 54 samples sequenced, 16 subjects, 54 samples","","NCI","GRU --- General Research Use","2024-08-09","2023-08-18","Not Provided",""
"phs003563.v1.p1","Transfer Learning Associates CAFs with EMT and Inflammation in Tumor    Cells in Human Tumors and Organoid Co-Culture in Pancreatic Ductal    Adenocarcinoma","This study examined the transcriptional changes induced by cancer associated fibroblasts (CAFs) in pancreatic ductal adenocarcinoma patient-derived tumor organoids. We hypothesized that cancer associated fibroblasts impacted tumor cell transcription to  promote tumorigenic behavior. Using patient-matched cells from 3 patients, we compared the transcriptional profiles of patient-derived organoids in","Not Applicable","Pancreatic Neoplasms","Collection","Not Provided","RNA-Seq","3 phenotype datasets, 16 variables, 12 samples sequenced, 3 subjects, 12 samples","","NCI","HMB-IRB-NPU --- Health/Medical/Biomedical (IRB, NPU)","2024-08-08","2024-08-08","Inflammation; Inflammatory Response, Innate; Innate Inflammatory Response; Innate Inflammatory Responses; Cancer of the pancreas; Neoplasia of the pancreas",""
"phs003579.v1.p1","Phase II Study of Cryoablation and Post-Progression Immune Checkpoint    Inhibition in Metastatic Melanoma","Percutaneous cryoablation guided by imaging is a well-established, minimally invasive treatment for oncological conditions. We posited that cryoablation could alter the immune microenvironment by directly influencing the tumor, potentially eliciting  an anti-tumor response in cases resistant to immune checkpoint inhibition (ICI). In this non-randomized phase II single-center study (NCT03290677),","Not Applicable","Melanoma","Collection","Not Provided","RNA-Seq","4 phenotype datasets, 19 variables, 20 samples sequenced, 15 subjects, 20 samples","","NCI","DS-MSC-MDS --- Disease-Specific (Melanoma and Skin Cancer Research, MDS)","2024-08-05","2024-08-05","Cancer of skin pigment cells; MM - malignant melanoma; Malignant Melanoma; Malignant Melanomas; Melanoma, Malignant; Melanomas",""
"phs003286.v2.p1","Multi-Omic Profiling of Glioma Patient Tumors and Patient-Derived Model    Systems","We have created a resource of transcriptomic (RNAseq), genomic (whole-exome seq), and lipidomic (untargeted shotgun) profiling data from over 175 molecularly diverse glioma tumors and derivative models in orthotopic mouse  xenografts and gliomasphere cultures from over 110 unique patient tumor lines. Provided in this dataset are matched bulk RNA and whole-exome","Not Applicable","Glioblastoma","Collection","RNAseq_gene_transcripts, RNAseq_gene_transcripts, WES_markerset_grc38","RNA-Seq, CNV Segments (NGS), RNA Seq (NGS), WXS","5 phenotype datasets, 23 variables, 1 molecular datasets, 461 samples sequenced, 119 subjects, 461 samples","","NCI","GRU-NPU --- General Research Use (NPU)","2024-08-05","2024-08-05","Astrocytoma, Grade IV; Astrocytomas, Grade IV; GBM; GBM (glioblastoma); Giant cell glioblastoma (histologic variant); Glioblastoma multiforme",""
"phs003682.v1.p1","EWS-WT1 Fusion Isoforms Establish Oncogenic Programs and Therapeutic    Vulnerabilities in Desmoplastic Small Round Cell Tumors","Desmoplastic Small Round Cell Tumor (DSRCT) is an aggressive mesenchymal tumor driven by fusions between the disordered domain of the Ewing sarcoma RNA binding protein 1 (EWSR1) and the developmental  transcription factor Wilms tumor 1 (WT1). We used genome-wide chromatin profiling to identify EWSR1-WT1-dependent gene regulatory networks and target","Not Applicable","Sarcoma","Case Set","Not Provided","ChIP-Seq","3 phenotype datasets, 10 variables, 12 samples sequenced, 2 subjects, 12 samples","","NCI","HMB --- Health/Medical/Biomedical","2024-07-31","2024-07-31","Blastoma; CA; CA - Cancer; Cancer; MT; Malignancies",""
"phs003480.v1.p1","Single-Cell RNA-Sequencing of Human Prostatectomy Tissue","The tissue microenvironment in prostate cancer is profoundly altered. How prostate cancer cells and their precursors mediate those changes is unclear, in part due to the inability to longitudinally study  the disease evolution in human tissues. To overcome this limitation, we performed extensive single-cell RNA-sequencing (scRNA-seq) to assess the","Not Applicable","Prostatic Neoplasms","Tumor vs. Matched-Normal","Not Provided","RNA-Seq","4 phenotype datasets, 17 variables, 12 samples sequenced, 7 subjects, 12 samples","","NCI","HMB-IRB-NPU --- Health/Medical/Biomedical (IRB, NPU)","2024-07-30","2024-07-30","NGP - New growth of prostate; Neoplasm of Prostate; Neoplasm of the Prostate; Neoplasm, Prostate; Neoplasm, Prostatic; Neoplasms, Prostate",""
"phs001287.v19.p6","CPTAC Proteogenomic Study","Recently, significant progress has been made in characterizing and sequencing the genomic alterations in statistically robust numbers of samples from several types of cancer. For example, The Cancer Genome Atlas  (TCGA), International Cancer Genome Consortium (ICGC) and other similar efforts are identifying genomic alterations associated with specific cancers","Not Applicable","Neoplasms","Case Set","Not Provided","Not Provided","3 phenotype datasets, 11 variables, 7117 subjects, 7117 samples","","NCI","GRU --- General Research Use","2024-07-26","2023-06-29","Lung Neoplasms; Sarcoma; Uterine Neoplasms; ADENOCARCINOMA OF LUNG; Adenocarcinoma of lung, somatic; Adenocarcinoma of the Lung","NCI's Collection of Datasets for General Research Use (phs003014.v1.p1)"
"phs003712.v1.p1","Early Detection of Malignant and Pre-Malignant Peripheral Nerve Tumors    Using Cell-Free DNA Fragmentomics","Early detection of neurofibromatosis type 1 (NF1) associated peripheral nerve sheath tumors (PNST) informs clinical decision-making, potentially averting deadly outcomes. Here, we describe a cell-free DNA (cfDNA) fragmentomic approach which  distinguishes non-malignant, pre-malignant and malignant forms of NF1 PNST. Using plasma samples from a novel cohort of 101 NF1 patients and 21","Not Applicable","Neurofibromatosis 1","Case-Control","Not Provided","WGS","3 phenotype datasets, 12 variables, 166 samples sequenced, 122 subjects, 166 samples","","NCI","GRU-IRB --- General Research Use (IRB)","2024-07-25","2024-07-25","Molluscum Fibrosum; Multiple non-ossifying fibromatosis; NEUROFIBROMATOSIS TYPE 1; NEUROFIBROMATOSIS, PERIPHERAL TYPE; NEUROFIBROMATOSIS, TYPE I; NEUROFIBROMATOSIS, TYPE I, SOMATIC",""
"phs003519.v1.p1","Childhood Cancer Data Initiative (CCDI): Single-Cell Atlas of NF1 Nerve    Sheath Tumors","The worst outcome of NF1 is the development of the aggressive and highly metastatic malignant peripheral nerve sheath tumors (MPNST), which transform from benign plexiform neurofibroma (PN) and lack effective  treatment. In this study, we performed single-cell RNA sequencing of 63 clinically annotated NF1-associated peripheral nerve sheath tumors, including","Not Applicable","Rare Diseases","Prospective Longitudinal Cohort","Not Provided","Not Provided","2 phenotype datasets, 5 variables, 29 subjects, 55 samples","","NCI","GRU --- General Research Use","2024-07-22","2024-07-22","Neurofibromatosis 1; Rare Disease; Blastoma; CA; CA - Cancer; Cancer",""
"phs002517.v3.p2","Childhood Cancer Data Initiative (CCDI): Molecular Characterization    across Pediatric Brain Tumors and Other Solid and Hematologic    Malignancies for Research, Diagnostic, and Precision Medicine","This study contains tumor and germline WGS, RNA-Seq, Clinical Panel Sequencing, and other omics and molecular data for patients with pediatric brain tumors and other solid and hematologic malignancies. This  data has been collected from multiple organizations including the multi-institute Children's Brain Tumor Network (CBTN), the Pacific Pediatric","Not Applicable","Brain Neoplasms","Tumor vs. Matched-Normal","Not Provided","RNA-Seq, Targeted-Capture, WGS, WXS, miRNA-Seq","2 phenotype datasets, 5 variables, 3187 samples sequenced, 3937 subjects, 8972 samples","","NCI","GRU --- General Research Use","2024-07-22","2023-05-12","Brain Tumor; Brain Tumors; Brain neoplasm; Brain tumour; Neoplasm of Brain; Neoplasm of the Brain",""
"phs003008.v1.p1","Comprehensive Genomic Characterization of Translocation Renal Cell    Carcinoma","Xp11 translocation renal cell carcinoma (tRCC) is a rare, female-predominant cancer driven by a fusion between the TFE3 gene on chromosome Xp11.2 and a partner gene on either chrX or  an autosome. It remains unknown what types of rearrangements underlie TFE3 fusions, whether fusions can arise from both the active (chrXa) and","Not Applicable","Kidney","Tumor vs. Matched-Normal","Not Provided","RNA-Seq, WGS","4 phenotype datasets, 15 variables, 61 samples sequenced, 16 subjects, 61 samples","","NCI","HMB --- Health/Medical/Biomedical","2024-07-19","2024-07-19","Not Provided",""
"phs001988.v2.p1","Molecular Characterization of Prostate Cancer Specimens by Bulk and    Single Cell Analysis","Version 1: We performed single-cell RNA-sequencing (scRNA-seq) of fresh biopsies from metastatic castration resistant prostate cancer. Additionally, where available, we performed matched bulk whole exome sequencing (WXS; tumor and normal  paired) and whole transcriptome sequencing for the same individuals. We also performed bulk whole exome (WXS) and RNA-sequencing (RNA-Seq) from FFPE","Not Applicable","Prostatic Neoplasms","Clinical Trial","Not Provided","RNA-Seq, WGS, WXS","4 phenotype datasets, 26 variables, 201 samples sequenced, 58 subjects, 201 samples","","NCI","GRU --- General Research Use, DS-CA-MDS --- Disease-Specific (Cancer, MDS), DS-PC-MDS --- Disease-Specific (Prostate Cancer, MDS)","2024-07-19","2021-04-27","NGP - New growth of prostate; Neoplasm of Prostate; Neoplasm of the Prostate; Neoplasm, Prostate; Neoplasm, Prostatic; Neoplasms, Prostate","NCI's Collection of Datasets for General Research Use (phs003014.v1.p1)"
"phs003569.v1.p1","Aberrant Activation of Wound Healing Programs within the Metastatic Niche    Facilitates Lung Colonization by Osteosarcoma Cells","Lung metastasis is responsible for nearly all deaths caused by osteosarcoma, the most common pediatric bone tumor. How malignant bone cells coerce the lung microenvironment to support metastatic growth is  unclear. This study delineates how osteosarcoma cells educate the lung microenvironment during metastatic progression. Using single-cell","Not Applicable","Osteosarcoma","Case Set","Not Provided","RNA-Seq","5 phenotype datasets, 19 variables, 7 samples sequenced, 5 subjects, 7 samples","","NCI","GRU-PUB-NPU --- General Research Use (PUB, NPU)","2024-07-18","2024-07-18","Bone cell cancer; OSRC; OSTEOSARCOMA; Osteoblastic osteosarcoma; Osteoblastic sarcoma; Osteochondrosarcoma",""
"phs003613.v1.p1","Chromatin Landscape of BET Inhibitor-Treated CD8+ T-cells from Chronic    Lymphocytic Leukemia Patients","The pan-BET (bromodomain and extra-terminal) inhibitor, OPN-51107 (OPN5) was found to alleviate features of T-cell exhaustion in models of chronic lymphocytic leukemia (CLL). To evaluate if OPN5 treatment could relieve  fixed chromatin states associated with terminal T-cell dysfunction, ATAC-sequencing was performed on CLL patient T-cells. Peripheral blood","Not Applicable","Leukemia, Lymphocytic, Chronic, B-Cell","Case Set","Not Provided","ATAC-seq, SRA Metadata","3 phenotype datasets, 15 variables, 1 molecular datasets, 8 samples sequenced, 5 subjects, 10 samples","","NCI","GRU --- General Research Use","2024-07-10","2024-07-10","B Cell CLL; B Cell Chronic Lymphocytic Leukemia; B Cell Leukemia, Chronic; B Cell Lymphocytic Leukemia; B Cell Malignancy, Low Grade; B Lymphocytic Leukemia, Chronic",""
"phs002790.v7.p1","Childhood Cancer Data Initiative (CCDI): Molecular Characterization    Initiative","The National Cancer Institute's (NCI) Childhood Cancer Data Initiative (CCDI) focuses on the critical need to collect, analyze, and share data to address the burden of cancer in children, adolescents,  and young adults (AYAs). The Molecular Characterization Initiative (MCI) will further the CCDI's goals by providing access to better diagnostic tests","Not Applicable","Neoplasms","Tumor vs. Matched-Normal","Not Provided","OTHER, WXS","2 phenotype datasets, 5 variables, 6375 samples sequenced, 3014 subjects, 8485 samples","","NCI","GRU --- General Research Use","2024-07-10","2022-11-03","Blastoma; CA; CA - Cancer; Cancer; MT; Malignancies",""
"phs003503.v1.p1","ILyAD (Indolent Lymphoma And vitamin D)","Indolent non-Hodgkin lymphomas are incurable diseases, and require intermittent and often morbid and expensive therapy during their prolonged natural history. Lower intensity and better-tolerated, cost-effective treatment strategies are needed for  these patients. Low vitamin D levels at diagnosis of indolent lymphomas are strongly associated with inferior outcomes to treatment. Standard therapy","Not Applicable","Lymphoma, Non-Hodgkin","Clinical Trial","WES_markerset_grc38","SNP/CNV Genotypes (NGS), WXS","4 phenotype datasets, 16 variables, 1 molecular datasets, 185 samples sequenced, 185 subjects, 185 samples","","NCI","GRU-IRB --- General Research Use (IRB)","2024-07-08","2024-07-08","Interdigitating cell sarcoma; Reticulosarcomas; Reticulum Cell Sarcoma; Reticulum Cell Sarcomas; Reticulum cell sarcoma morphology; Reticulum-Cell Sarcoma",""
"phs003462.v1.p1","Tumor detection by analysis of both symmetric- and hemi-methylation of    plasma cell-free DNA","Aberrant DNA methylation plays a critical role in tumorigenesis. While DNA methylation has been used for cancer detection and classification, DNA hemi-methylation, a novel epigenetic mark has not been analyzed  extensively in cancer epigenomes. Here we report a strand-specific (ss) sequencing method (MeDIP-Seq) for plasma cell free (cf) DNA (sscf-MeDIP-Seq),","Not Applicable","Early Detection of Cancer","Case-Control","Not Provided","MeDIP-Seq","3 phenotype datasets, 13 variables, 271 samples sequenced, 271 subjects, 271 samples","","NCI","DS-HCC --- Disease-Specific (Hepatocellular Carcinoma), DS-BT --- Disease-Specific (Brain Tumors)","2024-07-08","2024-07-08","Liver Neoplasms; Brain Neoplasms; Brain Tumor; Brain Tumors; Brain neoplasm; Brain tumour",""
"phs003220.v2.p1","Identification of High-Risk PHF19 Expressing Cells in Myeloma Single-Cell    Multiomics","The aim of this study is to identify novel subsets of cells that are associated with progression and response to treatment. In this project, we study the tumor fraction from  49 myeloma patients across stages of progression. Samples were collected from 10 smoldering multiple myeloma (SMM), 22 newly diagnosed multiple","Not Applicable","Multiple Myeloma","Case Set","Not Provided","OTHER, WGS","4 phenotype datasets, 30 variables, 186 samples sequenced, 49 subjects, 186 samples","","NCI","GRU-NPU --- General Research Use (NPU)","2024-07-08","2024-03-07","Al amyloidosis; Cell Myeloma, Plasma; Cell Myelomas, Plasma; Disease, Kahler; Familial Myeloma; Kahler Disease",""
