"phs003148.v1.p1","NCT03343197: Clinical Biomarker Data","Patients with IDH1-mutated low-grade glioma were treated with AG-120 (ivosidenib), AG-881 (vorasidenib), or Placebo for 28 days before surgical resection. A portion of the surgical sample was submitted for exome  capture-based transcriptome sequencing (Personalis ACE Whole Transcriptome). Following surgery, subjects had the option to continue (or initiate)","Not Applicable","Glioma","Clinical Trial","Not Provided","RNA-Seq","4 phenotype datasets, 15 variables, 41 samples sequenced, 41 subjects, 41 samples","","NCI","DS-GL --- Disease-Specific (Glioma)","2023-03-22","2023-03-22","Glial Cell Tumor; Glial Cell Tumors; Glial Neoplasm; Glial Tumor; Neoplasm of Neuroglia; Neoplasm of the Neuroglia",""
"phs003191.v1.p1","RNA Splicing Dysregulation in the Pathogenesis of Chronic Lymphocytic    Leukemia","RNA splicing dysregulation is a hallmark of cancers, promoting the onset and progression of disease. In chronic lymphocytic leukemia (CLL), spliceosome mutations leading to aberrant splicing occurs in approximately 20%  of patients. However, the underlying mechanism for splicing defects in spliceosome unmutated CLL cases remains elusive. To discover","Not Applicable","Leukemia, Lymphocytic, Chronic, B-Cell","Case-Control","Not Provided","OTHER, RNA-Seq","4 phenotype datasets, 23 variables, 56 samples sequenced, 48 subjects, 56 samples","","NCI","DS-CLL-PUB-NPU --- Disease-Specific (Chronic Lymphocytic Leukemia, PUB, NPU)","2023-03-21","2023-03-21","B Cell CLL; B Cell Chronic Lymphocytic Leukemia; B Cell Leukemia, Chronic; B Cell Lymphocytic Leukemia; B Cell Malignancy, Low Grade; B Lymphocytic Leukemia, Chronic",""
"phs002435.v1.p1","Development and Validation of Patient-Derived Xenografts from    Fibrolamellar Carcinoma Human Tissue","We developed and validated Patient-Derived Xenografts (PDX) of Fibrolamellar Carcinoma human tissue from surgical resections. Human tissues from primary liver tumor, recurrent liver, and liver metastases were implanted into NOD-SCID-Gamma  (NSG) mice (Jackson laboratories) and monitored for tumor growth. Some of the original tissues were frozen for further analysis including RNA","Not Applicable","Carcinoma, Hepatocellular","Xenograft","Not Provided","RNA-Seq","4 phenotype datasets, 14 variables, 19 samples sequenced, 5 subjects, 19 samples","","NCI","DS-HCC-IRB-COL --- Disease-Specific (Hepatocellular Carcinoma, IRB, COL)","2023-03-17","2023-03-17","Adult Liver Cancer; Adult Liver Cancers; Cancer, Adult Liver; Cancers, Adult Liver; Carcinoma of Liver Cells; Carcinoma of the Liver Cells",""
"phs003165.v1.p1","Phase I Study and Cell-Free DNA Analysis of T-DM1 and Metronomic    Temozolomide for Secondary Prevention of HER2-Positive Breast Cancer    Brain Metastases","This study is a phase I trial combining ado-trastuzumab emtansine (T-DM1) with Temozolomide (TMZ) for the prevention of additional brain metastases after previous occurrence and local treatment in HER2+ breast  cancer patients. Twelve patients were enrolled in this study. Data includes whole exome sequencing (WES) from patients' cerebrospinal fluid (CSF) and","Not Applicable","Breast Neoplasms","Case Set","target_markerset_grc38","SNP Genotypes (NGS), WXS","4 phenotype datasets, 15 variables, 1 molecular datasets, 69 samples sequenced, 12 subjects, 69 samples","","NCI","GRU --- General Research Use","2023-03-16","2023-03-16","Brain Neoplasms; Brain Tumor; Brain Tumors; Brain neoplasm; Brain tumour; Neoplasm of Brain","dbGaP Collection: Compilation of Individual-Level Genomic Data for    General Research Use (phs000688.v1.p1)"
"phs002962.v1.p1","Germline Genetics of Myelodysplastic Syndromes (MDS) and Acute Myeloid    Leukemia (AML)","Myelodysplastic syndromes (MDS) are part of a heterogeneous and overlapping group of clonal diseases including acute myeloid leukemia (AML), myeloproliferative neoplasms (MPN), and the hybrid MDS/MPN entities that arise in  hematopoietic stem or progenitor cells. Individuals with MDS have a high risk of progressing to leukemia, with approximately 30% expected to develop","Not Applicable","Myelodysplastic Syndromes","Case-Control","Global_Diversity_Array-8","SNP Genotypes (Array)","5 phenotype datasets, 32 variables, 1 molecular datasets, 1711 subjects, 1711 samples","European (1671), African (1), East Asian (5), African American (11), Hispanic1 (3), Hispanic2 (12), Other Asian or Pacific Islander (4), South Asian (2), Other (2)","NCI","GRU-PUB --- General Research Use (PUB)","2023-03-16","2023-03-16","AML; AML - Acute Myeloid Leukemia; AML - Acute myeloblastic leukemia; AML - acute myeloid leukaemia; AML adult; ANLL",""
"phs002347.v1.p1","PDAC Prognosis Biomarkers in Genomic and Transcriptomic Molecular Data","Our study was designed to identify biomarkers related to the prognosis of Pancreatic Ductal AdenoCarcinoma (PDAC) patients using genomic variants and gene expression in coding regions of the human genome  (exome). PDAC is the 7th cause of cancer deaths and is among types of cancer having the poorest prognosis. To improve treatment outcomes of PDAC,","Not Applicable","Carcinoma, Pancreatic Ductal","Tumor vs. Matched-Normal","WES_markerset_grc38, WES_markerset_grc38, WES_markerset_grc38","RNA-Seq, SNP Genotypes (NGS), SNV Aggregate (.MAF), WXS","4 phenotype datasets, 24 variables, 1 molecular datasets, 450 samples sequenced, 150 subjects, 450 samples","","NCI","GRU --- General Research Use","2023-03-15","2023-03-15","Adenocarcinoma; ADNOS; Adenocarcinomas; Adenoma, Malignant; Adenomas, Malignant; Malignant Adenoma","dbGaP Collection: Compilation of Individual-Level Genomic Data for    General Research Use (phs000688.v1.p1)"
"phs003103.v1.p1","Single Cell Analysis of Sporadic Human Basal Cell Carcinomas","To explore tumor heterogeneity in sporadic human basal cell carcinoma tumors, we profiled three individual patient tumors by scRNA-Seq and scATAC-Seq. Basal cell carcinomas (BCCs) are driven by hedgehog signaling  with GLI1 representing the key downstream transcription factor that drives tumor growth. GLI1 as such is a readout of active hedgehog signaling. We","Not Applicable","Carcinoma, Basal Cell","Case Set","ATAC_DNAseq_probe_set","OTHER, RNA Seq (NGS)","1 molecular datasets, 6 samples sequenced, 3 subjects, 6 samples","","NCI","GRU --- General Research Use","2023-03-09","2023-03-09","Basal Cell Nevus Syndrome; BCNS; BCNS - Basal cell nevus syndrome; BCNS1; Basal cell carcinoma syndrome; Fifth Phacomatoses",""
"phs003195.v1.p1","NSD2 E1099K Drives Relapse in Pediatric Acute Lymphoblastic Leukemia by    Disrupting 3D Chromatin Organization","NSD2 p.E1099K (EK) is a mutation shown to be enriched in patients that relapse with pediatric Acute Lymphoblastic Leukemia (ALL). This work aims to uncover 3D chromatin architecture-related mechanisms responsible  for drug resistance or therapy failure in these patients. We investigated this by performing Hi-C, ATAC-Seq, and RNA-Seq on three B-ALL cell lines","Not Applicable","Precursor Cell Lymphoblastic Leukemia-Lymphoma","Clinical Trial","Not Provided","RNA-Seq","3 phenotype datasets, 11 variables, 6 samples sequenced, 6 subjects, 6 samples","","NCI","GRU --- General Research Use","2023-03-08","2023-03-08","ALL, Childhood; Childhood ALL; Childhood Precursor Lymphoblastic Leukemia; L1 Lymphocytic Leukemia; Leukemia, L1 Lymphocytic; Leukemia, Lymphoblastic, Acute, L1",""
"phs002188.v2.p1","Single Cell Genomic Analysis of Lymphoma","Our study aimed to define the extent of heterogeneity between anatomically separated tumor manifestations in follicular lymphoma at single-cell resolution. We subjected single-cell suspensions derived from nodal, synchronously-acquired fine needle  aspirations from two distinct tumor sites to high-throughput microfluidics-based single-cell RNA sequencing. By comparing the relative composition of","Not Applicable","Lymphoma","Case Set","Not Provided","OTHER","4 phenotype datasets, 14 variables, 22 samples sequenced, 10 subjects, 22 samples","","NCI","GRU --- General Research Use","2023-03-03","2021-03-26","Follicular Lymphoma; Brill - Symmers' disease; Brill Symmers Disease; Brill-Symmers Disease; Disease, Brill-Symmers; FOLLICULAR LYMPHOMA, SOMATIC","dbGaP Collection: Compilation of Individual-Level Genomic Data for    General Research Use (phs000688.v1.p1); NCI's Collection of Datasets for General Research Use (phs003014.v1.p1)"
"phs002862.v1.p1","Improved T Cell Immunity Following Neoadjuvant Chemotherapy in Ovarian    Cancer","This study characterized the evolution of the peripheral immune cell function and composition across the course of standard of care platinum and taxane chemotherapy in ovarian cancer using bulk and  single cell transcriptomic approaches. Serial blood samples were collected from ten patients with advanced high-grade serous ovarian cancer treated","Not Applicable","Carcinoma, Ovarian Epithelial","Prospective Longitudinal Cohort","Not Provided","OTHER","4 phenotype datasets, 13 variables, 10 samples sequenced, 10 subjects, 10 samples","","NCI","GRU --- General Research Use","2023-03-02","2023-03-02","Cancer, Epithelial Ovarian; Cancer, Ovarian Epithelial; Carcinoma of Ovary; Carcinoma of the Ovary; Carcinoma, Epithelial Ovarian; Epithelial Cancer, Ovarian",""
"phs002939.v1.p1","NCI-Maryland Prostate Cancer Case-Control Study","The study seeks to examine the genetic and ancestral basis of prostate cancer-associated inflammation using a genome-wide association approach. The study population are the participants of the NCI Maryland Prostate  Cancer Case-Control study. This study recruited both African American and European American men, and investigated the causes for the excessive burden","Not Applicable","Prostatic Neoplasms","Case-Control","HumanOmni5Exome-4","SNP Genotypes (Array)","4 phenotype datasets, 20 variables, 1 molecular datasets, 1450 subjects, 1450 samples","European (753), African (16), African American (668), Hispanic1 (8), Hispanic2 (1), Other Asian or Pacific Islander (2), Other (2)","NCI","HMB-IRB-PUB-NPU-MDS --- Health/Medical/Biomedical (IRB, PUB, NPU, MDS)","2023-03-01","2023-03-01","NGP - New growth of prostate; Neoplasm of Prostate; Neoplasm of the Prostate; Neoplasm, Prostate; Neoplasm, Prostatic; Neoplasms, Prostate",""
"phs003111.v1.p1","Childhood Cancer Data Initiative (CCDI): Clonal Evolution During    Metastatic Spread in High-Risk Neuroblastoma","The goal of this study is to deliver a detailed characterization of the patterns of disease dissemination at diagnosis, during progression and in response to therapy in high-risk neuroblastoma. Longitudinal  and spatially distinct tumors were collected from patients. Clinical data includes diagnosis and treatment information. Biospecimen data includes","Not Applicable","Rare Diseases","Tumor vs. Matched-Normal","Not Provided","RNA-Seq, WGS","2 phenotype datasets, 7 variables, 195 samples sequenced, 129 subjects, 487 samples","","NCI","HMB --- Health/Medical/Biomedical","2023-02-28","2023-02-28","Rare Disease; Blastoma; CA; CA - Cancer; Cancer; MT",""
"phs002529.v1.p1","Childhood Cancer Data Initiative (CCDI): Comprehensive Genomic Sequencing    of Pediatric Cancer Cases (CMRI/KUCC)","This study provides paired tumor normal genomic sequencing data from 200 children with cancer, including both solid tumors and leukemias, done by the Children's Mercy Research Institute (CMRI) and University  of Kansas Cancer Center (KUCC). These data include whole genome sequencing (generally, 20x), whole exome sequencing (generally, 300x), bulk RNA","Not Applicable","Whole Genome Sequencing","Tumor vs. Matched-Normal","Not Provided","ATAC-seq, RNA-Seq, WGS, WXS","2 phenotype datasets, 5 variables, 372 samples sequenced, 193 subjects, 372 samples","","NCI","DS-CA --- Disease-Specific (Cancer)","2023-02-28","2023-02-28","Leukemia; Blood (Leukemia); Blood cancer; Leucocythaemia; Leucocythaemias; Leucocythemia",""
"phs003177.v1.p1","Comparison Between qPCR and RNA-Seq Reveals Challenges of Quantifying HLA    Expression","Human leukocyte antigen (HLA) class I and HLA class II loci are essential elements of innate and acquired immunity. Their exceptional influence on disease outcome is well documented by GWAS  and candidate gene studies. The impact of HLA allelic variation on human disease through allele-specific presentation of antigenic peptides to T","Not Applicable","HLA Antigens","Collection","Not Provided","RNA-Seq","4 phenotype datasets, 12 variables, 125 samples sequenced, 96 subjects, 125 samples","","NCI","GRU --- General Research Use","2023-02-24","2023-02-24","Not Provided","dbGaP Collection: Compilation of Individual-Level Genomic Data for    General Research Use (phs000688.v1.p1)"
"phs003060.v1.p1","Whole Exome Sequencing of Calcitonin Producing Pancreatic Neuroendocrine    Neoplasms (CT-pNENs) Indicates a Unique Molecular Signature","Calcitonin-producing pancreatic neuroendocrine neoplasms (CT-pNENs), which can mimic clinical and laboratory features of medullary thyroid carcinoma, are an extremely rare clinical entity with approximately 60 cases reported worldwide. The molecular  profile of CT-pNENs is not yet known. Whole-exome sequencing (WES) was performed on tumor and corresponding serum samples of five patients with","Not Applicable","Insulinoma","Tumor vs. Matched-Normal","Not Provided","WGS","3 phenotype datasets, 15 variables, 10 samples sequenced, 5 subjects, 10 samples","","NCI","GRU --- General Research Use","2023-02-24","2023-02-24","Adenoma, beta Cell; Adenoma, beta-Cell; Adenomas, beta-Cell; Beta cell adenoma; Insulinomas; Insuloma",""
"phs001528.v2.p1","Gene Expression of Small Cell Carcinoma of the Ovary-Hypercalcemic Type    (SCCOHT)","Small cell carcinoma of the ovary-hypercalcemic type (SCCOHT) is a rare and aggressive form of ovarian cancer afflicting young women at a median age of 24 years. SCCOHTs are characterized  by loss of protein expression of SWI/SNF chromatin remodeling ATPases SMARCA4 and SMARCA2 through mutation and epigenetic silencing, respectively.","Not Applicable","Ovarian Neoplasms","Case Set","Not Provided","RNA-Seq","5 phenotype datasets, 23 variables, 9 samples sequenced, 9 subjects, 9 samples","","NCI","HMB --- Health/Medical/Biomedical","2023-02-24","2018-02-22","Neoplasm of Ovary; Neoplasm of the Ovary; Neoplasm of the ovaries; Neoplasm, Ovarian; Neoplasm, Ovary; Neoplasms, Ovarian","NCI's Collection of Datasets for Health, Medical, and Biomedical Research    Purposes (phs003044.v1.p1)"
"phs001273.v4.p2","Oncoarray Consortium - Lung Cancer Studies","The study was conducted under the auspices of the Transdisciplinary Research In Cancer of the Lung (TRICL) Research Team, which is a part of the Genetic Associations and MEchanisms in  ONcology (GAME-ON) consortium, and associated with the International Lung Cancer Consortium (ILCCO). Ethics: All participants provided written","Not Applicable","Lung Neoplasms","Case-Control","OncoArray, imputation_panel","SNP Genotypes (Array), SNP/CNV Genotypes (imputed)","4 phenotype datasets, 20 variables, 1 documents, 6 analyses, 3 molecular datasets, 38721 subjects, 39518 samples","European (32953), African (12), East Asian (3553), African American (960), Hispanic1 (245), Hispanic2 (381), Other Asian or Pacific Islander (430), South Asian (22), Other (165)","NCI","CADM --- Cancer in all age groups, other diseases in adults only, and methods, HMB --- Health/Medical/Biomedical, DS-CA --- Disease-Specific (Cancer), DS-CA-GSO --- Disease-Specific (Cancer, GSO), DS-CA-COL-NPU-MDS --- Disease-Specific (Cancer, COL, NPU, MDS), HMB-MDS-GSO --- Health/Medical/Biomedical (MDS, GSO), CHRONIC --- Chronic Diseases (including Cancer), Methods, EPIMEDCA --- Epidemiological and Medical Research on Cancer, Methods, DS-CALD-PUB-NPU --- Disease-Specific (Cancer or Lung Diseases, PUB, NPU), GRU --- General Research Use, LDS --- Lung Disease and Smoking, GRU-COL --- General Research Use (COL), DS-CA-MDS --- Disease-Specific (Cancer, MDS), LCEDOE --- Lung Cancer, Environmental, Diet, Occupational Exposures, HMB-PUB --- Health/Medical/Biomedical (PUB), DS-CA-PUB-NPU --- Disease-Specific (Cancer, PUB, NPU)","2023-02-24","2023-02-24","Adenocarcinoma; Neoplasms, Squamous Cell; ADNOS; Adenocarcinomas; Adenoma, Malignant; Adenomas, Malignant","NCI's Collection of Datasets for General Research Use (phs003014.v1.p1); NCI's Collection of Datasets for Health, Medical, and Biomedical Research    Purposes (phs003044.v1.p1)"
"phs003090.v1.p1","Advancing Precision Oncology in a Humanized, Fully Autologous Mouse Model","Progress in the early detection and treatment of cancer requires accurate model systems to further evaluate new, promising discoveries. Small animal and, in particular, mouse model systems are attractive to  researchers for numerous reasons, including their ease of use and well-described platforms. The ability to grow human tumors in immune-deficient mice","Not Applicable","Melanoma","Xenograft","Not Provided","RNA-Seq, WXS","4 phenotype datasets, 17 variables, 40 samples sequenced, 4 subjects, 40 samples","","NCI","GRU --- General Research Use","2023-02-14","2023-02-14","Cancer of skin pigment cells; MM - malignant melanoma; Malignant Melanoma; Malignant Melanomas; Melanoma, Malignant; Melanomas",""
"phs003094.v1.p1","Urothelial Cancer - Genomic Analysis to Improve Patient Outcomes and    Research (UC-GENOME): a Bladder Cancer Advocacy Network (BCAN)-Led    Collaborative Research Pilot Study - for Samples Collected at Johns    Hopkins","UC-GENOME is a real-world cohort of patients with metastatic urothelial carcinoma (UC). The study consisted of two co-equal aims: 1) to provide targeted DNA sequencing for clinical decision making at  no cost to patients; and 2) to create a resource for collaborative translational science including a clinically annotated biobank. The submitted data","Not Applicable","Urinary Bladder Neoplasms","Prospective Longitudinal Cohort","Not Provided","RNA-Seq, Targeted-Capture","4 phenotype datasets, 13 variables, 14 samples sequenced, 8 subjects, 14 samples","","NCI","DS-TCC-IRB-NPU --- Disease-Specific (transitional cell carcinoma, IRB, NPU)","2023-02-09","2023-02-09","Bladder Cancer; Cancer of Urinary Tract; Bladder Cancers; Cancer of Bladder; Cancer of the Bladder; Cancer, Bladder",""
"phs003059.v1.p1","Metastatic Colorectal Adenocarcinoma Tumor Purity Assessment from Whole    Exome Sequencing Data","As molecular medicine wields greater and greater influence on cancer patient care, including therapeutic selection, it becomes increasingly important to understand the power and deficiencies of computational tools used in  decision making processes. Here we use a set of unselected metastatic colorectal tumor samples in a head-to-head comparison between the calculation","Not Applicable","Colorectal Neoplasms","Case Set","Not Provided","WXS","3 phenotype datasets, 11 variables, 30 samples sequenced, 18 subjects, 30 samples","","NCI","GRU --- General Research Use","2023-02-08","2023-02-08","Neoplasm Metastases; CRC; Cancer of Large Bowel; Cancer of Large Intestine; Cancer of the Large Bowel; Cancer of the Large Intestine","dbGaP Collection: Compilation of Individual-Level Genomic Data for    General Research Use (phs000688.v1.p1)"
"phs001904.v1.p1","Genomic Characterization CS-MATCH-0007 Arm Y","The CS-MATCH-0007 protocol is a collaboration between the Center for Cancer Genomics (CCG) and the Division of Cancer Treatment and Diagnosis (DCTD) to perform whole-exome sequencing and RNA sequencing using  pre-and post-treatment tumor biopsy specimens from all patients enrolled on a treatment arm of the NCI-MATCH Clinical Trial (EAY131). The goal of","Not Applicable","Neoplasms","Clinical Trial","Not Provided","Not Provided","3 phenotype datasets, 380 variables,  SRA, 31 subjects, 31 samples","","NCI","GRU-COL --- General Research Use (COL)","2023-02-07","2023-02-07","Blastoma; CA; CA - Cancer; Cancer; MT; Malignancies",""
"phs003154.v1.p1","An Advanced Molecular Medicine Case Report of a Rare Human Tumor Using    Genomics, Pathomics, and Radiomics","The associated data of this study is derived from a single female patient with pulmonary sclerosing pneumocytoma (PSP). The aim of this study is to provide the most comprehensive, multi-modality  sequencing study of a single case of PSP to-date. To this end, the following sequencing experiments were performed: i) RNA-Seq of the primary tumor","Not Applicable","Pulmonary Sclerosing Hemangioma","Case-Control","Not Provided","RNA-Seq, Targeted-Capture, WGS","3 phenotype datasets, 15 variables, 16 samples sequenced, 1 subjects, 16 samples","","NCI","GRU-PUB --- General Research Use (PUB)","2023-02-06","2023-02-06","Hemangioma, Sclerosing, Pulmonary; Lung Sclerosing Angioma; Lung Sclerosing Hemangioma; Lung Sclerosing Hemangiomas; Pneumocytoma; Pulmonary Sclerosing Hemangiomas",""
"phs003042.v1.p1","Novel Strategies to Eliminate Resistance to B-cell Receptor Inhibitor    Therapy in Lymphoid Malignancies","Ibrutinib and acalabrutinib are BTK inhibitors (BTKi) used as frontline therapies for chronic lymphocytic leukemia (CLL). Clonal evolution during ibrutinib treatment has previously been studied, but limited study of clonal  evolution in patients receiving acalabrutinib has been done. Our group analyzed 216 blood samples from 38 CLL patients at multiple time points during","Not Applicable","Clonal Evolution","Case Set","Not Provided","WXS","4 phenotype datasets, 25 variables, 216 samples sequenced, 38 subjects, 216 samples","","NCI","GRU --- General Research Use","2023-02-06","2023-02-06","Evolution, Clonal; B Cell CLL; B Cell Chronic Lymphocytic Leukemia; B Cell Leukemia, Chronic; B Cell Lymphocytic Leukemia; B Cell Malignancy, Low Grade","dbGaP Collection: Compilation of Individual-Level Genomic Data for    General Research Use (phs000688.v1.p1)"
"phs002822.v1.p1","SU2C-MARK Lung Cancer Consortium - Checkpoint Blockade Response Project","Immune checkpoint inhibitors have become a critical part of the armamentarium against advanced Non-Small Cell Lung Cancer (NSCLC). While early studies have identified Tumor Mutation Burden (TMB) and PD-L1 staining  as important biomarkers of response, they remain imperfect predictors. Here we describe a multi-institutional effort as part of the SU2C-MARK Lung","Not Applicable","Carcinoma, Non-Small-Cell Lung","Collection","WES_markerset_grc38","MAF (NGS), Targeted-Capture","4 phenotype datasets, 46 variables, 1 molecular datasets, 463 samples sequenced, 230 subjects, 463 samples","","NCI","DS-CATHLU-MDS --- Disease-Specific (Cancer -Thoracic and Lung, MDS), HMB-MDS --- Health/Medical/Biomedical (MDS), GRU --- General Research Use","2023-02-02","2023-02-02","Adenocarcinoma; Large Cell Carcinoma; ADNOS; Adenocarcinomas; Adenoma, Malignant; Adenomas, Malignant",""
"phs003100.v1.p1","Whole-Genome Sequencing Analysis of Extrachromosomal DNA with Amplicon    Architect","The study is related to our manuscript entitled ""Single-cell genetic heterogeneity linked to immune infiltration in glioblastoma"". Using multiplexed FISH analysis of 3-4 tumor cores from 17 glioblastoma formalin-fixed paraffin-embedded  (FFPE) tumors, we identified two classes of tumors based on single cell co-occurrence of EGFR and CDK4 amplification. Tumors with a low odds ratio","Not Applicable","Glioblastoma","Case Set","Not Provided","WGS","4 phenotype datasets, 27 variables, 6 samples sequenced, 6 subjects, 6 samples","","NCI","GRU --- General Research Use","2023-01-31","2023-01-31","Astrocytoma, Grade IV; Astrocytomas, Grade IV; GBM; GBM (glioblastoma); Giant cell glioblastoma (histologic variant); Glioblastoma multiforme",""
"phs003085.v1.p1","RNA-Sequencing of B-Lymphoblastic Leukemia with Glucocorticoids and PI3K    Delta Inhibition","Mononuclear cells were isolated from bone marrow or peripheral blood of 7 pediatric subjects with B-lymphoblastic leukemia at the time of diagnosis. To determine the effect of PI3K delta inhibition  on glucocorticoid-induced gene regulation, B-lymphoblastic leukemia cells were treated with glucocorticoids +/- the PI3K delta inhibitor, idelalisib,","Not Applicable","Precursor B-Cell Lymphoblastic Leukemia-Lymphoma","Case Set","RNAseq_gene_transcripts","RNA-Seq, RNA Seq (NGS)","4 phenotype datasets, 20 variables, 1 molecular datasets, 65 samples sequenced, 7 subjects, 65 samples","","NCI","GRU --- General Research Use","2023-01-31","2023-01-31","Leukemia, Pre B Cell; Leukemia, Pre-B-Cell; Leukemias, Pre-B-Cell; Pre B ALL; Pre B Cell Leukemia; Pre B-ALL",""
"phs003159.v1.p1","Targeted Long-Read Sequencing of the Ewing Sarcoma 6p25.1 Susceptibility    Locus","Ewing Sarcoma (EwS) is rare but the second most common cancer in children, adolescents and young adults. Recent studies suggest germline variation in or around GGAA microsatellites may interact with  fusion oncoprotein binding causing changes in binding affinity and potentially impacting enhancer activity on nearby target genes. This study aims to","Not Applicable","Sarcoma, Ewing","Case-Control","Not Provided","AMPLICON","4 phenotype datasets, 13 variables, 462 samples sequenced, 231 subjects, 462 samples","","NCI","DS-ES --- Disease-Specific (Ewing's Sarcoma)","2023-01-27","2023-01-27","ES; Ewing Sarcoma; Ewing Tumor; Ewing tumour; Ewing's Sarcoma; Ewing's Tumor",""
