"phs001639.v1.p1","NGS","This study phs001639 NGS contains molecular data and phenotype of subjects available from the phs001639 study. Summary level phenotypes for the NCI Biospecimen PV cohort study participants can be viewed  at the top-level study page phs001304 Biospecimen PV cohort. Individual level phenotype data and molecular data for all Biospecimen PV cohort","National Cancer Institute (NCI) Biospecimen Pre-analytical Variables (BPV) Analysis (phs001304.v1.p1)","Carcinoma, Renal Cell","Case Set","Not Provided","RNA-Seq, WXS, miRNA-Seq, RNA-Seq, WXS, miRNA-Seq","1 phenotype datasets, 129 variables, 341 samples sequenced,  SRA, 35 subjects, 341 samples","","NCI","GRU-PUB --- General Research Use (PUB)","2018-10-12","2018-10-12","Fallopian Tube Neoplasms; ADENOCARCINOMA OF LUNG; Adenocarcinoma of lung, somatic; Adenocarcinoma of the Lung; Adenocarcinoma, Lung; Adenocarcinomas, Lung",""
"phs001638.v1.p1","mRNA_TaqMan","This study phs001638 mRNA TaqMan contains molecular data and phenotype of subjects available from the phs001638 study. Summary level phenotypes for the NCI Biospecimen PV cohort study participants can be  viewed at the top-level study page phs001304 Biospecimen PV cohort. Individual level phenotype data and molecular data for all Biospecimen PV cohort","National Cancer Institute (NCI) Biospecimen Pre-analytical Variables (BPV) Analysis (phs001304.v1.p1)","Carcinoma, Renal Cell","Case Set","SNP-PCR","Legacy Genotypes, Legacy Genotypes","1 phenotype datasets, 124 variables, 1 molecular datasets,  SRA, 20 subjects, 100 samples","","NCI","GRU-PUB --- General Research Use (PUB)","2018-10-12","2018-10-12","Fallopian Tube Neoplasms; ADENOCARCINOMA OF LUNG; Adenocarcinoma of lung, somatic; Adenocarcinoma of the Lung; Adenocarcinoma, Lung; Adenocarcinomas, Lung",""
"phs001637.v1.p1","GlobalMetaboliteProfiling","This study phs001637 Global Metabolite Profiling contains molecular data and phenotype of subjects available from the phs001637 study. Summary level phenotypes for the NCI Biospecimen PV cohort study participants can  be viewed at the top-level study page phs001304 Biospecimen PV cohort. Individual level phenotype data and molecular data for all Biospecimen PV","National Cancer Institute (NCI) Biospecimen Pre-analytical Variables (BPV) Analysis (phs001304.v1.p1)","Carcinoma, Renal Cell","Case Set","custom_markerset","Legacy Genotypes, Legacy Genotypes","1 phenotype datasets, 49 variables, 1 molecular datasets,  SRA, 40 subjects, 240 samples","","NCI","GRU-PUB --- General Research Use (PUB)","2018-10-12","2018-10-12","Fallopian Tube Neoplasms; ADENOCARCINOMA OF LUNG; Adenocarcinoma of lung, somatic; Adenocarcinoma of the Lung; Adenocarcinoma, Lung; Adenocarcinomas, Lung",""
"phs001636.v1.p1","FixationDelay","This study phs001636 Fixation Delay contains molecular data and phenotype of subjects available from the phs001636 study. Summary level phenotypes for the NCI Biospecimen PV cohort study participants can be  viewed at the top-level study page phs001304 Biospecimen PV cohort. Individual level phenotype data and molecular data for all Biospecimen PV cohort","National Cancer Institute (NCI) Biospecimen Pre-analytical Variables (BPV) Analysis (phs001304.v1.p1)","Carcinoma, Renal Cell","Case Set","custom_markerset","Legacy Genotypes, Legacy Genotypes","1 phenotype datasets, 116 variables, 1 molecular datasets,  SRA, 20 subjects, 95 samples","","NCI","GRU-PUB --- General Research Use (PUB)","2018-10-12","2018-10-12","Fallopian Tube Neoplasms; ADENOCARCINOMA OF LUNG; Adenocarcinoma of lung, somatic; Adenocarcinoma of the Lung; Adenocarcinoma, Lung; Adenocarcinomas, Lung",""
"phs001635.v1.p1","CNV_aCGH","This study phs001635 CNV aCGH contains molecular data and phenotype of subjects available from the phs001635 study. Summary level phenotypes for the NCI Biospecimen PV cohort study participants can be  viewed at the top-level study page phs001304 Biospecimen PV cohort. Individual level phenotype data and molecular data for all Biospecimen PV cohort","National Cancer Institute (NCI) Biospecimen Pre-analytical Variables (BPV) Analysis (phs001304.v1.p1)","Carcinoma, Renal Cell","Case Set","Cytogenetic_Arrays","Legacy Genotypes, Legacy Genotypes","1 phenotype datasets, 168 variables, 1 molecular datasets,  SRA, 38 subjects, 229 samples","","NCI","GRU-PUB --- General Research Use (PUB)","2018-10-12","2018-10-12","Fallopian Tube Neoplasms; ADENOCARCINOMA OF LUNG; Adenocarcinoma of lung, somatic; Adenocarcinoma of the Lung; Adenocarcinoma, Lung; Adenocarcinomas, Lung",""
"phs001634.v1.p1","CIT_mRNA","This study phs001634 CIT mRNA contains molecular data and phenotype of subjects available from the phs001634 study. Summary level phenotypes for the NCI Biospecimen PV cohort study participants can be  viewed at the top-level study page phs001304 Biospecimen PV study. Individual level phenotype data and molecular data for all Biospecimen PV cohort","National Cancer Institute (NCI) Biospecimen Pre-analytical Variables (BPV) Analysis (phs001304.v1.p1)","Carcinoma, Renal Cell","Case Set","SNP-PCR","Legacy Genotypes, Legacy Genotypes","1 phenotype datasets, 131 variables, 1 molecular datasets,  SRA, 40 subjects, 209 samples","","NCI","GRU-PUB --- General Research Use (PUB)","2018-10-12","2018-10-12","Fallopian Tube Neoplasms; ADENOCARCINOMA OF LUNG; Adenocarcinoma of lung, somatic; Adenocarcinoma of the Lung; Adenocarcinoma, Lung; Adenocarcinomas, Lung",""
"phs001572.v1.p1","Pan-Tumor Genomic Biomarkers for PD-1 Based Immunotherapy","Tumor mutation burden (TMB) and a T-cell-inflamed gene expression profile (GEP) independently predict clinical outcome in pembrolizumab-treated patients in 22 indications and stratify distinct targets of resistance biology. TMB was  evaluated by whole exome sequencing (WES) of germline and tumor DNA from formalin-fixed paraffin-embedded (FFPE) pre-treatment samples in multiple","Not Applicable","Neoplasms","Case Set","Not Provided","WXS","4 phenotype datasets, 15 variables, 624 samples sequenced,  SRA, 312 subjects, 624 samples","","NCI","DS-CA-IRB --- Disease-Specific (Cancer, IRB)","2018-10-11","2018-10-11","Blastoma; CA; CA - Cancer; Cancer; MT; Malignancies",""
"phs001527.v1.p1","Oral Microbiome in Esophageal Adenocarcinoma","The purpose of our study was to assess the influence of oral microbiota on the development of esophageal cancer. Our preliminary case-control studies reported a global alteration of foregut microbiome  in esophageal adenocarcinoma with the strongest changes found in the oral microbiome. We hypothesise that commensal oral bacteria are capable of","Not Applicable","Esophageal Neoplasms","Case-Control","Not Provided","WGS","4 phenotype datasets, 18 variables, 219 samples sequenced,  SRA, 219 subjects, 219 samples","","NCI","HMB-IRB-PUB-COL --- Health/Medical/Biomedical (IRB, PUB, COL)","2018-09-28","2018-09-28","Esophageal Neoplasms, Benign and Malignant; Esophageal Tumor; Esophageal Tumors; Esophageal neoplasm; Esophageal tumour; Esophagus Neoplasm",""
"phs001643.v1.p1","Chordoma Genomics","In this study, we performed paired tumor/normal whole exome and shallow long insert whole genome sequencing, as well as tumor RNAseq, from archival chordoma specimens collected from four patients at  the Barrow Neurological Institute in Phoenix, AZ. The purpose of this analysis was to identify potential therapeutic targets. In three patients, we","Not Applicable","Chordoma","Case Set","Not Provided","RNA-Seq, WGS, WXS","4 phenotype datasets, 15 variables, 8 samples sequenced,  SRA, 4 subjects, 8 samples","","NCI","HMB-PUB --- Health/Medical/Biomedical (PUB)","2018-09-25","2018-09-25","CHDM; Chordomas; Notochordal sarcoma; chordoma (disease); chordoma, malignant; chordoma, susceptibility to",""
"phs001006.v1.p1","Intra-Lesion Heterogeneity and Clonality of Lobular Carcinomas In Situ","This study comprises prospectively accrued, microdissected fresh frozen samples of multifocal lobular carcinoma in situ (LCIS), ductal carcinoma in situ (DCIS), invasive lobular carcinoma and invasive ductal carcinoma from patients  undergoing prophylactic or therapeutic mastectomies after a diagnosis on LCIS diagnosed and managed at Memorial Sloan Kettering Cancer Center","Not Applicable","Carcinoma, Lobular","Collection","Not Provided","WXS","4 phenotype datasets, 26 variables, 94 samples sequenced,  SRA, 24 subjects, 94 samples","","NCI","GRU --- General Research Use","2018-09-13","2018-09-13","Carcinoma in Situ; Cancer in situ; Carcinoma, Intraepithelial; Carcinoma, Preinvasive; Intraepithelial Carcinoma; Non-invasive Carcinoma","NCI's Collection of Datasets for General Research Use (phs003014.v1.p1)"
"phs001577.v1.p1","Structural Alterations in Castration-Resistant Prostate Cancer","Adapted from manuscript in review: Nearly all prostate cancer deaths are from metastatic castration-resistant prostate cancer (mCRPC) but there have been few whole genome sequencing (WGS) studies of this disease  state. We performed linked-read WGS on 23 mCRPC biopsy specimens and analyzed cell-free DNA sequencing data from 86 patients with mCRPC. In addition","Not Applicable","Prostatic Neoplasms, Castration-Resistant","Prospective Longitudinal Cohort","Not Provided","WGS","4 phenotype datasets, 11 variables, 2 samples sequenced,  SRA, 20 subjects, 43 samples","","NCI","DS-MDS --- Disease-Specific (Cancer, MDS), DS-PC-MDS --- Disease-Specific (Prostate Cancer, MDS)","2018-09-12","2018-09-12","NGP - New growth of prostate; Neoplasm of Prostate; Neoplasm of the Prostate; Neoplasm, Prostate; Neoplasm, Prostatic; Neoplasms, Prostate",""
"phs001481.v1.p1","Inherited Bone Marrow Failure Syndromes Study","Background: A prospective cohort of Inherited Bone Marrow Failure Syndrome (IBMFS) will provide new information regarding cancer rates and types in these disorders. Mutations in IBMFS genes are relevant to  carcinogenesis in sporadic cancers. Patients with IBMFS who develop cancer differ in their genetic and/or environmental features from patients with","Not Applicable","Bone Marrow Failure Disorders","Prospective Longitudinal Cohort","Not Provided","WXS","5 phenotype datasets, 19 variables, 456 samples sequenced, 456 subjects, 456 samples","","NCI","GRU --- General Research Use","2018-09-06","2018-09-06","Bone Marrow Failure Syndromes; Dyskeratosis Congenita; Anemia, Fanconi; Anemia, Fanconi's; Anemias, Fanconi; FA","dbGaP Collection: Compilation of Individual-Level Genomic Data for    General Research Use (phs000688.v1.p1); NCI's Collection of Datasets for General Research Use (phs003014.v1.p1)"
"phs001549.v1.p1","Genome-Wide Association Study and Meta-Analysis of Ewing Sarcoma","We combined a set of 122 French Ewing sarcoma (EWS) cases from the Institut Curie, 19 EWS cases from the National Cancer Institute (NCI) Center for Cancer Research (CCR), and  29 EWS cases from the NCI Bone Disease and Injury Study. All EWS cases were confirmed by medical record review and the presence of a specific","Not Applicable","Sarcoma, Ewing","Case-Control","imputation_panel, HumanOmniExpress-12","SNP Genotypes (Array), SNP Genotypes (imputed)","4 phenotype datasets, 13 variables, 2 molecular datasets, 170 subjects, 170 samples","","NCI","DS-BONE --- Disease-Specific (Bone Cancers), DS-ES --- Disease-Specific (Ewing's Sarcoma), GRU --- General Research Use","2018-08-31","2018-08-31","ES; Ewing Sarcoma; Ewing Tumor; Ewing tumour; Ewing's Sarcoma; Ewing's Tumor",""
"phs001247.v1.p1","GMKF: Kids First Pediatric Research Program on Congenital Cranial    Dysinnervation Disorders and Related Birth Defects","Goals of this ongoing study are to identify novel ""congenital cranial dysinnervation disorder"" (CCDD) genes and define the role of the wildtype and mutant genes in normal and aberrant development.  The umbrella term (CCDD) refers to congenital birth defects with malformation of one or more cranial nerves, typically resulting in limitations of","Not Applicable","Cranial Nerve Diseases","Family/Twin/Trios","WGS_markerset_grc37","SNP/CNV Genotypes (NGS), WGS","6 phenotype datasets, 41 variables, 1 molecular datasets, 899 samples sequenced,  SRA, 899 subjects, 899 samples","","NCI","DS-EMD --- Disease-Specific (Eye Movement Disorders), DS-ELMD --- Disease-Specific (Eye and Lid Movement Disorders), DS-CCDD-RD --- Disease-Specific (Congenital Cranial Dysinnervation Disorders, RD)","2018-08-24","2018-08-24","Abducens Nerve Diseases; Facial Nerve Diseases; Oculomotor Nerve Diseases; Trochlear Nerve Diseases; Abducens Nerve Disease; Abducens nerve weakness",""
"phs001618.v1.p1","Dormant TILs and Sensitivity to Immune Checkpoint Blockers in Lung Cancer","The biological determinants of sensitivity and resistance to immune checkpoint inhibitors are not completely understood. To elucidate the role of intratumoral T-cells and its association with the tumor genomic landscape,  we perform paired whole exome DNA sequencing and multiplexed quantitative immunofluorescence (QIF) in pre-treatment samples from non-small cell lung","Not Applicable","Neoplasms","Prospective Longitudinal Cohort","WES_markerset_grc37","SNP Genotypes (NGS), WXS","4 phenotype datasets, 20 variables, 1 molecular datasets, 84 samples sequenced,  SRA, 49 subjects, 84 samples","","NCI","GRU --- General Research Use, DS-LCTC-MDS --- Disease-Specific (Lung Cancer and Thoracic Malignancies, MDS)","2018-08-03","2018-08-03","Carcinoma, Non Small Cell Lung; Carcinoma, Non-Small Cell Lung; Carcinoma, Non-Small-Cell Lung; Carcinomas, Non-Small-Cell Lung; Lung Carcinoma, Non-Small-Cell; Lung Carcinomas, Non-Small-Cell","dbGaP Collection: Compilation of Individual-Level Genomic Data for    General Research Use (phs000688.v1.p1); NCI's Collection of Datasets for General Research Use (phs003014.v1.p1)"
"phs001513.v1.p1","Mechanisms of Chemotherapy Resistance in T-ALL","The goals of this study are to unravel the molecular mechanisms underlying leukemic transformation and chemotherapy resistance in T-cell acute lymphoblastic leukemia (T-ALL). Towards this end, a cohort of T-ALL  lymphoblast specimens was collected at the time of initial T-ALL diagnosis (prior to the start of therapy) from children enrolled on contemporary","Not Applicable","Precursor T-Cell Lymphoblastic Leukemia-Lymphoma","Prospective Longitudinal Cohort","Not Provided","RNA-Seq, Targeted-Capture","4 phenotype datasets, 17 variables, 109 samples sequenced,  SRA, 109 subjects, 109 samples","","NCI","DS-LEU --- Disease-Specific (Leukemia)","2018-08-02","2018-08-02","Acute T Cell Leukemia; Acute T Cell Lymphoblastic Leukemia; Acute T-Cell Leukemia; Acute T-Cell Leukemias; Acute T-Cell Lymphoblastic Leukemia; Acute T-Lymphocytic Leukemia",""
"phs001566.v1.p1","Mutations in Breast Cancer Patient with Neurofibromatosis","Targeted genetic sequencing was performed on a 41-year-old female with metaplastic breast cancer (MBC) and neurofibromatosis type I (NF1). A custom panel capturing 279 cancer related genes was used to  identify a germline pathogenic SNV in NF1, as well several other somatic alterations. Single case report Related Genes: NF1 Principal Investigator:","Not Applicable","Neurofibromatosis 1","Case Set","target_markerset_grc37","SNP Genotypes (NGS)","4 phenotype datasets, 24 variables, 1 molecular datasets, 1 subjects, 2 samples","","NCI","GRU --- General Research Use","2018-07-25","2018-07-25","Breast Cancer; Breast Malignant Neoplasm; Breast Malignant Neoplasms; Breast Malignant Tumor; Breast Malignant Tumors; CA - Breast cancer",""
"phs001565.v1.p1","Pre-treatment Molecular Characterizations of Tumors from Patients Who    Receive Immune Checkpoint Therapies","Immune checkpoint inhibitors yield clinical benefit in many cancer types, but molecular predictors of response have not yet been robustly characterized. In this study, we pursued whole exome sequencing (WES)  of pre-treatment tumors from patients treated with immune checkpoint therapies - including monoclonal antibodies targeting programmed cell death-1","Not Applicable","Neoplasms","Case Set","Not Provided","WXS","4 phenotype datasets, 14 variables, 142 samples sequenced, 71 subjects, 142 samples","","NCI","DS-CA-MDS --- Disease-Specific (Cancer, MDS), DS-BLADDERCA-MDS --- Disease-Specific (Bladder Cancer, MDS), DS-CATHLU-MDS --- Disease-Specific (Cancer -Thoracic and Lung, MDS), GRU --- General Research Use","2018-07-03","2018-07-03","Carcinoma, Transitional Cell; Lung Neoplasms; Urinary Bladder Neoplasms; Epidermoid Carcinoma of Hypopharynx; Epidermoid Carcinoma of the Hypopharynx; Hypopharyngeal Conventional Squamous Cell Carcinoma",""
"phs001381.v1.p1","Gut Microbiome and Types of Colorectal Polyps","Colorectal cancer is a heterogeneous disease arising from at least two precursors-the conventional adenoma and the serrated polyp. This dataset was used to test the relationship of the gut microbiota  to specific colorectal polyp types. We included samples from two independent study populations based at colonoscopy clinics: the Centers for Disease","Not Applicable","Colonic Polyps","Cross-Sectional","Not Provided","AMPLICON","4 phenotype datasets, 43 variables, 667 samples sequenced, 667 subjects, 667 samples","","NCI","GRU --- General Research Use","2018-06-15","2018-06-15","Adenomatous Polyps","NCI's Collection of Datasets for General Research Use (phs003014.v1.p1)"
"phs001399.v1.p1","Development of Precision Neoadjuvant-Adjuvant Therapies","In clinical trials assessing neoadjuvant androgen deprivation therapy plus next-generation androgen receptor axis inhibitors, a subset of patients fail to demonstrate a complete pathologic response following treatment and radical prostatectomy.  We performed exome and transcriptome analyses on laser capture microdissected foci of residual tumor from these patients. Patients with residual","Not Applicable","Prostatic Neoplasms","Case Set","Not Provided","WXS","5 phenotype datasets, 23 variables, 50 samples sequenced,  SRA, 19 subjects, 69 samples","","NCI","DS-CA-NPU --- Disease-Specific (Cancer, NPU)","2018-05-31","2018-05-31","NGP - New growth of prostate; Neoplasm of Prostate; Neoplasm of the Prostate; Neoplasm, Prostate; Neoplasm, Prostatic; Neoplasms, Prostate",""
"phs001315.v1.p1","GECCO: Detecting Common and Rare Genetic Loci and GxE Interactions in    Colorectal Cancer","COLON, Colorectal Cancer: Longitudinal Observational study on Nutritional and lifestyle factors that influence colorectal tumor recurrence, survival and quality of life: The COLON study is a multi-center prospective cohort study  to assess the role of diet and other lifestyle factors in cancer recurrence and survival among incident colorectal cancer patients in the","Not Applicable","Colorectal Neoplasms","Case-Control","HumanOmniExpressExome-8, imputation_panel","SNP Genotypes (Array), SNP Genotypes (imputed)","4 phenotype datasets, 24 variables, 2 molecular datasets, 8725 subjects, 9101 samples","European (8607), African (1), East Asian (17), African American (23), Hispanic1 (11), Hispanic2 (6), Other Asian or Pacific Islander (18), Other (42)","NCI","GRU --- General Research Use, DS-CC-NPU-GSO --- Disease-Specific (Colorectal Cancer, NPU, GSO), DS-CC-PUB-NPU --- Disease-Specific (Colorectal Cancer, PUB, NPU), HMB-PUB --- Health/Medical/Biomedical (PUB)","2018-05-23","2018-05-23","CRC; Cancer of Large Bowel; Cancer of Large Intestine; Cancer of the Large Bowel; Cancer of the Large Intestine; Cancer, Colorectal","NCI's Collection of Datasets for General Research Use (phs003014.v1.p1)"
"phs001396.v1.p1","Genetics of Pigmentation in Eastern and Southern African Populations    Study","The goal of this study was to identify genes and loci associated with pigmentation in African populations. It comprises 1,593 participants from Ethiopia, Tanzania, and Botswana. Sexes are evenly represented  (768 males and 825 females) and self reported ages ranged from 18 to 103. Mean age was used for individuals without ages. For each participant, a DSM","Not Applicable","Skin Pigmentation","Cross-Sectional","HumanOmni2.5-8, WGS_markerset_grc37, Not Provided, WGS_markerset_grc37","SNP Genotypes (Array), SNP Genotypes (NGS), WGS","4 phenotype datasets, 14 variables, 1 molecular datasets, 135 samples sequenced,  SRA, 1573 subjects, 1573 samples","","NCI","GRU-NPU --- General Research Use (NPU)","2018-05-15","2018-05-15","Not Provided",""
"phs001219.v1.p1","Detection of Genes Predisposing to Hematologic Malignancies","We have been conducting genetic studies on families at high risk of different hematologic malignancies, in order to define the related tumors in the families, define precursor and other related  conditions, and map and identify susceptibility genes. We have focused mainly on four types of lymphoid malignancies: chronic lymphocytic leukemia","Not Applicable","Leukemia, Lymphocytic, Chronic, B-Cell","Family/Twin/Trios","Not Provided","WXS","5 phenotype datasets, 26 variables, 475 samples sequenced,  SRA, 475 subjects, 475 samples","","NCI","DS-CA-MDS --- Disease-Specific (Cancer, MDS)","2018-05-10","2018-05-10","Hodgkin Disease; Leukemia, Hairy Cell; Leukemia, Myelomonocytic, Juvenile; Lymphoma, Non-Hodgkin; Waldenstrom Macroglobulinemia; CHL",""
"phs001391.v1.p1","OncoArray: Prostate Cancer","Original description of the study: From ELLIPSE (linked to the PRACTICAL consortium), we contributed 78,000 SNPs to the OncoArray. A large fraction of the content was derived from the GWAS  meta-analyses in European ancestry populations (overall and aggressive disease; 27K SNPs). We also selected just over 10,000 SNPs from the","Not Applicable","Prostatic Neoplasms","Case-Control","OncoArray","SNP Genotypes (Array)","4 phenotype datasets, 15 variables, 1 molecular datasets, 99622 subjects, 99622 samples","European (87794), African (1216), East Asian (390), African American (6686), Hispanic1 (361), Hispanic2 (2309), Other Asian or Pacific Islander (212), South Asian (276), Other (378)","NCI","GRU --- General Research Use, CADM --- Cancer in all age groups, other diseases in adults only, and methods, CHRONIC --- Chronic Diseases (including Cancer), Methods, DS-BCEMOPCA-NPU-MDS --- Disease-Specific (Breast, Colorectal, Endometrial, Melanoma, Ovarian, and/or Prostate Cancer, NPU, MDS), DS-CA --- Disease-Specific (Cancer), DS-CA-MDS-GSO --- Disease-Specific (Cancer, MDS, GSO), DS-CA-NPU --- Disease-Specific (Cancer, NPU), DS-CA-NPU-GSO --- Disease-Specific (Cancer, NPU, GSO), DS-PC-MDS-GSO --- Disease-Specific (Prostate Cancer, MDS, GSO), DS-PCP --- Disease-Specific (Prostate Cancer Predisposition), GRU-IRB --- General Research Use (IRB), DS-PC-PUB-MDS --- Disease-Specific (Prostate Cancer, PUB, MDS), GRU-NPU --- General Research Use (NPU), MHNSI-MDS --- Men's Health and Nutrition in Serious Illnesses (MDS), PC-RITPC --- Prostate Cancer or Radiation-induced Toxicity in Prostate Cancer Patients, HMB-PUB --- Health/Medical/Biomedical (PUB), DS-CA-PUB --- Disease-Specific (Cancer, PUB), DS-CA-MDS --- Disease-Specific (Cancer, MDS), EPIMEDCA --- Epidemiological and Medical Research on Cancer, Methods, DS-PC-MDS --- Disease-Specific (Prostate Cancer, MDS), PC-MDS-NOCTRL --- Prostate Cancer, Methods, Non-control, HMB-NPU --- Health/Medical/Biomedical (NPU), DS-CHDSAD-MDS --- Disease-Specific (Cancer, Heart Disease, Stroke, Alzheimer Disease, and Diabetes, MDS), HMB-PUB-NPU --- Health/Medical/Biomedical (PUB, NPU), DS-PC --- Disease-Specific (Prostate Cancer), HMB --- Health/Medical/Biomedical","2018-03-21","2018-03-21","NGP - New growth of prostate; Neoplasm of Prostate; Neoplasm of the Prostate; Neoplasm, Prostate; Neoplasm, Prostatic; Neoplasms, Prostate","NCI's Collection of Datasets for General Research Use (phs003014.v1.p1); NCI's Collection of Datasets for Health, Medical, and Biomedical Research    Purposes (phs003044.v1.p1)"
"phs001064.v1.p1","Whole Exome Sequencing of Signet Ring/Plasmacytoid Variant Bladder Cancer","In this study, six plasmacytoid bladder cancers were analyzed by whole exome sequencing. The results show loss of the CDH1 gene in every sample and correlate with E-cadherin loss of  expression by immunohistochemistry. A separate validation cohort of plasmacytoid samples showed loss of E-cadherin expression by CDH1 mutation or","Not Applicable","Carcinoma, Signet Ring Cell","Case Set","other","SNV Aggregate (.MAF), WXS","4 phenotype datasets, 15 variables, 1 molecular datasets, 12 samples sequenced,  SRA, 6 subjects, 12 samples","","NCI","DS-BLADDERCA --- Disease-Specific (Bladder Cancer)","2018-03-12","2018-03-12","Urinary Bladder Neoplasms; Signet Ring Cell Adenocarcinoma; Signet Ring Cell Carcinoma; Signet cell adenocarcinoma; Signet ring carcinoma; Signet-Ring Cell Carcinoma",""
"phs001447.v1.p1","Metastatic Castrate-Resistant Prostate Cancer Study (MCRPCS)","We examined genetic resistance to second generation androgen targeting therapies (abiraterone acetate or enzalutamide) by analyzing whole exome sequencing of patient-matched pre-treatment and post-resistance tumors from a series of castrate-resistant  prostate cancer (CRPC) patients. Abiraterone resistant tumors harbored alterations in AR and MYC, whereas patients treated with enzalutamide had","Not Applicable","Prostatic Neoplasms","Prospective Longitudinal Cohort","Not Provided","WXS","4 phenotype datasets, 12 variables, 21 samples sequenced, 7 subjects, 21 samples","","NCI","DS-CA-MDS --- Disease-Specific (Cancer, MDS), DS-PC-MDS --- Disease-Specific (Prostate Cancer, MDS)","2018-03-07","2018-03-07","NGP - New growth of prostate; Neoplasm of Prostate; Neoplasm of the Prostate; Neoplasm, Prostate; Neoplasm, Prostatic; Neoplasms, Prostate",""
