"phs002313.v1.p1","Copy-Number Analysis of Understudied Black Women Ovarian Cancers","Two general types of genetic alterations drive cancer progression: mutations and copy number alterations (CNAs). With the exception of p53, single nucleotide variant mutations (here, simply ""mutations"") are not drivers  of 80% of tumors within the most frequent and deadly histotype of ovarian cancer: serous ovarian cancer (SOC). Rather, CNAs are more prevalent in SOC","Not Applicable","Neoplasms","Case Set","WGS_markerset_grc37","CNV Genotypes, WXS","4 phenotype datasets, 18 variables, 1 molecular datasets, 21 samples sequenced, 20 subjects, 21 samples","","NCI","GRU --- General Research Use","2021-03-23","2021-03-23","Blastoma; CA; CA - Cancer; Cancer; MT; Malignancies","NCI's Collection of Datasets for General Research Use (phs003014.v1.p1)"
"phs002089.v1.p1","Dynamics of Genomic and Immune Responses During Primary Immunotherapy    Resistance in Mismatch Repair Deficient Tumors","We study a patient with dMMR lung cancer refractory to immunotherapy. Post-treatment tumor demonstrated compound heterozygous frameshift deletions located upstream of the kinase domain in the gene encoding JAK1 protein,  downregulation of JAK1 and mediators of its signal transduction, and total loss of JAK1 phosphorylation. Importantly, one of the JAK1 mutations,","Not Applicable","Small Cell Lung Carcinoma","Case Set","Not Provided","RNA-Seq, WGS, WXS","4 phenotype datasets, 16 variables, 6 samples sequenced, 1 subjects, 6 samples","","NCI","GRU --- General Research Use","2021-03-23","2021-03-23","Turcot syndrome; Carcinoma, Small Cell Lung; Lung Small Cell Neuroendocrine Carcinoma; Lung oat cell carcinoma; Oat Cell Carcinoma of Lung; Oat Cell Lung Cancer","NCI's Collection of Datasets for General Research Use (phs003014.v1.p1)"
"phs002273.v1.p1","Analysis of Recurrently Protected Genomic Regions in Urine Cell-Free DNA","This study investigated fragmentation patterns in urine and plasma cell-free DNA and evaluated the relevance of such analysis for cancer diagnostics using urine samples. Specifically, we performed whole-genome sequencing at  variable depths and evaluated genome-wide coverage in urine and plasma samples, relative to known genome annotation features. Tumor/germline exome","Not Applicable","Cell-Free Nucleic Acids","Methods","Not Provided","WGS, WXS","3 phenotype datasets, 13 variables, 89 samples sequenced, 60 subjects, 89 samples","","NCI","HMB-PUB-MDS --- Health/Medical/Biomedical (PUB, MDS)","2021-03-22","2021-03-22","Not Provided",""
"phs001264.v1.p1","A Super-Enhancer Associated with CD47 in Breast Cancer","CD47 is a cell surface molecule that inhibits phagocytosis of cells that express it by binding to its receptor, SIRP&#x003b1;, on macrophages and other immune cells. CD47 is expressed at  different levels in normal cells, however, in cancer cells, CD47 transcript and protein expression is aberrantly increased. Here we sought to uncover","Not Applicable","Breast Neoplasms","Xenograft","Not Provided","ChIP-Seq","4 phenotype datasets, 24 variables, 4 samples sequenced,  SRA, 4 subjects, 4 samples","","NCI","GRU --- General Research Use, DS-BRCA-MDS --- Disease-Specific (Breast Cancer, MDS)","2021-03-17","2021-03-17","Breast Cancer; Breast Malignant Neoplasm; Breast Malignant Neoplasms; Breast Malignant Tumor; Breast Malignant Tumors; CA - Breast cancer","NCI's Collection of Datasets for General Research Use (phs003014.v1.p1)"
"phs001374.v2.p1","VA APOLLO Project - Research for Precision Oncology (RePOP)","The Research for Precision Oncology Program (RePOP) is a research activity that establishes a cohort of Veterans diagnosed with cancer and who have had genomic analyses performed on their tumor  tissue as part of standard of care. All data relevant to a patient's cancer and cancer care will be collected under RePOP, including patient","Not Applicable","Neoplasms","Prospective Longitudinal Cohort","Not Provided","Not Provided","2 phenotype datasets, 4 variables,  SRA, 170 subjects, 170 samples","","NCI","GRU --- General Research Use","2021-03-15","2018-08-22","Blastoma; CA; CA - Cancer; Cancer; MT; Malignancies","NCI's Collection of Datasets for General Research Use (phs003014.v1.p1)"
"phs002295.v1.p1","Cross-site Concordance Evaluation of Tumor DNA and RNA Sequencing    Platforms of CIMAC-CIDC Network","The Cancer Immune Monitoring and Analysis Centers (CIMACs) and the Cancer Immunologic Data Commons (CIDC)&#x000a0; has engaged in efforts to harmonize Whole-exome (WES) and RNA-sequencing (RNA-seq) data from three different  experimental platforms (MD Anderson, NCI MoCha lab, and Broad Institute) and are using a series of developed pipelines to process the early trial","Not Applicable","Carcinoma, Non-Small-Cell Lung","Case Set","WES_markerset_grc38, RNAseq_probe_set_grc38","SNV (.MAF), RNA Seq (NGS)","3 phenotype datasets, 12 variables, 2 molecular datasets, 8 subjects, 234 samples","","NCI","GRU --- General Research Use","2021-03-11","2021-03-11","Carcinoma, Non Small Cell Lung; Carcinoma, Non-Small Cell Lung; Carcinomas, Non-Small-Cell Lung; Lung Carcinoma, Non-Small-Cell; Lung Carcinomas, Non-Small-Cell; NONSMALL CELL LUNG CANCER","dbGaP Collection: Compilation of Individual-Level Genomic Data for    General Research Use (phs000688.v1.p1); NCI's Collection of Datasets for General Research Use (phs003014.v1.p1)"
"phs002252.v1.p1","Cellular and Molecular Characterization of Renal Cell Carcinoma","We are performing a comprehensive cellular and molecular characterization of renal cell carcinoma. This work includes an initial cohort of patients whose tumors (and adjacent normal tissue) underwent single cell  analysis. Single-cell RNA sequencing (scRNA-seq) and TCR sequencing (scTCR-seq) analysis of untreated clear cell renal cell carcinoma tumor and","Not Applicable","Carcinoma, Renal Cell","Tumor vs. Matched-Normal","Not Provided","OTHER, WXS","4 phenotype datasets, 21 variables, 52 samples sequenced, 13 subjects, 53 samples","","NCI","DS-RCCA-MDS --- Disease-Specific (Renal Cell Carcinoma, MDS)","2021-03-11","2021-03-11","Kidney Neoplasms; ADENOCARCINOMA OF KIDNEY; Adenocarcinoma Of Kidneys; Adenocarcinoma of the Kidney; Adenocarcinoma, Renal; Adenocarcinoma, Renal Cell",""
"phs002342.v1.p1","Optimized Polyepitope Neoantigen DNA Vaccines Elicit Neoantigen-Specific    Immune Responses in Preclinical Models and in Clinical Translation","A patient with Lynch syndrome and a neuroendocrine tumor sequenced with exome, whole genome, and bulk RNAseq. Sequence data was used to create a personalized cancer vaccine. Principal Investigator: William  Gillanders, MD, Washington University School of Medicine, St Louis, MO, USA","Not Applicable","Carcinoma, Neuroendocrine","Tumor vs. Matched-Normal","Not Provided","RNA-Seq, WGS, WXS","4 phenotype datasets, 16 variables, 5 samples sequenced, 1 subjects, 5 samples","","NCI","GRU --- General Research Use","2021-03-09","2021-03-09","","dbGaP Collection: Compilation of Individual-Level Genomic Data for    General Research Use (phs000688.v1.p1); NCI's Collection of Datasets for General Research Use (phs003014.v1.p1)"
"phs002335.v1.p1","Dana-Farber Cancer Institute (DFCI) Wu Lab/Avicenne CLL RNA-Seq Study","Chronic Lymphocytic Leukemia (CLL) is a hematological malignancy characterized by accumulation of CD5+ B cells in peripheral lymphoid organs, bone marrow and blood. Recently, the advent of large-scale whole-exome sequencing  of hundreds of CLL samples has led to gain a comprehensive understanding of the mutational landscape of this clonal B cell malignancy, but the","Not Applicable","Leukemia","Case Set","Not Provided","RNA-Seq","4 phenotype datasets, 15 variables, 14 samples sequenced, 12 subjects, 14 samples","","NCI","HMB-NPU-MDS --- Health/Medical/Biomedical (NPU, MDS)","2021-03-09","2021-03-09","Blood (Leukemia); Blood cancer; Leucocythaemia; Leucocythaemias; Leucocythemia; Leucocythemias",""
"phs002334.v1.p1","Genetic Determinants of EGFR-Driven Lung Cancer Growth and Therapeutic    Response In Vivo","Oncogenic alterations in EGFR frequently co-occur with additional genetic alterations in EGFR-driven lung adenocarcinoma (LUAD), but how specific combinations of mutations affect tumor phenotypes and responses to targeted therapy is  yet unknown. We leveraged a genetically engineered mouse model of EGFR mutant/Trp53-deficient LUAD to study the consequences of inactivating 10","Not Applicable","Adenocarcinoma of Lung","Collection","Not Provided","WXS","4 phenotype datasets, 20 variables, 78 samples sequenced, 29 subjects, 78 samples","","NCI","DS-LCTC-MDS --- Disease-Specific (Lung Cancer and Thoracic Malignancies, MDS)","2021-03-09","2021-03-09","ADENOCARCINOMA OF LUNG; Adenocarcinoma of lung, somatic; Adenocarcinoma of the Lung; Adenocarcinoma, Lung; Adenocarcinomas, Lung; Lung Adenocarcinoma",""
"phs002210.v1.p1","Comprehensive Analysis of Structural Variants in Breast Cancer Genomes    Using Single Molecule Sequencing","This study used the SKBR3 breast cell line and tumor/normal organoids derived from breast tissue to explore the utility of long read sequencing for detecting structural variants in complex samples.  Three technologies were used to characterize the samples: Illumina/10X, Pacific Biosciences, and Oxford Nanopore. Methylation results were derived","Not Applicable","Breast Neoplasms","Case Set","target_markerset_grc38","CNV (NGS), WGS","4 phenotype datasets, 15 variables, 1 molecular datasets, 7 samples sequenced, 2 subjects, 7 samples","","NCI","GRU-IRB --- General Research Use (IRB)","2021-03-05","2021-03-05","Breast Cancer; Breast Malignant Neoplasm; Breast Malignant Neoplasms; Breast Malignant Tumor; Breast Malignant Tumors; CA - Breast cancer",""
"phs002065.v1.p1","Integrative Somatic and Germline Molecular Characterization of    Genitourinary Cancers","We have performed integrative bulk (whole exome sequencing of tumor and normal paired and whole transcriptome sequencing) and single cell analysis of primary and metastatic non-prostate genitourinary cancer specimens, such  as renal and bladder tumors. Principal Investigator: Eliezer M. Van Allen, MD, Dana-Farber Cancer Institute, Boston, MA, USA Funding Sources: R37","Not Applicable","Urinary Bladder Neoplasms","Case-Control","Not Provided","RNA-Seq, WXS","4 phenotype datasets, 17 variables, 18 samples sequenced, 8 subjects, 18 samples","","NCI","HMB --- Health/Medical/Biomedical","2021-03-05","2021-03-05","Bladder Neoplasms; Kidney Neoplasms; Bladder Cancer; Bladder Cancers; Cancer of Bladder; Cancer of the Bladder","NCI's Collection of Datasets for Health, Medical, and Biomedical Research    Purposes (phs003044.v1.p1)"
"phs002294.v1.p1","Evolution of Core Archetypal Phenotypes in High-Grade Serous Ovarian    Cancer (HGSOC)","The evolution of resistance in high-grade serous ovarian cancer (HGSOC) cells in response to chemotherapy is only partially understood. To uncover phenotypic changes associated with chemotherapy resistance, we performed single-cell  RNA-sequencing (scRNA-seq) or whole-genome sequencing of 23 total patients, with longitudinal samples collected from 9, treatment-na&#x000ef;ve","Not Applicable","Ovarian Neoplasms","Tumor vs. Matched-Normal","Not Provided","OTHER, WGS","3 phenotype datasets, 11 variables, 72 samples sequenced, 23 subjects, 72 samples","","NCI","GRU --- General Research Use","2021-03-04","2021-03-04","Carcinoma, Ovarian Epithelial; Cancer, Epithelial Ovarian; Cancer, Ovarian Epithelial; Carcinoma of Ovary; Carcinoma of the Ovary; Carcinoma, Epithelial Ovarian","dbGaP Collection: Compilation of Individual-Level Genomic Data for    General Research Use (phs000688.v1.p1); NCI's Collection of Datasets for General Research Use (phs003014.v1.p1)"
"phs001935.v1.p1","National Cancer Institute Clinical and Laboratory Analysis of Familial    Cancer","The purpose of this study is to continue the analysis begun on 09C0079 which was focused on identification of the genetic mutation associated with a new gastric polyposis syndrome, Gastric  Adenocarcinoma and Proximal Polyposis of the Stomach (GAPPS). GAPPS, first described in 2012, is an autosomal dominant gastric polyposis syndrome","Not Applicable","Stomach Neoplasms","Case Set","Not Provided","WXS","5 phenotype datasets, 24 variables, 6 samples sequenced,  SRA, 6 subjects, 12 samples","","NCI","GRU --- General Research Use","2021-03-03","2021-03-03","Adenocarcinoma; Polyposis, Gastric; ADNOS; Adenocarcinomas; Adenoma, Malignant; Adenomas, Malignant",""
"phs002289.v1.p1","Yale SPORE in Skin Cancer Project 2","Understanding the relationship between tumor and peripheral immune environments could allow longitudinal immune monitoring in cancer. Here, we examined whether T cells that share the same TCRab and are found  in both tumor and blood can be interrogated to gain insight into the ongoing tumor T cell response. Paired transcriptome and TCRab repertoire of","Not Applicable","Single-Cell Analysis","Case Set","RNAseq_probe_set_grc38","RNA-Seq, RNA Seq (NGS)","5 phenotype datasets, 29 variables, 1 molecular datasets, 26 samples sequenced, 13 subjects, 50989 samples","","NCI","HMB --- Health/Medical/Biomedical","2021-02-26","2021-02-26","Not Provided","NCI's Collection of Datasets for Health, Medical, and Biomedical Research    Purposes (phs003044.v1.p1)"
"phs002327.v1.p1","Therapeutic Targeting of ATR Yields Durable Regressions in High    Replication Stress Tumors","Patients with relapsed or recurrent small cell lung cancer or extra-pulmonary small cell cancers were enrolled on an investigator-initiated, single-arm, phase 2 trial (NCT02487095) combining an ATR inhibitor M6620 (VX-970,  berzosertib) administered at 210 mg/m2 intravenously over 60 minutes on day 2 and day 5, and topotecan 1.25 mg/m2 intravenously over 30 minutes every","Not Applicable","Small Cell Lung Carcinoma","Clinical Trial","RNAseq_gene_transcripts, other, RNAseq_gene_transcripts, other, other","RNA-Seq, SNV (.MAF), RNA Seq (NGS), MAF (NGS), WXS","4 phenotype datasets, 14 variables, 1 molecular datasets, 24 samples sequenced, 24 subjects, 24 samples","","NCI","GRU --- General Research Use","2021-02-22","2021-02-22","Carcinoma, Small Cell Lung; Lung Small Cell Neuroendocrine Carcinoma; Lung oat cell carcinoma; Oat Cell Carcinoma of Lung; Oat Cell Lung Cancer; SCCL","NCI's Collection of Datasets for General Research Use (phs003014.v1.p1)"
"phs001140.v1.p1","ALCHEMIST Study","The ALCHEMIST study will accrue patients that are potentially eligible for the Intergroup adjuvant studies and perform central EGFR and ALK genotyping using a central reference laboratory certified by the  Clinical Laboratory Improvement Amendments of 1988 (CLIA). Patients may either present prior to surgery with resectable NSCLC, may present following","Not Applicable","Carcinoma, Non-Small-Cell Lung","Case Set","Not Provided","Not Provided","2 phenotype datasets, 4 variables,  SRA, 5731 subjects, 5731 samples","","NCI","GRU --- General Research Use","2021-02-17","2021-02-17","Carcinoma, Non Small Cell Lung; Carcinoma, Non-Small Cell Lung; Carcinomas, Non-Small-Cell Lung; Lung Carcinoma, Non-Small-Cell; Lung Carcinomas, Non-Small-Cell; NONSMALL CELL LUNG CANCER","NCI's Collection of Datasets for General Research Use (phs003014.v1.p1)"
"phs002037.v1.p1","Methylation Biomarker Study of Magnesium Deficiency and Colorectal Cancer","Five US studies using the Mg tolerance test, the ""gold standard"" test of Mg status, indicated that 50% participants had Mg deficiency. In our ongoing US trial, we have found  a similar result. In growing recognition of the importance of Mg in human health, very recently, Mg was selected by the US Federal Dietary Reference","Not Applicable","Magnesium Deficiency","Clinical Trial","MethylationEPIC","Methylation (CpG)","4 phenotype datasets, 16 variables, 1 molecular datasets, 238 subjects, 476 samples","","NCI","GRU --- General Research Use","2021-02-10","2021-02-10","DNA Methylation; Deficiencies, Magnesium; Deficiency, Magnesium; Magnesium Deficiencies","NCI's Collection of Datasets for General Research Use (phs003014.v1.p1)"
"phs002290.v1.p1","Tumor Fraction Guided Cell-Free DNA Profiling in Metastatic Cancer    Patients","Cell-free DNA (cfDNA) profiling is increasingly used to guide cancer care, yet mutations are not always identified. The ability to detect somatic mutations in plasma depends on both assay sensitivity  and the fraction of circulating DNA in plasma that is tumor-derived (i.e cfDNA tumor fraction). We hypothesized that cfDNA tumor fraction could","Not Applicable","Cell-Free Nucleic Acids","Tumor vs. Matched-Normal","Not Provided","WGS, WXS","4 phenotype datasets, 13 variables, 131 samples sequenced, 118 subjects, 131 samples","","NCI","DS-CA --- Disease-Specific (Cancer)","2021-02-05","2021-02-05","Not Provided",""
"phs002083.v1.p1","Role of Tobacco Smoke in Clear Cell Renal Cell Carcinoma","Background. Clear cell renal cell carcinoma (ccRCC) is the most common histologically defined renal cancer. However, it is not a uniform disease and includes several genetic subtypes with different prognoses.  ccRCC is also characterized by distinguished metabolic reprogramming. Tobacco smoking (TS) is an established risk factor for ccRCC with unknown","Not Applicable","Carcinoma, Renal Cell","Collection","Not Provided","RNA-Seq","4 phenotype datasets, 22 variables, 50 samples sequenced, 32 subjects, 50 samples","","NCI","GRU --- General Research Use","2021-02-05","2021-02-05","ADENOCARCINOMA OF KIDNEY; Adenocarcinoma Of Kidneys; Adenocarcinoma of the Kidney; Adenocarcinoma, Renal; Adenocarcinoma, Renal Cell; Adenocarcinomas, Renal Cell","NCI's Collection of Datasets for General Research Use (phs003014.v1.p1)"
"phs001748.v1.p1","Molecular Genetics of Histiocytic Sarcoma","This is a comprehensive genomic analysis of a rare set of histiocytic sarcomas from the consult service of the Hematopathology section of the Laboratory of Pathology, NCI, NIH. The study  identifies two distinct groupings of these tumors based on the site of disease, their mutational spectrum, and proliferation signature. All archived","Not Applicable","Histiocytic Sarcoma","Case Set","RNAseq_probe_set_grc37, WES_markerset_grc37","RNA-Seq, SNV (.MAF), RNA Seq (NGS), WXS","4 phenotype datasets, 15 variables, 2 molecular datasets, 44 samples sequenced, 25 subjects, 54 samples","","NCI","GRU --- General Research Use","2021-02-05","2021-02-05","Histiocytic Lymphoma, True; Histiocytic Lymphomas, True; Histiocytic Sarcomas; Histiocytoses, True Malignant; Histiocytosis, True Malignant; Lymphoma, True Histiocytic","NCI's Collection of Datasets for General Research Use (phs003014.v1.p1)"
"phs001857.v1.p1","Genetics of Mammographic Density in Ashkenazi Jews","Mammographic density (MD) is a strong risk factor for breast cancer and is also a highly heritable trait with 60-70% of the variance due to genetic factors, based on twin  studies. MD is also higher in families with a strong history of breast cancer. Genome-wide association studies (GWAS), which focus on common genetic","Not Applicable","Breast Density","Cross-Sectional","Multi-Ethnic_Global","SNP Genotypes (Array)","5 phenotype datasets, 46 variables, 1 molecular datasets, 677 subjects, 677 samples","European (667), African American (1), Hispanic2 (3), Other Asian or Pacific Islander (1), Other (5)","NCI","DS-MDBRCA-MDS --- Disease-Specific (Mammographic Density and Breast Cancer Risk, MDS)","2021-02-03","2021-02-03","Mammographic Breast Density; Breast Densities, Mammographic; Breast Density, Mammographic; Density, Mammographic; Mammographic Breast Densities; Mammographic Densities",""
"phs002062.v1.p1","Polygenic Risk Score for the Prediction of Breast Cancer Is Related to    Lesser Terminal Duct Lobular Unit Involution of the Breast","The Susan G. Komen Tissue Bank (KTB) at the Indiana University Simon Cancer Center is an annotated biobank, which has recruited healthy women who provided demographic, lifestyle, and cancer-related information  via self-administered questionnaire, blood samples and normal breast tissues. H&E slides of the normal breast tissues were scanned for image analysis","Not Applicable","Breast Neoplasms","Cross-Sectional","Not Provided","Not Provided","4 phenotype datasets, 25 variables, 1089 subjects, 1089 samples","","NCI","DS-BRCA --- Disease-Specific (Breast Cancer)","2021-01-28","2021-01-28","Breast Cancer; Breast Malignant Neoplasm; Breast Malignant Neoplasms; Breast Malignant Tumor; Breast Malignant Tumors; CA - Breast cancer",""
"phs001962.v1.p1","Genomic Profiling of Peripheral T-cell Lymphoma","Peripheral T-cell lymphomas (PTCLs) are malignant and highly aggressive hematologic tumors arising from mature post-thymic T cells. The diagnosis of PTCL includes diverse lymphoma subgroups, altogether accounting for about 15%  of all non-Hodgkin lymphomas. Despite recent advances in uncovering the mutational landscape of PTCLs, the prognoses of most PTCLs remain poor. To","Not Applicable","Lymphoma, T-Cell, Peripheral","Prospective Longitudinal Cohort","Not Provided","RNA-Seq","4 phenotype datasets, 12 variables, 20 samples sequenced,  SRA, 20 subjects, 20 samples","","NCI","HMB-PUB --- Health/Medical/Biomedical (PUB)","2021-01-28","2021-01-28","Lymphoma, Non-Hodgkin; Interdigitating cell sarcoma; Reticulosarcomas; Reticulum Cell Sarcoma; Reticulum Cell Sarcomas; Reticulum cell sarcoma morphology",""
"phs001744.v1.p1","Genome-Wide Association Study of HCC in Non-Asian USA Population","This GWAS of HCC relied on existing biological and data resources from 7 USA sites and one Canadian site which allows for the integration of genetic and environmental data. Total  of 2199 case patients and 1103 non cancer controls were genotyped. Case patients are defined as patients with pathological or radiological diagnosis","Not Applicable","Liver Neoplasms","Case-Control","HumanOmniExpressExome-8, imputation_panel","SNP Genotypes (Array), SNP/CNV Genotypes (imputed)","4 phenotype datasets, 19 variables, 2 molecular datasets, 3225 subjects, 3352 samples","European (2849), African (1), East Asian (3), African American (147), Hispanic1 (39), Hispanic2 (172), Other Asian or Pacific Islander (3), South Asian (1), Other (10)","NCI","DS-LCCLD-MDS --- Disease-Specific (Liver Cancer and Chronic Liver Disease, MDS), DS-HCC-IRB --- Disease-Specific (Hepatocellular Carcinoma, IRB)","2021-01-27","2021-01-27","Carcinoma, Hepatocellular; Adult Liver Cancer; Adult Liver Cancers; Cancer, Adult Liver; Cancers, Adult Liver; Carcinoma of Liver Cells",""
"phs002287.v1.p1","Evolution of Resistance in ER+ Breast Cancer","While the combination of endocrine therapy and CDK4/CDK6 inhibitors has been shown to be effective in the metastatic ER+ breast cancer setting, to test whether it is effective in an  earlier stage neoadjuvant setting, the FELINE trial (NCT02712723) was established to test the efficacy of letrozole and ribociclib in a ER-positive,","Not Applicable","Breast Neoplasms","Tumor vs. Matched-Normal","Not Provided","WXS","5 phenotype datasets, 18 variables, 72 samples sequenced, 24 subjects, 72 samples","","NCI","GRU --- General Research Use","2021-01-15","2021-01-15","Drug Resistance; Breast Cancer; Breast Malignant Neoplasm; Breast Malignant Neoplasms; Breast Malignant Tumor; Breast Malignant Tumors","dbGaP Collection: Compilation of Individual-Level Genomic Data for    General Research Use (phs000688.v1.p1); NCI's Collection of Datasets for General Research Use (phs003014.v1.p1)"
"phs002060.v1.p1","Pharmacogenomic Analysis of Microtubule Targeting Agent Response and    Toxicity","Microtubule targeting agents are commonly prescribed for early and metastatic breast cancer and other solid tumors. However, interindividual variability in microtubule targeting drug response and toxicity can cause limited therapeutic  benefit and impact quality of life. In the present study, genome-wide analyses were performed to investigate how genetic factors can be used to","Not Applicable","Peripheral Nervous System Diseases","Prospective Longitudinal Cohort","WES_markerset_grc38, HumanOmniExpress-12, HumanOmniExpress-12, WES_markerset_grc38","SNP Genotypes (Array), SNP/CNV Genotypes (NGS)","4 phenotype datasets, 34 variables, 1 molecular datasets, 624 subjects, 624 samples","European (483), African (6), East Asian (8), African American (77), Hispanic1 (13), Hispanic2 (22), Other Asian or Pacific Islander (12), South Asian (1), Other (2)","NCI","HMB --- Health/Medical/Biomedical","2020-12-22","2020-12-22","Breast Cancer; Breast Malignant Neoplasm; Breast Malignant Neoplasms; Breast Malignant Tumor; Breast Malignant Tumors; CA - Breast cancer","NCI's Collection of Datasets for Health, Medical, and Biomedical Research    Purposes (phs003044.v1.p1)"
"phs001787.v1.p1","Discovery of Colorectal Cancer Susceptibility Genes in High-Risk Families","Colorectal cancer remains one of the most common cancers in the US with 146,970 new diagnoses and 49,920 deaths estimated for 2009. Colon cancer is also one of the most  familial of cancers. Individuals with a first-degree relative with colon cancer have a 2- to 3-fold increased risk, and those with more than one","Not Applicable","Colorectal Neoplasms, Hereditary Nonpolyposis","Case Set","HumanOmniExpressExome-8","SNP Genotypes (Array), WXS","4 phenotype datasets, 17 variables, 1 molecular datasets, 159 samples sequenced,  SRA, 51 subjects, 206 samples","","NCI","DS-CA-MDS --- Disease-Specific (Cancer, MDS)","2020-12-22","2020-12-22","Familial Nonpolyposis Colon Cancer",""
