project_num	core_project_num	appl_id	fiscal_year	project_title	abstract_text	pref_terms	org_name	org_city	org_state	org_country	principal_investigators	program_officers	award_amount	agency_ic_fundings	award_notice_date	project_start_date	project_end_date	full_foa	api_source_search
5U01CA213338-02	U01CA213338	9571233	2018	Developing ASCL1 and NeuroD1 lineage oncogene targeted therapy for small cell lung cancer	"Developing ASCL1 and NEUROD1 lineage oncogene targeted therapy for small cell lung cancer (SCLC)
This application focuses on developing new targeted therapy for SCLC focusing on two key lineage oncogenes
involved in SCLC pathogenesis and malignant behavior, ASCL1 and NEUROD1. Nearly 90% of SCLCs
express ASCL1, NEUROD1 or both. In the preclinical models, including human SCLC lines and xenografts and
genetically engineered mouse models (GEMMs) of SCLC, tumors that express either ASCL1 or NEUROD1
appear “addicted” to their expression and function. The presence of ASCL1 or NEUROD1 also are associated
with expression of important downstream oncogenes and regulatory genes. If ASCL1/NEUROD1 are removed
(through genetic knockdown) SCLCs undergo many logs of tumor cell kill. Using state of the art technology in
human preclinical models, we propose to systematically study the dependency of a large number of SCLC
lines and xenografts (including patient derived xenografts, PDXs, and circulating tumor cell derived xenografts,
CDXs) on ASCL1 and NEUROD1 through genetic knockdown, and systematically test the ability of blocking
genetically and pharmacologically downstream potentially “druggable” targets of these two transcription factors
to kill SCLCs. We have three specific aims: Aim 1. Determine ASCL1 and NEUROD1 expression patterns
and clinical and molecular correlates in preclinical SCLC models and tumor specimens; Aim 2. Determine
ASCL1 and NEUROD1 genetic dependency phenotypes, potential molecular biomarkers predicting response,
and frequency and mechanisms of resistance in SCLC preclinical models; Aim 3. Determine the role of ASCL1
and NEUROD1 directly regulated “downstream” targets as vulnerabilities that can be exploited for therapeutic
effect using in vivo xenograft shRNA mini-library “drop out” screens and selected drugs that inhibit downstream
“druggable” targets. As part of these aims we will also determine if resistance to ASCL1 or NEUROD1 targeted
therapy in SCLCs develops using CRISPR-CAS9 technology including potential mechanisms of this
resistance, and we will explore the possible use of ASCL1 and NEUROD1 expression as SCLC enrollment
biomarkers for developing “precision medicine” to predict the response of such targeted therapy in individual
SCLCs. We have developed a large amount of preliminary data on which this application is based including 1)
assembling the world’s largest collection of clinically and molecularly annotated human SCLC lines and
xenografts, as well as important GEMMs of SCLC, 2) generating a comprehensive list of directly regulated
downstream targets of ASCL1 and NEUROD1 through ChipSeq/RNASeq and chromatin landscape studies,
and 3) developing experimental approaches to systematically study the dependency of SCLCs on ASCL1 and
NEUORD1 downstream targets. We have assembled a world class team of investigators, including a patient
advocate, with complementary skills to assure the successful completion of this project. The final deliverables
will serve as the basis for new ASCL1 and NEUROD1 targeted therapeutics for SCLC."	ASCL1 gene;Ablation;Advocate;BETA2 protein;Behavior;Biological Assay;Biological Markers;CRISPR/Cas technology;Cancer Model;Cancer Patient;Cancer cell line;Cell Line;Cells;ChIP-seq;Chromatin;Clinical;Collection;Congresses;Data;Data Set;Databases;Dependence;Drops;Drug usage;Enrollment;Family member;Frequencies;Future;Genes;Genetic;Genetically Engineered Mouse;Growth;Health;Human;In Vitro;Individual;Induction of Apoptosis;Knock-out;Knowledge;Libraries;Malignant - descriptor;Malignant Neoplasms;Methodology;Methods;Modeling;Molecular;Molecular and Cellular Biology;Mus;Mutate;NFIB gene;Neoplasm Circulating Cells;Neurosecretory Systems;Oncogenes;Pathogenesis;Patients;Pattern;Pharmaceutical Preparations;Pharmacology;Phenotype;Pre-Clinical Model;Prevention approach;Prevention therapy;Proteins;Publishing;Regulator Genes;Research Personnel;Resistance;Role;Specimen;Technology;Testing;Therapeutic;Therapeutic Effect;Translations;Work;Xenograft Model;Xenograft procedure;base;cancer survival;cancer therapy;cell killing;clinical translation;clinically translatable;druggable target;in vitro Assay;in vivo;knock-down;lung small cell carcinoma;mRNA Expression;molecular marker;neoplastic cell;new therapeutic target;novel therapeutics;pre-clinical;precision medicine;predicting response;predictive marker;protein expression;resistance frequency;resistance mechanism;response;skills;small hairpin RNA;success;targeted treatment;therapeutic development;therapy development;transcription factor;transcriptome sequencing;tumor	UT SOUTHWESTERN MEDICAL CENTER	DALLAS	TX	UNITED STATES	John D. Minna	Suzanne L Forry	605070	605070	2018-08-20T12:08:00Z	2017-09-25T12:09:00Z	2022-08-31T12:08:00Z	PAR-16-049	nofo_PAR-16-049
1U01CA231776-01	U01CA231776	9601064	2018	Bioinformatic-Chemical Approach to Credential Molecular Targets to Combat Rapid Chemo-Radiation Resistance in SCLC	"PROJECT ABSTRACT
Limited stage small cell lung cancer (LS SCLC), the only curable form of SCLC, is remarkably sensitive to
etoposide plus cisplatin combined with thoracic radiotherapy with response rates > 70%; however, therapy-
refractory recurrence is common. LS SCLC has less than a 25% 5-year overall survival (OS) and ultimately a
strategy for improving long-term SCLC outcomes needs to successfully target tumor cell populations that
survive standard therapy and give rise to recurrent disease. There is, however, a considerable gap in
understanding the specific mechanisms responsible for chemoradiotherapy resistance in SCLC. Our project is
unique among the current portfolio of SCLC funded programs in that we have focused on
chemoradioresistance to increase cure rates in LS SCLC. Recently, our work has suggested using patient-
derived xenograft (PDX) models of SCLC may be an important tool to elucidate mechanisms of therapy
resistance. This approach was remarkably successful, identifying a tolerable and strongly synergistic anti-
SCLC interaction that led to a CTEP-approved trial based on our preclinical data - (NCI #10070; Study Chair:
Hann). In this research program, we will test key hypotheses via three specific aims that will provide more
mechanistic insights into the rapidly emergent chemoradiation resistance observed in LS SCLC.
One central hypothesis of this proposal is that adaptive gene expression changes mediate rapid emergence of
the chemoradiation resistance phenotype in LS SCLC. We have developed a novel chemoradiation treatment
regimen with SCLC PDX models to facilitate these studies. Development and characterization of this novel
model involves a unique collaboration between medical oncologists, radiation oncologists, bioinformaticians,
medical physicists, veterinarians and molecular/cell biologists that is extremely well suited to develop an
integrated program dedicated to resolving questions of SCLC chemoradioresistance. Finally, we have already
identified novel gene targets that are correlated with SCLC chemoradioresistance.
Our research program is organized as follows: Aim #1: Characterize natural history of response of
experimental models of SCLC to chemoradiation in vivo. We will determine response rates and recurrence
patterns of a panel of SCLC PDXs and transgenic mouse models. Aim #2: Characterization of molecular
underpinnings of SCLC chemoradiation resistance. We will reconstruct gene regulatory networks and gene
expression profiles associated with chemoradiation resistance and develop small-scale predictive classifiers for
therapy response to be validated in follow-up studies. Aim #3: Pharmacologic and genetic validation of
candidate genes for SCLC chemoradiation resistance in vitro and in vivo. We will validate our novel gene
candidates for conferring chemoradiation resistance using pharmacologic and genetic approach with SCLC
PDX-derived organoids and SCLC transgenic mouse models."	BCL2 gene;Bioinformatics;Cancer Model;Cancer Therapy Evaluation Program;Candidate Disease Gene;Cell Line;Cells;Chemicals;Chest;Cisplatin;Clinical;Collaborations;Complex;Data;Development;Drug Combinations;Epigenetic Process;Etiology;Etoposide;Experimental Models;Expression Profiling;Follow-Up Studies;Funding;Gene Expression;Gene Expression Profiling;Gene Targeting;Genetic;Genetic Transcription;Genetically Engineered Mouse;Human;In Vitro;Limited Stage;Malignant Neoplasms;Mediating;Medical;Medical Oncologist;Modeling;Molecular;Molecular Target;Natural History;Organoids;Outcome;Pathway interactions;Patients;Pattern;Pharmacology;Phenotype;Population;Positioning Attribute;Radiation Oncologist;Radiation therapy;Recurrence;Recurrent disease;Refractory;Regulator Genes;Research;Research Design;Resistance;Signaling Protein;Techniques;Testing;Transgenic Mice;Treatment Protocols;Variant;Veterinarians;Work;Xenograft Model;Xenograft procedure;animal imaging;base;candidate validation;chemoradiation;chemotherapy;combat;genetic approach;improved;in vivo;inhibitor/antagonist;innovation;insight;irradiation;lung small cell carcinoma;mouse model;neoplastic cell;novel;pre-clinical;programs;resistance gene;resistance mechanism;response;therapy resistant;tool;transcription factor;transcriptome sequencing;tumor	JOHNS HOPKINS UNIVERSITY	BALTIMORE	MD	UNITED STATES	Christine L. Hann, Luigi Marchionni, Phuoc T. Tran	Suzanne L Forry	611606	611606	2018-09-03T12:09:00Z	2018-09-03T12:09:00Z	2023-08-31T12:08:00Z	PAR-16-049	nofo_PAR-16-049
5U01CA213359-02	U01CA213359	9432491	2018	Preclinical development of a DLL3-targeted theranostic for small cell lung cancer	"PROJECT SUMMARY
 Small cell lung cancer (SCLC) is remarkable for exceptionally high metastatic potential, initial robust
response to DNA damaging agents, and near universal development of resistance. This combination of
predilection for early metastasis acquired treatment resistance – often times manifested as cross resistance to
multiple agents – highlights a critical need for novel systemic therapies operating through a novel mechanism
in order to achieve improved patient outcomes.
 Delta-like ligand 3 (DLL3), has recently been identified as a therapeutic target in SCLC. The highly
tumor-selective surface expression of this protein make it an excellent candidate target for an antibody drug
conjugate (ADC). Rovalpituzumab tesserine (Rova-T) is one such ADC that is showing encouraging efficacy
signals in the clinic. However, despite apparent clinical benefit, this agent has also been associated with some
severe adverse events attributable to the presence of the anthracycline PBD warhead. DLL3 targeting
approaches are in need of both a real-time, quantitative diagnostic biomarker and a therapeutic approach with
reduced toxicity.
 We propose a theranostic approach comprising on 89Zr immunoPET and a 90Y/177Lu
radioimmunotherapeutic. The first Aim improves upon already promising bioconjugation chemistry. We are
already able to obtain high-contrast immunoPET images using non-specific amine labeling and site-specific
maleimide bioconjugation. We will improve upon this approach by developing more stable thiol-clickable
methylsuflone chelators for 89Zr and 90Y/177Lu to minimize kidney dose. The second Aim identifies preclinical
dosing parameters and comprehensively optimizes efficacy and toxicity in a traditional cell line xenograft. Our
preliminary imaging data is focused on H82, an SCLC cell lined derived from a chemoexperienced patient. This
cell line is very resistant to etoposide in vitro and in vivo and will be used to identify a radiotherapy dose that
demonstrates efficacy in vivo, while minimizing dose to the kidney. Different dose ranges and schedules will be
explored. The final Aim explores radiotherapy in a variety of in vivo contexts including lesion sizes ranging from
0.1 to 10 mm in diameter and representing both chemonaïve and chemoresistant disease. Radioisotopes have
different energy deposition depending on the volume of the tumor being targeted. We will evaluate 90Y and
177Lu radioisotopes in different in vivo models of small cell lung cancer for the ability to eradicate lesions of
different sizes. A unique resource in the lab is our collection of 10 paired chemonaïve and chemoresistant
patient-derived xenograft lines. We will place particular emphasis on establishing efficacy in the context of
acquired chemoresistance.
 Data obtained in this study should provide preclinical evidence in support of clinical translation of a
DLL3 targeting theranostic based on rovalpituzumab."	90Y;Amines;Anthracyclines;Antibodies;Antibody-drug conjugates;Biodistribution;Caliber;Cancer cell line;Cell Line;Cell surface;Central Nervous System Diseases;Chelating Agents;Chemistry;Clinic;Clinical;Clinical Trials;Collection;Cysteine;DNA Damage;DNA Minor Groove Binding Agent;Data;Deferoxamine;Deposition;Diagnosis;Disease;Dose;Etoposide;Exposure to;Extensive Stage;FDA approved;Goals;Image;ImmunoPET;In Vitro;Kidney;Label;Lead;Lesion;Ligands;Lutetium;Maleimides;Malignant Neoplasms;Malignant neoplasm of lung;Metastatic/Recurrent;Methods;Micrometastasis;Molecular;Mus;Neoplasm Metastasis;Patient Selection;Patient-Focused Outcomes;Patients;Pentetic Acid;Performance;Pericardial body location;Peritoneal;Pharmacodynamics;Pleural;Population;Positron;Pre-Clinical Model;Proteins;Radiation Tolerance;Radiation therapy;Radioconjugate;Radioimmunoconjugate;Radioimmunotherapy;Radioisotopes;Recurrence;Refractory;Resistance;Resistance development;Resources;Route;Schedule;Serum;Severe Adverse Event;Signal Transduction;Site;Specificity;Sulfhydryl Compounds;Surface;Systemic Therapy;Therapeutic;Therapeutic Index;Time;Toxic effect;Toxicology;Toxin;Treatment Protocols;Tumor Volume;United States;Work;Xenograft Model;Xenograft procedure;Zirconium;acquired treatment resistance;base;chemical synthesis;clinical translation;companion diagnostics;design;diagnostic biomarker;efficacy study;effusion;first-in-human;imaging agent;immunoreactivity;improved;in vivo;in vivo Model;lung small cell carcinoma;novel;novel therapeutic intervention;novel therapeutics;outcome forecast;pre-clinical;preclinical development;protein expression;response;targeted agent;targeted treatment;theranostics;therapeutic target;tumor;tumor specificity	SLOAN-KETTERING INST CAN RESEARCH	NEW YORK	NY	UNITED STATES	John Thomas Poirier	Jacek Capala	339331	339331	2017-12-20T12:12:00Z	2017-02-15T12:02:00Z	2022-01-31T12:01:00Z	PAR-16-049	nofo_PAR-16-049
1U01CA220323-01A1	U01CA220323	9602353	2018	Using patient-derived models to understand drug responses in SCLC	"PROJECT SUMMARY
Small cell lung cancer (SCLC) afflicts more than 30,000 patients per year and is rapidly fatal in 95% of cases,
with median survival is less than one year. Belying this grim prognosis, treatment-naive SCLC is highly
sensitive to chemotherapy, with response rates in excess of 70% for etoposide/platinum. However, relapse is
nearly inevitable, and relapsed SCLC presents two obstacles that have been insurmountable for at least 30
years: cross-resistance to chemotherapy, and absence of biomarker-driven targeted therapy.
Following relapse, resistance often extends beyond etoposide/platinum, and a disease that was once highly
chemosensitive becomes inexorably progressive. However, the molecular determinants of cross-resistance in
SCLC remain unclear. Although critically important, cross-resistance is difficult to study experimentally, as it
requires a model system that faithfully reproduces clinical outcomes.
Topotecan is the only approved second-line therapy, but NCCN guidelines list 10 agents of nearly equivalent
efficacy. None are particularly effective in unselected patients, and although there is significant molecular
heterogeneity in SCLC, this does not guide patient selection. As novel targets and therapeutic regimens
emerge, biomarker discovery will require a model system that recapitulates the molecular features of patient
tumors, so that molecular heterogeneity can be parsed into clinically meaningful subgroups.
We have generated a panel of 44 SCLC patient-derived xenograft models (PDXs) from biopsy specimens and
circulating tumor cells (CTCs). Our panel includes successive models from individual patients at time points
before and after specific lines of therapy, with detailed information about the corresponding clinical response.
For both standard chemotherapy and experimental agents in clinical trial, these models faithfully mirror patient
responses. However, unlike the patient experience, multiple strategies can be compared for identical tumors.
We propose to use these models to directly compare standard first and second-line chemotherapy with two
experimental regimens that have given promising results in the clinic or in preclinical assays: olaparib plus
temozolomide, in a phase I/II trial at MGH, and a combined Mcl-1/Bcl-2 inhibitors. Individually, these PDX
population trials are designed to reveal biomarkers of sensitivity and mechanisms of resistance for promising
experimental therapies. Collectively, they present a novel opportunity to model cross-resistance through
comparative analysis with reference to the clinical histories of each model.
The successful completion of this work will establish a large collection of PDX models with comprehensive
molecular an functional profiles. In addition, these experiments will investigate the molecular determinants of
cross-resistance following chemotherapy, a problem that has beleaguered management of SCLC for over
three decades."	Aftercare;Apoptotic;BCL2 gene;Biological Assay;Biological Markers;Biological Models;Biopsy;Biopsy Specimen;Blood specimen;Cancer Patient;Cancer cell line;Cisplatin;Clinic;Clinical;Clinical Trials;Collection;Communities;DNA Damage;Dependence;Development;Diagnosis;Disease;Dissection;Etoposide;Frequencies;Guidelines;Heterogeneity;Human;In Vitro;Investigational Therapies;Malignant Neoplasms;Methods;Modeling;Molecular;Molecular Profiling;Mus;Mutation Spectra;National Comprehensive Cancer Network;Neoplasm Circulating Cells;Outcome;Patient Selection;Patients;Pattern;Pharmaceutical Preparations;Pharmacology Study;Phase;Phase I/II Trial;Platinum;Population;Proteomics;Recording of previous events;Regimen;Relapse;Resistance;Resources;Specimen;Subgroup;System;Therapeutic;Time;Topotecan;United States;Work;Xenograft Model;Xenograft procedure;anticancer research;base;biomarker discovery;biomarker-driven;cancer therapy;candidate marker;chemotherapy;comparative;compare effectiveness;drug sensitivity;effusion;exome sequencing;experience;experimental study;genome sequencing;in vivo;individual patient;inhibitor/antagonist;lung small cell carcinoma;neoplastic cell;novel;novel marker;novel therapeutic intervention;novel therapeutics;outcome forecast;patient population;patient response;pre-clinical;relapse patients;repaired;resistance mechanism;response;targeted treatment;temozolomide;transcriptome sequencing;trial design;tumor	MASSACHUSETTS GENERAL HOSPITAL	BOSTON	MA	UNITED STATES	Nicholas J Dyson, Anna Flora Farago	Suzanne L Forry	619923	619923	2018-09-17T12:09:00Z	2018-09-17T12:09:00Z	2023-08-31T12:08:00Z	PAR-16-049	nofo_PAR-16-049
1U01CA213359-01	U01CA213359	9246182	2017	Preclinical development of a DLL3-targeted theranostic for small cell lung cancer	"PROJECT SUMMARY
 Small cell lung cancer (SCLC) is remarkable for exceptionally high metastatic potential, initial robust
response to DNA damaging agents, and near universal development of resistance. This combination of
predilection for early metastasis acquired treatment resistance – often times manifested as cross resistance to
multiple agents – highlights a critical need for novel systemic therapies operating through a novel mechanism
in order to achieve improved patient outcomes.
 Delta-like ligand 3 (DLL3), has recently been identified as a therapeutic target in SCLC. The highly
tumor-selective surface expression of this protein make it an excellent candidate target for an antibody drug
conjugate (ADC). Rovalpituzumab tesserine (Rova-T) is one such ADC that is showing encouraging efficacy
signals in the clinic. However, despite apparent clinical benefit, this agent has also been associated with some
severe adverse events attributable to the presence of the anthracycline PBD warhead. DLL3 targeting
approaches are in need of both a real-time, quantitative diagnostic biomarker and a therapeutic approach with
reduced toxicity.
 We propose a theranostic approach comprising on 89Zr immunoPET and a 90Y/177Lu
radioimmunotherapeutic. The first Aim improves upon already promising bioconjugation chemistry. We are
already able to obtain high-contrast immunoPET images using non-specific amine labeling and site-specific
maleimide bioconjugation. We will improve upon this approach by developing more stable thiol-clickable
methylsuflone chelators for 89Zr and 90Y/177Lu to minimize kidney dose. The second Aim identifies preclinical
dosing parameters and comprehensively optimizes efficacy and toxicity in a traditional cell line xenograft. Our
preliminary imaging data is focused on H82, an SCLC cell lined derived from a chemoexperienced patient. This
cell line is very resistant to etoposide in vitro and in vivo and will be used to identify a radiotherapy dose that
demonstrates efficacy in vivo, while minimizing dose to the kidney. Different dose ranges and schedules will be
explored. The final Aim explores radiotherapy in a variety of in vivo contexts including lesion sizes ranging from
0.1 to 10 mm in diameter and representing both chemonaïve and chemoresistant disease. Radioisotopes have
different energy deposition depending on the volume of the tumor being targeted. We will evaluate 90Y and
177Lu radioisotopes in different in vivo models of small cell lung cancer for the ability to eradicate lesions of
different sizes. A unique resource in the lab is our collection of 10 paired chemonaïve and chemoresistant
patient-derived xenograft lines. We will place particular emphasis on establishing efficacy in the context of
acquired chemoresistance.
 Data obtained in this study should provide preclinical evidence in support of clinical translation of a
DLL3 targeting theranostic based on rovalpituzumab."	90Y;Amination;Amines;Anthracyclines;Antibodies;Antibody-drug conjugates;Biodistribution;Caliber;Cancer cell line;Cell Line;Cell surface;Central Nervous System Diseases;Chelating Agents;Chemistry;Clinic;Clinical;Clinical Trials;Collection;Cysteine;DNA Damage;DNA Minor Groove Binding Agent;Data;Deferoxamine;Deposition;Diagnosis;Disease;Dose;Etoposide;Exposure to;Extensive Stage;FDA approved;Goals;Human;Image;In Vitro;Kidney;Label;Lead;Lesion;Ligands;Lutetium;Maleimides;Malignant Neoplasms;Malignant neoplasm of lung;Metastatic/Recurrent;Methods;Micrometastasis;Molecular;Mus;Neoplasm Metastasis;Patient Selection;Patient-Focused Outcomes;Patients;Pentetic Acid;Performance;Pericardial body location;Peritoneal;Pharmacodynamics;Pleural;Population;Positron;Positron-Emission Tomography;Pre-Clinical Model;Proteins;Radiation Tolerance;Radiation therapy;Radioconjugate;Radioimmunoconjugate;Radioimmunotherapy;Radioisotopes;Recurrence;Refractory;Resistance;Resistance development;Resources;Route;Schedule;Serum;Severe Adverse Event;Signal Transduction;Site;Specificity;Sulfhydryl Compounds;Surface;Systemic Therapy;Therapeutic;Therapeutic Index;Time;Toxic effect;Toxicology;Toxin;Treatment Protocols;Tumor Volume;United States;Work;Xenograft Model;Xenograft procedure;Zirconium;acquired treatment resistance;base;chemical synthesis;clinical translation;companion diagnostics;design;diagnostic biomarker;efficacy study;effusion;imaging agent;immunoreactivity;improved;in vivo;in vivo Model;lung small cell carcinoma;novel;novel therapeutic intervention;novel therapeutics;outcome forecast;pre-clinical;preclinical development;protein expression;radiosensitive;response;targeted agent;targeted treatment;theranostics;therapeutic target;tumor;tumor specificity	SLOAN-KETTERING INST CAN RESEARCH	NEW YORK	NY	UNITED STATES	John Thomas Poirier	Jacek Capala	355035	355035	2017-02-14T12:02:00Z	2017-02-15T12:02:00Z	2022-01-31T12:01:00Z	PAR-16-049	nofo_PAR-16-049
