project_num	core_project_num	appl_id	fiscal_year	project_title	abstract_text	pref_terms	org_name	org_city	org_state	org_country	principal_investigators	program_officers	award_amount	agency_ic_fundings	award_notice_date	project_start_date	project_end_date	full_foa	api_source_search
5U01CA224326-03	U01CA224326	9856999	2020	Studies of the initiation and progression of small cell lung cancer using cells derived by differentiation from human pluripotent stem cells	"PROJECT SUMMARY
 Small cell lung cancer (SCLC) is an especially virulent form of lung cancer that is
only transiently responsive to therapy and kills about 30,000 Americans each year.
Based on a more general interest in understanding why certain kinds of cancers have
characteristic genotypes, we are developing methods for studying the initiation of human
cancers by genetically modifying cells at discrete stages of differentiation after chemical
induction of specific lineages from human embryonic stem cells (hESCs). We have
extended recently published methods for inducing hESCs to form parts of the pulmonary
lineage by perturbing NOTCH signaling and reducing expression of the RB1 gene (one of
the two genes commonly inactivated in SCLC); in this way, we have prepared cultures
with high proportions of pulmonary neuroendocrine cells (PNECs), the putative
precursors of SCLC. Moreover, by also reducing expression of P53, the other gene
commonly inactivated in SCLC, PNEC-containing cultures are able to produce small
tumors resembling SCLC when implanted in immune-deficient mice.
 We now propose to expand our studies of this promising model for studying the
origins of SCLC in several ways: by determining the mechanisms by which interference
with NOTCH and RB1 generates PNECs; by exploring several possible assays for the
SCLC-like phenotype we have recently observed; by defining the similarities between the
genetic and physiological features of the SCLCs derived from hESCs and the SCLCs
arising in human patients; and by making induced pleuropotent stem cells (iPSCs) from
normal and tumor cells from patients with lung cancer, especially SCLC, in an effort to
seek genetic risk factors for SCLC. Through these studies, we expect to generate new
information and ideas about risk assessment, prevention, diagnosis, and treatment for
SCLC.
!"	American;Animals;Biological Assay;Cancer Control;Cancer Patient;Cell Culture Techniques;Cell Differentiation process;Cell Line;Cell Lineage;Cells;Characteristics;Chemicals;Collaborations;Data;Diagnosis;Disease;Early Diagnosis;Event;Frequencies;Genes;Genetic;Genomics;Genotype;Human;Immune;Implant;Individual;Lung;Malignant Neoplasms;Malignant neoplasm of lung;Methods;Modeling;Molecular;Mus;Mutate;Mutation;Nature;Neuroendocrine Cell;Normal Cell;Notch Signaling Pathway;Oncogenic;Pathogenesis;Patients;Phenotype;Physiological;Prevention;Process;Production;Protocols documentation;Public Health;Publishing;RB1 gene;Receptor Down-Regulation;Risk Assessment;Role;Signal Transduction;Study models;TP53 gene;Therapeutic;Time;Totipotent;Tumor Suppressor Genes;Tumor-Derived;Virulent;Work;base;cell type;experimental study;gamma secretase;genetic risk factor;genetically modified cells;high risk;human embryonic stem cell;human embryonic stem cell line;human pluripotent stem cell;interest;lung small cell carcinoma;model development;neoplastic cell;notch protein;novel strategies;prevent;stem cell technology;stem cells;therapeutic target;transcriptome;tumor;unpublished works	WEILL MEDICAL COLL OF CORNELL UNIV	NEW YORK	NY	UNITED STATES	Harold E. Varmus	Eva Szabo	606140	606140	2020-01-27T12:01:00Z	2018-02-09T12:02:00Z	2023-01-31T12:01:00Z	PAR-16-051	nofo_PAR-16-051
5U01CA224293-03	U01CA224293	9988380	2020	Targeting BCAT1 and branched-chain amino acid metabolism for the detection and prevention of SCLC	"Summary
The high mortality of small cell lung cancer (SCLC) is largely due to its invariable resistance to current
cytotoxic therapies. Chemoprevention has been considered as an alternative to existing therapeutics on the
basis of long tumor latency and the well-defined high-risk population (e.g. smokers). Identification of tractable
targets for prevention and early detection requires an understanding of molecular changes underlying early-
stage tumor development. We found that enhanced ribosome biogenesis and protein synthesis are critical for
MYC family-driven transformation of precancerous precursors (preSC) into fully tumorigenic cells. Both human
and mouse SCLC cells are extremely sensitive to a specific inhibitor of ribosome biogenesis that has also been
shown to reduce tumor growth in a genetically engineered mouse model. Analysis of the MYC-driven
oncogenic gene signature revealed branched-chain aminotransferase 1 (BCAT1) as a potential modulator of
both metabolic adaptation and related stress response to promote cellular homeostasis. BCAT1 is an enzyme
that catalyzes transfer of the α-amino nitrogen from branched-chain amino acids (BCAAs including leucine) to
α-ketoglutarate to produce branched-chain α-keto acids (BCKAs) and glutamate. This enzyme routes BCAAs
into multiple metabolite pools for biosynthesis and regulates levels of BCAAs, specifically leucine, that
stimulate protein synthesis by acting as indicators of nutrient availability. BCAT1 has recently been implicated
in multiple types of cancers, including glioblastoma and mouse Kras/p53-driven lung adenocarcinoma. In this
application, we will test the hypotheses that enhanced BCAT1 promotes SCLC development by controlling
protein synthesis and stress response, and that altered levels of BCAA metabolites inform early BCAT1-
dependent SCLC development. To test these hypotheses, we propose the following Aims. Aim 1: To determine
the necessity of BCAT1 for SCLC development, we will evaluate the tumor suppressive effects of knocking out
Bcat1 and examine the effects of pharmacological inhibition of BCAT1 on SCLC development and long-term
survival in vivo. Aim 2: To determine the role of BCAT1 in protein synthesis and stress response during SCLC
development, we will manipulate BCAT1 and determine the resulting impact on biochemical interactions
among related proteins and pathways that influence proliferation and survival of L-Myc-induced transforming
cells, a model of early stage SCLC. We will also determine the significance of BCAA metabolism in tumor
development in vivo by setting up variable conditions that mimic different outcomes of the metabolic reaction
using a BCAA-defined diet. Aim 3: To test alterations in BCAA metabolites as biomarkers for BCAT1-
dependent SCLC development, we will monitor changes in plasma BCAA and BCKA levels during SCLC
development in vivo and examine the clinical correlation of plasma levels of these metabolites with a SCLC
diagnosis. The expected outcome of this proposal will provide critical insights into novel strategies for targeted
prevention using minimally invasive detection methods and intervention using low-toxicity drugs or nutrition."	Affect;Anabolism;Biochemical;Biogenesis;Biological Markers;Branched-Chain Amino Acids;Cancer Patient;Cause of Death;Cells;Chemoprevention;Chronic;Clinic;Clinical;Cytotoxic Chemotherapy;Data;Dependence;Detection;Development;Diagnosis;Diet;Disease;Drug toxicity;Early Diagnosis;Enzymes;Essential Amino Acids;Eukaryotic Initiation Factors;Family;Genes;Genetically Engineered Mouse;Glioblastoma;Glutamates;Goals;Growth;Homeostasis;Human;Individual;Intervention;Isoleucine;Keto Acids;Kinetics;Knock-out;Knowledge;Leucine;Literature;Lung Adenocarcinoma;Malignant neoplasm of lung;Measurable;Mediating;Metabolic;Metabolic stress;Metabolism;Methods;Modeling;Molecular;Monitor;Mus;Nitrogen;Nutrient;Oncogenic;Outcome;Pathway interactions;Patient-Focused Outcomes;Patients;Pharmacology;Physiology;Plasma;Prevention;Prevention strategy;Protein Biosynthesis;Proteins;Publishing;Reaction;Resistance;Ribosomes;Role;Route;Sampling Studies;Smoker;Stress;TP53 gene;Testing;Therapeutic;Toxic effect;Translations;Tumor stage;United States;Validation;Valine;Woman;alpha ketoglutarate;amino acid metabolism;amino group;biological adaptation to stress;branched-chain-amino-acid transaminase;cancer cell;cancer diagnosis;cancer type;cell transformation;early detection biomarkers;endoplasmic reticulum stress;genetic signature;high risk;high risk population;improved;in vivo;inhibitor/antagonist;insight;knock-down;lung small cell carcinoma;men;minimally invasive;mortality;mouse development;novel;novel strategies;nutrient deprivation;nutrition;potential biomarker;premalignant;prevent;prospective;public health relevance;small hairpin RNA;small molecule inhibitor;tumor;tumor growth;tumor metabolism;tumorigenic	UNIVERSITY OF VIRGINIA	CHARLOTTESVILLE	VA	UNITED STATES	Kwon-Sik Park	Eva Szabo	430949	430949	2020-08-18T12:08:00Z	2018-09-10T12:09:00Z	2023-08-31T12:08:00Z	PAR-16-051	nofo_PAR-16-051
5U01CA224276-02	U01CA224276	9788304	2019	Phenotype Interactions in SCLC Development and Detection	"PROJECT SUMMARY
 Small Cell Lung Carcinoma (SCLC) is an aggressive neuroendocrine subtype of lung cancer. SCLC
patients have a very low 5-year survival, in part because SCLC tumors are often detected at a late stage when
the tumors have already metastasized and treatment outcomes are worse. Thus, early detection becomes
critical to achieve better treatment results. Emerging evidence supports the idea that, while SCLC tumors seem
homogeneous when examined under a microscope, these tumors contain a significant level of intra-tumoral
heterogeneity. Indeed, recent observations by our group and others have identified distinct cellular phenotypes
in SCLC, including in primary human tumors, in cell lines derived from human tumors, and in tumors from
genetically-engineered mouse models. Importantly, data from our group indicate that these cellular phenotypes
contribute to SCLC development. The specific goal of this proposal is to elucidate how different cellular
subpopulations within SCLC tumors drive early SCLC development, dynamics, and growth and to leverage this
mechanistic information to identify biomarkers for early detection and prevention of SCLC.
 We have previously identified tumor-propagating cells (TPCs) in SCLC tumors and found that these cells
are neuroendocrine and strongly tumorigenic. We have also characterized cell populations derived from these
TPCs with distinct phenotypes, including non-neuroendocrine NOTCH+ and CD44+ subpopulations, that
promote the growth and survival of the neuroendocrine TPCs. Leveraging these findings as well as our unique
genetic mouse models that allow dissection of SCLC phenotype evolution, we will investigate how cell-cell
interactions of these distinct SCLC cell phenotypes contribute to tumor development and growth, in relationship
with the tumor microenvironment. We will also elucidate the role of secretory factors released by these SCLC
subpopulations in driving survival, growth, and phenotype composition of SCLC tumors. Finally, we will
perform analysis of cfDNA and proteins (including on exosomes) present in SCLC patient plasma for
identification of related markers of SCLC development and early detection. We will also follow up on intriguing
findings that germline mutations in NOTCH are present in a large fraction of SCLC patients, suggesting a
potential risk marker beyond smoking.
 This interdisciplinary basic-translational project will elucidate fundamental mechanisms of SCLC
development and may lead to novel methods for early detection and/or prevention of SCLC."	ASCL1 gene;Affect;Automobile Driving;Biological Assay;Biology;Biopsy Specimen;CD44 gene;Cell Communication;Cell Line;Cell Survival;Cells;Chromatin;Clinical Markers;Collection;Computerized Medical Record;DNA;DNA Sequence Alteration;Data;Detection;Development;Diagnostic radiologic examination;Disease;Disease susceptibility;Dissection;Early Diagnosis;Ecosystem;Epithelial Cells;Event;Evolution;Genes;Genetic;Genetically Engineered Mouse;Germ-Line Mutation;Goals;Growth;Growth and Development function;Heterogeneity;Human;In Vitro;Intervention;Lead;Link;Lung;MAP Kinase Gene;MYC Gene Amplification;Maintenance;Malignant Epithelial Cell;Malignant neoplasm of lung;Mesenchymal;Methods;Microscope;Molecular;Mus;Mutation;Neoplasm Metastasis;Neuroendocrine Cell;Neuroendocrine Tumors;Neurosecretory Systems;PTEN gene;Patients;Phenotype;Plasma;Plasma Proteins;Population;Predisposition;Prevention;Proteins;RB1 gene;Recurrence;Risk Marker;Role;Sampling;Smoking;Source;Supporting Cell;TP53 gene;Testing;Transplantation;Treatment outcome;Tumor-Derived;Work;base;biomarker validation;cancer stem cell;cell free DNA;cell growth;cell type;clinically relevant;early detection biomarkers;exosome;experimental study;extracellular vesicles;follow-up;human data;in vivo;lung small cell carcinoma;macrophage;mouse model;neoplastic cell;notch protein;novel;novel strategies;outcome forecast;protein biomarkers;release factor;self-renewal;single-cell RNA sequencing;tumor;tumor growth;tumor heterogeneity;tumor initiation;tumor microenvironment;tumor progression;tumorigenesis;tumorigenic;virtual	VANDERBILT UNIVERSITY	Nashville	TN	UNITED STATES	Alissa M Weaver	Eva Szabo	306036	306036	2019-08-27T12:08:00Z	2018-09-19T12:09:00Z	2023-08-31T12:08:00Z	PAR-16-051	nofo_PAR-16-051
5U01CA224326-02	U01CA224326	9645624	2019	Studies of the initiation and progression of small cell lung cancer using cells derived by differentiation from human pluripotent stem cells	"PROJECT SUMMARY
 Small cell lung cancer (SCLC) is an especially virulent form of lung cancer that is
only transiently responsive to therapy and kills about 30,000 Americans each year.
Based on a more general interest in understanding why certain kinds of cancers have
characteristic genotypes, we are developing methods for studying the initiation of human
cancers by genetically modifying cells at discrete stages of differentiation after chemical
induction of specific lineages from human embryonic stem cells (hESCs). We have
extended recently published methods for inducing hESCs to form parts of the pulmonary
lineage by perturbing NOTCH signaling and reducing expression of the RB1 gene (one of
the two genes commonly inactivated in SCLC); in this way, we have prepared cultures
with high proportions of pulmonary neuroendocrine cells (PNECs), the putative
precursors of SCLC. Moreover, by also reducing expression of P53, the other gene
commonly inactivated in SCLC, PNEC-containing cultures are able to produce small
tumors resembling SCLC when implanted in immune-deficient mice.
 We now propose to expand our studies of this promising model for studying the
origins of SCLC in several ways: by determining the mechanisms by which interference
with NOTCH and RB1 generates PNECs; by exploring several possible assays for the
SCLC-like phenotype we have recently observed; by defining the similarities between the
genetic and physiological features of the SCLCs derived from hESCs and the SCLCs
arising in human patients; and by making induced pleuropotent stem cells (iPSCs) from
normal and tumor cells from patients with lung cancer, especially SCLC, in an effort to
seek genetic risk factors for SCLC. Through these studies, we expect to generate new
information and ideas about risk assessment, prevention, diagnosis, and treatment for
SCLC.
!"	American;Animals;Biological Assay;Cancer Control;Cancer Patient;Cell Culture Techniques;Cell Differentiation process;Cell Line;Cell Lineage;Cells;Characteristics;Chemicals;Collaborations;Data;Diagnosis;Disease;Early Diagnosis;Event;Frequencies;Genes;Genetic;Genomics;Genotype;Human;Immune;Implant;Individual;Lung;Malignant Neoplasms;Malignant neoplasm of lung;Methods;Modeling;Molecular;Mus;Mutate;Mutation;Nature;Neuroendocrine Cell;Normal Cell;Notch Signaling Pathway;Oncogenic;Pathogenesis;Patients;Phenotype;Physiological;Prevention;Process;Production;Protocols documentation;Public Health;Publishing;RB1 gene;Receptor Down-Regulation;Risk Assessment;Role;Signal Transduction;Stem cells;Study models;TP53 gene;Therapeutic;Time;Totipotent;Tumor Suppressor Genes;Tumor-Derived;Virulent;Work;base;cell type;experimental study;gamma secretase;genetic risk factor;genetically modified cells;high risk;human embryonic stem cell;human embryonic stem cell line;human pluripotent stem cell;interest;lung small cell carcinoma;model development;neoplastic cell;notch protein;novel strategies;prevent;stem cell technology;therapeutic target;transcriptome;tumor;unpublished works	WEILL MEDICAL COLL OF CORNELL UNIV	NEW YORK	NY	UNITED STATES	Harold E. Varmus	Eva Szabo	448281	448281	2019-01-29T12:01:00Z	2018-02-09T12:02:00Z	2023-01-31T12:01:00Z	PAR-16-051	nofo_PAR-16-051
5U01CA231851-02	U01CA231851	9788319	2019	Molecular mechanisms of SCLC initiation and detection in mice and humans	"Small cell lung carcinoma (SCLC) is one of the deadliest cancers, a “recalcitrant” cancer for which there
is no effective treatment except when the disease is diagnosed early. However, only a small fraction of patients
are diagnosed early in disease. The greatest challenge to early diagnosis is that SCLC tumor cells typically
acquire an exceptional mutation burden and metastasize early, so for most patients disease has spread
beyond the lung at the time of diagnosis. The key to developing effective early diagnosis and treatment
methods is to elucidate the earliest molecular and cellular events of tumor initiation to uncover ones that can
be detected by screening during the premalignant phase of the disease. The goal of this proposal is to define
the early, premalignant molecular and cellular events of SCLC, so that they can be detected early and
destroyed before they become a deadly, untreatable disease.
 SCLC is a neuroendocrine cancer. The prominent cell of origin is pulmonary neuroendocrine (NE) cells,
neurosensory and neurosecretory epithelial cells that sense and respond to the environment in the lung.
Recently, a minor subpopulation of NE cells was found to have stem cell activity, proliferating, dispersing, and
replenishing the surrounding bronchial epithelium following severe airway injury. Loss of tumor suppressors Rb
and p53 constitutively activates the stem cell program within days of loss of the tumor suppressors, even in the
absence of injury. In this proposal, a combination of genetics, cell culture, and single-cell genomics is used to
systematically interrogate these stem cells at cellular resolution, both in healthy lungs and in the early,
premalignant stage of SCLC. The goal is to define the molecular events immediately following loss of Rb and
p53 that constitutively activate the stem cell program and initiate their transformation into cancer stem cells that
spread, mutate, and escape immune destruction, and to identify the signals they secrete that might allow the
tumors to be detected before they become deadly."	Cell Culture Techniques;Cell Proliferation;Cells;Data;Detection;Diagnosis;Disease;Early Diagnosis;Early treatment;Environment;Epithelial Cells;Epithelium;Event;Gene Expression Profile;Genetic;Genetic Engineering;Genetically Engineered Mouse;Genomic approach;Genomics;Goals;Human;Human Genetics;Immune;Individual;Injury;Life Expectancy;Limited Stage;Lung;Malignant Neoplasms;Methods;Minor;Molecular;Mus;Mutate;Mutation;Neoplasm Metastasis;Neuroendocrine Cell;Neuroendocrine Tumors;Neuropeptides;Neurosecretory Systems;Non-Invasive Cancer Detection;Oncogenic;Paraneoplastic Syndromes;Patients;Peptides;Phase;Premalignant;Process;Proliferating;Resected;Resolution;Signal Transduction;Specimen;Stem cells;Survival Rate;TP53 gene;Time;Tumor Initiators;Tumor Suppressor Proteins;Widespread Disease;base;bronchial epithelium;cancer stem cell;early detection biomarkers;effective therapy;injured;injured airway;injury and repair;insight;lung small cell carcinoma;mouse model;neoplastic cell;neurosensory;new therapeutic target;novel;novel strategies;programs;screening;single-cell RNA sequencing;stem cell population;tumor;tumor behavior;tumor initiation	STANFORD UNIVERSITY	STANFORD	CA	UNITED STATES	Mark A Krasnow	Eva Szabo	573067	573067	2019-08-15T12:08:00Z	2018-09-19T12:09:00Z	2023-08-31T12:08:00Z	PAR-16-051	nofo_PAR-16-051
5U01CA213285-03	U01CA213285	9762873	2019	Development of Risk and Early Detection Biomarker for Small Cell Lung Cancer	"ABSTRACT
The goal of this proposal by a multi-disciplinary team at MD Anderson Cancer Center, the
University of Texas Southwestern Cancer Center and the University of Pittsburg Cancer Center
is to explore approaches based on circulating protein markers and autoantibodies to develop a
blood based marker panel to assess risk of harboring or developing small cell lung cancer
(SCLC). There are currently several established SCLC protein markers which individually lack
sufficient performance for early detection. Additionally, the applicant group has uncovered
several protein marker candidates through integrated analyses of mouse models and human
SCLC samples. To assess the potential of established and newly discovered candidate markers
to yield a combined panel of markers indicative of risk of harboring or developing SCLC,
validation studies will be conducted using plasma samples collected up to 5 years prior to a
diagnosis of SCLC, from participants in the large European Prospective Investigation into
Cancer and Nutrition (EPIC) and the Singapore Chinese Health Study (SCHS) cohorts.
Additonally, plasmas collected at the time of diagnosis of SCLC and post-treatment as well as
tissue molecular profiles will be interrogated to establish the biological relevance to candidates
to SCLC. Two approaches will be implemented to identify antigenic proteins and peptides that
induce autoantibodies that can be mined for SCLC early detection. One consisting of Ig bound
proteins in plasmas from SCLC cases and another novel approach consists of interrogating
whole genome derived peptide arrays for reactivity with aliquots of SCLC plasmas utilized for
validation of circulating proteins. The resulting combination of the most promising markers will
be further validated using pre-diagnostic SCLC samples and matched controls from the US
Prostate Lung Colon and Ovarian (PLCO) cohort. The applicant group has a substantial track
record of collaboration and expertise relevant to project objectives, with rigor in experimental
design for discovery and validation studies of lung cancer biomarkers.  "	Aftercare;Aliquot;Autoantibodies;Binding Proteins;Biological;Biological Assay;Blinded;Blood;Blood Tests;Cancer Center;Cancer and Nutrition;Cell Line;Chinese People;Code;Cohort Studies;Collaborations;Colon;Data;Development;Diagnosis;Diagnostic;Disease;Early Diagnosis;Epitopes;European;Experimental Designs;Future;Goals;Health;Human;Human Genome;Image;Immune response;Individual;Investigation;Lead;Lung;Malignant Neoplasms;Malignant neoplasm of lung;Mass Spectrum Analysis;Modeling;Molecular Profiling;Newly Diagnosed;Non-Small-Cell Lung Carcinoma;Ovarian;Paraneoplastic Syndromes;Participant;Pathway Analysis;Peptides;Performance;Plasma;Plasma Proteins;Prospective cohort;Prostate;Proteins;Risk;Risk Assessment;Sampling;Signal Transduction;Singapore;Technology;Testing;Texas;Time;Tissues;Tumor Antigens;Tumor Tissue;Universities;Validation;antigen binding;base;biomarker panel;blood-based biomarker;cancer biomarkers;cancer risk;cancer therapy;candidate marker;candidate validation;cohort;early detection biomarkers;effective therapy;follow-up;high risk;improved;lung cancer screening;lung small cell carcinoma;mortality;mouse model;multidisciplinary;mutant;novel strategies;predictive marker;prospective;protein biomarkers;screening;specific biomarkers;success;treatment response;validation studies;whole genome	UNIVERSITY OF TX MD ANDERSON CAN CTR	HOUSTON	TX	UNITED STATES	Samir M Hanash	Eva Szabo	491462	491462	2019-08-14T12:08:00Z	2017-09-06T12:09:00Z	2022-08-31T12:08:00Z	PAR-16-051	nofo_PAR-16-051
