project_num	core_project_num	appl_id	fiscal_year	project_title	abstract_text	pref_terms	org_name	org_city	org_state	org_country	principal_investigators	program_officers	award_amount	agency_ic_fundings	award_notice_date	project_start_date	project_end_date	full_foa	api_source_search
5U01CA235625-02	U01CA235625	9888352	2020	Employing CRISPR inactivation screening and in vivo models towards improving treatments for SCLC	"SUMMARY
With a lack of druggable oncogenic mutations in small cell lung cancer (SCLC) and no approved targeted
therapies, we need to identify new treatment approaches for SCLC. In this proposal, we apply whole genome
CRISPR inactivation screens to identify genes that are essential for SCLC broadly, or for key genetically defined
subsets. We then determine whether pharmacologic inhibition of identified hits also results in selective killing of
SCLC cells. We apply in vivo systems including patient derived xenograft (PDX) and genetically engineered
mouse models to test pharmacologic inhibitors of key targets identified in these genetic screens. Aim 1 will focus
on a pathway that we already identified using CRISPR inactivation screens to be essential for Rb/p53-mutant
SCLC cells. Components of a NEDD8/RBX1 pathway, controlling Cullin activity and protein ubiquitylation, were
essential for SCLC cells. Pharmacologic inhibition of NEDD8 activating enzyme (NAE) using MLN4924 in patient
derived xenograft (PDX) models confirmed reliance of SCLC cells on this pathway. Excitingly, we identified
examples of exceptional responses to MLN4924 in some PDX models. Aim 1: Apply in vivo models to direct
NEDD8 inhibition to subsets of SCLC most likely to respond. Here, we explore the potential for inhibiting
the NEDD8 pathway in SCLC. We will combine NAE inhibition with cisplatin-etoposide chemotherapy and
determine whether durable responses result. Some SCLC PDX models exhibited exquisite sensitivity to NAE
inhibition; we will identify underlying mechanisms and genetic features of super-responding PDX models that
could be used to help predict exceptional responders. We will determine whether NAE inhibition should be
directed to all SCLC patients, or to key subsets, and whether this approach augments response to chemotherapy.
MLN4924 is already being tested in clinical trials for other cancer types and this work could rapidly lead to clinical
trials in SCLC. Aim 2: Apply CRISPR inactivation screens to identify new therapeutic targets for SCLC.
This Aim will extend our CRISPR inactivation screens to include mouse SCLC cell lines with key driver mutations
beyond Rb/p53, including Pten, Crebbp and Mycl. Our approach takes advantage of the fact that while human
SCLC has an extremely high mutational burden, leading to extensive heterogeneity among SCLC with a given
driver mutation, mouse SCLC with defined driver alterations are more homogenous, increasing signal to noise
in identifying vulnerabilities. We will identify dependencies in genetically-defined subsets of SCLC and will test
inhibitors of identified druggable targets in PDX and GEM models that harbor defined genetic alterations. We
leverage available mouse models and derived cell lines, along with a bank of genetically annotated PDX models,
studied in vivo and ex vivo, to identify and evaluate completely new ways to target key genetic subsets of SCLC."	Biology;Cancer Model;Cancer Patient;Cancer cell line;Cell Death;Cell Line;Cisplatin;Clinical Trials;Clustered Regularly Interspaced Short Palindromic Repeats;Cullin Proteins;Dependence;Enzyme Inhibition;Enzymes;Epithelial;Epithelium;Essential Genes;Etoposide;Exhibits;Gene Deletion;Genes;Genetic;Genetic Models;Genetic Screening;Genetic Transcription;Genetically Engineered Mouse;Genotype;Goals;Heterogeneity;Human;Lead;Link;Lung;MYCL1 gene;Modeling;Molecular;Mus;Mutate;Mutation;Neuroendocrine Tumors;Noise;Oncogenic;Pathway interactions;Patients;Pharmacology;Proteins;RBX1 gene;Signal Transduction;System;TP53 gene;Testing;Therapeutic;Tumor Cell Line;Tumor Volume;Work;Xenograft Model;Xenograft procedure;base;cancer cell;cancer type;chemotherapy;driver mutation;drug sensitivity;druggable target;efficacy testing;exceptional responders;gene function;improved;in vivo;in vivo Model;inhibitor/antagonist;knock-down;lung small cell carcinoma;mouse model;mutant;neuroendocrine differentiation;new therapeutic target;novel;novel strategies;novel therapeutics;overexpression;programs;response;screening;small molecule inhibitor;targeted treatment;tumor;whole genome	FRED HUTCHINSON CANCER RESEARCH CENTER	SEATTLE	WA	UNITED STATES	David Macpherson	Suzanne L Forry	641606	641606	2020-01-31T12:01:00Z	2019-03-08T12:03:00Z	2024-02-29T12:02:00Z	PAR-16-049	nofo_PAR-16-049
5U01CA220323-03	U01CA220323	9997807	2020	Using patient-derived models to understand drug responses in SCLC	"PROJECT SUMMARY
Small cell lung cancer (SCLC) afflicts more than 30,000 patients per year and is rapidly fatal in 95% of cases,
with median survival is less than one year. Belying this grim prognosis, treatment-naive SCLC is highly
sensitive to chemotherapy, with response rates in excess of 70% for etoposide/platinum. However, relapse is
nearly inevitable, and relapsed SCLC presents two obstacles that have been insurmountable for at least 30
years: cross-resistance to chemotherapy, and absence of biomarker-driven targeted therapy.
Following relapse, resistance often extends beyond etoposide/platinum, and a disease that was once highly
chemosensitive becomes inexorably progressive. However, the molecular determinants of cross-resistance in
SCLC remain unclear. Although critically important, cross-resistance is difficult to study experimentally, as it
requires a model system that faithfully reproduces clinical outcomes.
Topotecan is the only approved second-line therapy, but NCCN guidelines list 10 agents of nearly equivalent
efficacy. None are particularly effective in unselected patients, and although there is significant molecular
heterogeneity in SCLC, this does not guide patient selection. As novel targets and therapeutic regimens
emerge, biomarker discovery will require a model system that recapitulates the molecular features of patient
tumors, so that molecular heterogeneity can be parsed into clinically meaningful subgroups.
We have generated a panel of 44 SCLC patient-derived xenograft models (PDXs) from biopsy specimens and
circulating tumor cells (CTCs). Our panel includes successive models from individual patients at time points
before and after specific lines of therapy, with detailed information about the corresponding clinical response.
For both standard chemotherapy and experimental agents in clinical trial, these models faithfully mirror patient
responses. However, unlike the patient experience, multiple strategies can be compared for identical tumors.
We propose to use these models to directly compare standard first and second-line chemotherapy with two
experimental regimens that have given promising results in the clinic or in preclinical assays: olaparib plus
temozolomide, in a phase I/II trial at MGH, and a combined Mcl-1/Bcl-2 inhibitors. Individually, these PDX
population trials are designed to reveal biomarkers of sensitivity and mechanisms of resistance for promising
experimental therapies. Collectively, they present a novel opportunity to model cross-resistance through
comparative analysis with reference to the clinical histories of each model.
The successful completion of this work will establish a large collection of PDX models with comprehensive
molecular an functional profiles. In addition, these experiments will investigate the molecular determinants of
cross-resistance following chemotherapy, a problem that has beleaguered management of SCLC for over
three decades."	Aftercare;Apoptotic;BCL2 gene;Biological Assay;Biological Markers;Biological Models;Biopsy;Biopsy Specimen;Blood specimen;Cancer Patient;Cancer cell line;Cisplatin;Clinic;Clinical;Clinical Trials;Collection;Communities;DNA Damage;Dependence;Development;Diagnosis;Disease;Dissection;Etoposide;Frequencies;Guidelines;Heterogeneity;Human;In Vitro;Investigational Therapies;MCL1 gene;Malignant Neoplasms;Methods;Modeling;Molecular;Molecular Profiling;Mus;Mutation Spectra;National Comprehensive Cancer Network;Neoplasm Circulating Cells;Outcome;Patient Selection;Patients;Pattern;Pharmaceutical Preparations;Pharmacology Study;Phase I/II Trial;Platinum;Population;Proteomics;Recording of previous events;Regimen;Relapse;Resistance;Resources;Specimen;Subgroup;System;Therapeutic;Time;Topotecan;United States;Work;Xenograft Model;Xenograft procedure;anticancer research;base;biomarker discovery;biomarker-driven;cancer therapy;candidate marker;chemotherapy;comparative;compare effectiveness;drug sensitivity;early phase clinical trial;effusion;exome sequencing;experience;experimental study;genome sequencing;in vivo;individual patient;inhibitor/antagonist;lung small cell carcinoma;neoplastic cell;novel;novel marker;novel therapeutic intervention;novel therapeutics;outcome forecast;patient population;patient response;pre-clinical;relapse patients;repaired;resistance mechanism;response;targeted treatment;temozolomide;transcriptome sequencing;trial design;tumor	MASSACHUSETTS GENERAL HOSPITAL	BOSTON	MA	UNITED STATES	Nicholas J Dyson	Suzanne L Forry	619923	619923	2020-08-25T12:08:00Z	2018-09-17T12:09:00Z	2023-08-31T12:08:00Z	PAR-16-049	nofo_PAR-16-049
5U01CA242919-02	U01CA242919	9980811	2020	Exploiting POU2F3 addiction in the tuft cell variant of small cell lung cancer	"Project Summary
Small cell lung cancer (SCLC) is the most aggressive form of lung cancer, which is associated with a high mitotic
rate, early metastatic spread, and a rapid evolution of chemotherapy resistance. We recently discovered a novel
form of SCLC that resembles the tuft cell lineage, which can be distinguished from the classical neuroendocrine
form of this disease through immunohistochemical staining of POU2F3. Importantly, we have identified several
molecular vulnerabilities that are specific to the variant form of this disease. In this research proposal, we seek
to advance personalized therapies that exploit the unique lineage program present in the tuft cell variant of SCLC.
Our innovative functional genomics strategy has already uncovered actionable dependencies that are unique to
tuft cell variant of SCLC, such as the kinase IGF1R. In addition, we discovered a profound addiction of tuft cell
variant SCLC tumors to POU2F3. Here we will investigate the molecular basis of POU2F3 addiction in SCLC,
with the explicit intent to develop small molecules that interfere with POU2F3 function. The first Aim of this
proposal will build upon the extensive epigenomic analyses we have performed in SCLC, which has defined a
unique enhancer landscape sustained by POU2F3 in this disease. We will now employ two independent
functional approaches to elucidate the critical POU2F3 binding sites/enhancers in the genome of SCLC cells,
which will be leveraged to pinpoint the critical components of the tuft cell lineage circuit that might be targeted
therapeutically. The second Aim will evaluate POU2F3 cofactors, which we have already nominated via an
innovative ChIP-SICAP-mass spectrometry analysis of endogenous POU2F3 binding sites. We will perform
CRISPR exon scanning and biochemical analysis of each cofactor to define the critical POU2F3:cofactor
interactions that selectively support this malignancy. The final Aim of this proposal will employ functional
genomics to devise drug combinations with the IGF1R inhibitor linsitinib that are rational and exploit synthetic-
lethal genetic interactions. We will also employ our latest CRISPR innovation, homolog co-targeting CRISPR
screens, to expose redundant kinase vulnerabilities that are linked with neuroendocrine versus tuft cell variants
of SCLC. In summary, we estimate that the tuft cell-like variant is present in ~18% of SCLC cases, which
corresponds to approximately 5,000 newly diagnosed SCLC cases and approximately 3,500 deaths in the United
States alone each year. Hence, the proposed research could lead to a sustained impact that affects a large
patient population for which novel medicines are desperately needed."	Affect;Avena sativa;Basic Science;Binding Sites;Biochemical;CRISPR screen;Cancer cell line;Cell Lineage;Cells;Cellular Morphology;Cessation of life;Characteristics;Chromatin;Clustered Regularly Interspaced Short Palindromic Repeats;Combined Modality Therapy;Complex;Data;Dependence;Disease;Drug Combinations;Elements;Enhancers;Epigenetic Process;Epithelial;Epithelium;Evolution;Exons;Exposure to;Gastrointestinal tract structure;Genes;Genetic;Genetic Screening;Genome;Genomic approach;Goals;Growth;Homologous Gene;Human;Insulin-Like-Growth Factor I Receptor;Lead;Libraries;Link;Lung;Lung Neuroendocrine Neoplasm;Maintenance;Malignant Neoplasms;Malignant neoplasm of lung;Maps;Mass Spectrum Analysis;Medicine;Methods;Mitotic;Molecular;Neuroendocrine Cell;Neurosecretory Systems;Newly Diagnosed;Phosphotransferases;Proteins;Publishing;Regulatory Element;Research;Research Proposals;Resistance;Respiratory System;Sampling;Scanning;Signal Transduction;Stains;Structure;Techniques;Technology;Therapeutic Intervention;Tumor Subtype;United States;Variant;Work;addiction;cancer cell;cell type;chemotherapy;clinical translation;cofactor;drug discovery;epigenomics;experimental study;functional genomics;genomic platform;inhibitor/antagonist;innovation;lung small cell carcinoma;novel;patient population;personalized medicine;preclinical study;programs;small molecule;targeted treatment;transcription factor;tumor	COLD SPRING HARBOR LABORATORY	COLD SPRING HARBOR	NY	UNITED STATES	Christopher Vakoc	Suzanne L Forry	439200	439200	2020-07-22T12:07:00Z	2019-08-01T12:08:00Z	2024-07-31T12:07:00Z	PAR-16-049	nofo_PAR-16-049
5U01CA213273-04	U01CA213273	9974992	2020	Novel therapeutic approaches for enhancing anti-tumor immunity in SCLC	"PROJECT SUMMARY
Small cell lung cancer (SCLC) is a highly lethal malignancy for which new therapeutic strategies are
desperately needed. One promising avenue is the use of immunotherapy (IMT) agents such as PD-1/PD-L1
pathway inhibitors. Despite its high mutation burden, however, data from our group and others indicate that
SCLC paradoxically has an immunosuppressed phenotype with relatively low levels of infiltrating T-cells,
reduced antigen presentation, and increased levels of CD47, a suppressor of myeloid function. Furthermore,
initial clinical testing suggests that most SCLC tumors often express low or very low levels of PD-L1 and fail to
respond to PD-1 inhibitor monotherapy; IMT resistance also inevitably emerges in responding tumors by
mechanisms that have not yet been characterized. Thus, immunosuppressive mechanisms other than the PD-
1/PD-L1 pathway are likely to play a major role in SCLC, and novel therapeutic approaches and combination
therapies are needed to realize the potential of IMT in SCLC.
The goal of this proposal is to address this issue by identifying new IMT targets and novel combination
regimens, and to rapidly translate them into the clinic. Our team already has promising leads. First, we
identified that SCLC is highly vulnerable to drugs targeting DNA damage repair (DDR) including PARP and
Chk1 inhibitors, a finding now supported by early clinical results. Our preliminary data further suggest that DDR
inhibition may increase PD-L1 expression and, by increasing the production of tumor-associated neoantigens
(TAA), may sensitize tumors to IMT. In Aim 1, we will test whether DDR inhibitors can increase the expression
of TAAs, and enhance the efficacy of PD-1/PD-L1 inhibitors. Second, we have developed a novel strategy for
protecting immune cells from the cytotoxic effects of chemotherapy by using inhibitors of CDK4/6, which can
be used to protect immune cells, but not RB-deficient SCLC cells. In Aim 2, we will test whether CDK4/6
inhibition can enhance the anti-tumor effects of immune cells by protecting them from chemotherapy-induced
cytotoxicity and enable improved chemotherapy/IMT combinations in SCLC. Third, we have identified the
“don't-eat-me” signal CD47 as a novel IMT target for SCLC; blockade of CD47 effectively promotes the
phagocytosis of SCLC cells by macrophages and inhibits tumor growth. In Aim 3, we will test whether targeting
this CD47 myeloid checkpoint can enhance antitumor immunity and the efficacy of PD-1/PD-L1 blockade and
chemotherapy in vivo in SCLC models.
The overall hypothesis tested here is that antitumor immunity can be enhanced in SCLC by targeting all these
processes, leading to more effective IMT combination regimens. These studies will be facilitated by novel
immune-competent pre-clinical murine SCLC models that we have developed and by a multidisciplinary team
including clinical and laboratory investigators, immunologists, pathologists, and others with a record of
innovation in SCLC and IMT and a track record of translating laboratory findings into the clinic."	Address;Anti-CD47;Antigen Presentation;Biopsy;CD47 gene;CDK4 gene;CHEK1 gene;Cancer Model;Cancer Patient;Cell Cycle Arrest;Cell surface;Cells;Cellular immunotherapy;Clinic;Clinical;Combination immunotherapy;Combined Modality Therapy;Cyclin-Dependent Kinase Inhibitor 2A;Cytoprotection;DNA Damage;DNA Repair;Data;Disease;Drug Targeting;Eating;Goals;Growth;Immune;Immunocompetent;Immunologic Markers;Immunologist;Immunotherapeutic agent;Immunotherapy;In Vitro;Infiltration;Laboratories;Laboratory Finding;Malignant Neoplasms;Mediating;Minority;Mus;Mutation;Myelogenous;Natural Killer Cells;Nature;Non-Small-Cell Lung Carcinoma;PD-1 inhibitors;PD-1/PD-L1;PD-L1 blockade;PDL1 inhibitors;PDL1 pathway;Pathologist;Pathway interactions;Patients;Phagocytosis;Phenotype;Play;Pre-Clinical Model;Process;Production;Regimen;Research Personnel;Resistance;Role;Signal Transduction;Surface;T-Lymphocyte;Testing;Therapeutic;Topotecan;Toxic effect;Translating;Tumor Antigens;Tumor Immunity;Tumor-infiltrating immune cells;antitumor effect;base;cancer cell;chemotherapy;cytotoxic;cytotoxicity;early phase clinical trial;immune checkpoint blockade;immunosuppressed;improved;in vivo;in vivo evaluation;inhibitor/antagonist;innovation;lung small cell carcinoma;macrophage;mouse model;multidisciplinary;neoantigens;neoplastic cell;novel;novel strategies;novel therapeutic intervention;phase II trial;pre-clinical;programmed cell death ligand 1;programmed cell death protein 1;research clinical testing;response;standard care;targeted agent;tumor;tumor growth;tumorigenic;virtual	UNIVERSITY OF TX MD ANDERSON CAN CTR	HOUSTON	TX	UNITED STATES	Lauren Averett Byers, John V Heymach, Julien Sage	Suzanne L Forry	702580	702580	2020-07-29T12:07:00Z	2017-08-01T12:08:00Z	2022-07-31T12:07:00Z	PAR-16-049	nofo_PAR-16-049
5U01CA231776-03	U01CA231776	9987580	2020	Bioinformatic-Chemical Approach to Credential Molecular Targets to Combat Rapid Chemo-Radiation Resistance in SCLC	"PROJECT ABSTRACT
Limited stage small cell lung cancer (LS SCLC), the only curable form of SCLC, is remarkably sensitive to
etoposide plus cisplatin combined with thoracic radiotherapy with response rates > 70%; however, therapy-
refractory recurrence is common. LS SCLC has less than a 25% 5-year overall survival (OS) and ultimately a
strategy for improving long-term SCLC outcomes needs to successfully target tumor cell populations that
survive standard therapy and give rise to recurrent disease. There is, however, a considerable gap in
understanding the specific mechanisms responsible for chemoradiotherapy resistance in SCLC. Our project is
unique among the current portfolio of SCLC funded programs in that we have focused on
chemoradioresistance to increase cure rates in LS SCLC. Recently, our work has suggested using patient-
derived xenograft (PDX) models of SCLC may be an important tool to elucidate mechanisms of therapy
resistance. This approach was remarkably successful, identifying a tolerable and strongly synergistic anti-
SCLC interaction that led to a CTEP-approved trial based on our preclinical data - (NCI #10070; Study Chair:
Hann). In this research program, we will test key hypotheses via three specific aims that will provide more
mechanistic insights into the rapidly emergent chemoradiation resistance observed in LS SCLC.
One central hypothesis of this proposal is that adaptive gene expression changes mediate rapid emergence of
the chemoradiation resistance phenotype in LS SCLC. We have developed a novel chemoradiation treatment
regimen with SCLC PDX models to facilitate these studies. Development and characterization of this novel
model involves a unique collaboration between medical oncologists, radiation oncologists, bioinformaticians,
medical physicists, veterinarians and molecular/cell biologists that is extremely well suited to develop an
integrated program dedicated to resolving questions of SCLC chemoradioresistance. Finally, we have already
identified novel gene targets that are correlated with SCLC chemoradioresistance.
Our research program is organized as follows: Aim #1: Characterize natural history of response of
experimental models of SCLC to chemoradiation in vivo. We will determine response rates and recurrence
patterns of a panel of SCLC PDXs and transgenic mouse models. Aim #2: Characterization of molecular
underpinnings of SCLC chemoradiation resistance. We will reconstruct gene regulatory networks and gene
expression profiles associated with chemoradiation resistance and develop small-scale predictive classifiers for
therapy response to be validated in follow-up studies. Aim #3: Pharmacologic and genetic validation of
candidate genes for SCLC chemoradiation resistance in vitro and in vivo. We will validate our novel gene
candidates for conferring chemoradiation resistance using pharmacologic and genetic approach with SCLC
PDX-derived organoids and SCLC transgenic mouse models."	BCL2 gene;Bioinformatics;Cancer Model;Cancer Therapy Evaluation Program;Candidate Disease Gene;Cell Line;Cells;Chemicals;Chest;Cisplatin;Clinical;Collaborations;Complex;Data;Development;Drug Combinations;Epigenetic Process;Etiology;Etoposide;Experimental Models;Expression Profiling;Follow-Up Studies;Funding;Gene Expression;Gene Expression Profiling;Gene Targeting;Genetic;Genetic Transcription;Genetically Engineered Mouse;Human;In Vitro;Limited Stage;Malignant Neoplasms;Mediating;Medical;Medical Oncologist;Modeling;Molecular;Molecular Target;Natural History;Organoids;Outcome;Pathway interactions;Patients;Pattern;Pharmacology;Phenotype;Population;Positioning Attribute;Radiation Oncologist;Radiation therapy;Recurrence;Recurrent disease;Refractory;Regulator Genes;Research;Research Design;Resistance;Signaling Protein;Techniques;Testing;Transgenic Mice;Treatment Protocols;Variant;Veterinarians;Work;Xenograft Model;Xenograft procedure;animal imaging;base;candidate validation;chemoradiation;chemotherapy;combat;genetic approach;improved;in vivo;inhibitor/antagonist;innovation;insight;irradiation;lung small cell carcinoma;mouse model;neoplastic cell;novel;pre-clinical;programs;resistance gene;resistance mechanism;response;therapy resistant;tool;transcription factor;transcriptome sequencing;tumor	JOHNS HOPKINS UNIVERSITY	BALTIMORE	MD	UNITED STATES	Christine L. Hann, Luigi Marchionni, Phuoc T. Tran	Suzanne L Forry	611606	611606	2020-08-05T12:08:00Z	2018-09-03T12:09:00Z	2023-08-31T12:08:00Z	PAR-16-049	nofo_PAR-16-049
