project_num	core_project_num	appl_id	fiscal_year	project_title	abstract_text	pref_terms	org_name	org_city	org_state	org_country	principal_investigators	program_officers	award_amount	agency_ic_fundings	award_notice_date	project_start_date	project_end_date	full_foa	api_source_search
5U24CA213274-07	U24CA213274	10653236	2023	Coordinating center for the NCI small cell lung cancer research consortium	"ABSTRACT
The overarching goal of the NCI Small Cell Lung Cancer (SCLC) Coordinating Center has been to “break the
logjam” of fundamental knowledge gaps resulting in a 30+ year lack of progress on this lethal malignancy that
was designated a “recalcitrant cancer” by the US Congress and NCI. Our U24 Coordinating Center has done
this by promoting and facilitating information sharing, interaction, and collaborative research among NCI-
supported investigators studying SCLC. Over our initial five years of support, this Coordinating Center has
significantly increased research progress within the SCLC research community through efforts including, but not
limited to, the creation and ongoing expansion of comprehensive preclinical and clinical -omics databases,
centralized annotation and cataloging of available SCLC models, distribution and sharing of such models,
centralized data analytics, a centralized Consortium website, initiation and coordination of an interactive work-
in-progress (“WIPs”) forum as well as planning and oversight of annual meetings. Of all of this, the role of the
Coordinating Center in facilitating interactive WIPs (usually with ~100 attendees from dozens of institutions
including patient advocates) with unprecedented information and resource sharing, has made possible
tremendous progress in overcoming knowledge gaps, all of which are documented in a large number of peer
reviewed publications. This renewal application will continue the exceptional research momentum the SCLC
Consortium has generated, and build on this initial success through support of new initiatives. These include
centralized support for databasing and comparative analysis of genetically-engineered mouse models (GEMMs),
and multi-parameter characterization of patient-derived xenograft models developed across the Consortium.
These additional resources will be of direct utility to the SCLC research community. As part of the U24 renewal,
given the remarkable growth in scope and diversity of SCLC research, we have developed a new multi-PI
structure including Charles Rudin (MSK), John Minna (UTSW), with addition of two exciting young SCLC
investigators who have contributed important new insights into SCLC molecular and cellular biology - Trudy
Oliver (University of Utah), and Lauren Byers (MDACC). All four have been personally very active both in the
U24 activities and in their own individual SCLC U01 and R01 research. The complementary strengths of this
leadership team cover all of the important areas of SCLC basic, translational, and clinical trials research. Dr.
Rudin will continue as contact PI, providing administrative leadership and coordination. We emphasize that the
products of the Consortium will ultimately benefit human health through fostering development of novel strategies
for disease prevention, early intervention, immune surveillance, metastasis suppression, and therapeutics."	Address;Administrative Coordination;Advocate;Area;Award;Bioinformatics;Biological;Biological Specimen database;Biometry;Cancer Model;Cataloging;Clinical;Clinical Trials;Collaborations;Collection;Communication;Communities;Complement;Congresses;Data;Data Analyses;Data Analytics;Databases;Development;Disease;Disease model;Early Diagnosis;Early Intervention;Epigenetic Process;Fostering;Funding;Funding Opportunities;Generations;Genetic Databases;Genetically Engineered Mouse;Goals;Grant;Growth;Health;Human;Immunologic Surveillance;Immunologics;Individual;Institution;Intervention;Knowledge;Leadership;Maintenance;Malignant Neoplasms;Metastasis Suppression;Modeling;Molecular and Cellular Biology;Mus;Oncogenic;Pathology;Patient-Focused Outcomes;Patients;Peer Review;Prevention;Prevention strategy;Principal Investigator;Proteomics;Publications;Research;Research Personnel;Resource Sharing;Resources;Role;Rotation;Secure;Societies;Structure;Sum;Teleconferences;Therapeutic;Therapeutic Research;Translational trial;Universities;University of Texas M D Anderson Cancer Center;Utah;Work;anticancer research;cancer immunotherapy;central database;clinical translation;cohort;comparative;design;disorder prevention;improved;in vitro Model;in vivo;innovation;insight;meetings;member;novel strategies;novel therapeutics;patient derived xenograft model;pre-clinical;repository;small cell lung carcinoma;success;synergism;tissue resource;transcriptomics;tumor;virtual;web site	SLOAN-KETTERING INST CAN RESEARCH	NEW YORK	NY	UNITED STATES	Lauren Averett Byers, John D. Minna, Trudy Gale Oliver, Charles M Rudin	Peter Ujhazy	1565497	1565497	2023-05-23T12:05:00Z	2022-06-24T12:06:00Z	2027-05-31T12:05:00Z	PAR-21-346	nofo_PAR21-346
2U24CA213274-06	U24CA213274	10525472	2022	Coordinating center for the NCI small cell lung cancer research consortium	"ABSTRACT
The overarching goal of the NCI Small Cell Lung Cancer (SCLC) Coordinating Center has been to “break the
logjam” of fundamental knowledge gaps resulting in a 30+ year lack of progress on this lethal malignancy that
was designated a “recalcitrant cancer” by the US Congress and NCI. Our U24 Coordinating Center has done
this by promoting and facilitating information sharing, interaction, and collaborative research among NCI-
supported investigators studying SCLC. Over our initial five years of support, this Coordinating Center has
significantly increased research progress within the SCLC research community through efforts including, but not
limited to, the creation and ongoing expansion of comprehensive preclinical and clinical -omics databases,
centralized annotation and cataloging of available SCLC models, distribution and sharing of such models,
centralized data analytics, a centralized Consortium website, initiation and coordination of an interactive work-
in-progress (“WIPs”) forum as well as planning and oversight of annual meetings. Of all of this, the role of the
Coordinating Center in facilitating interactive WIPs (usually with ~100 attendees from dozens of institutions
including patient advocates) with unprecedented information and resource sharing, has made possible
tremendous progress in overcoming knowledge gaps, all of which are documented in a large number of peer
reviewed publications. This renewal application will continue the exceptional research momentum the SCLC
Consortium has generated, and build on this initial success through support of new initiatives. These include
centralized support for databasing and comparative analysis of genetically-engineered mouse models (GEMMs),
and multi-parameter characterization of patient-derived xenograft models developed across the Consortium.
These additional resources will be of direct utility to the SCLC research community. As part of the U24 renewal,
given the remarkable growth in scope and diversity of SCLC research, we have developed a new multi-PI
structure including Charles Rudin (MSK), John Minna (UTSW), with addition of two exciting young SCLC
investigators who have contributed important new insights into SCLC molecular and cellular biology - Trudy
Oliver (University of Utah), and Lauren Byers (MDACC). All four have been personally very active both in the
U24 activities and in their own individual SCLC U01 and R01 research. The complementary strengths of this
leadership team cover all of the important areas of SCLC basic, translational, and clinical trials research. Dr.
Rudin will continue as contact PI, providing administrative leadership and coordination. We emphasize that the
products of the Consortium will ultimately benefit human health through fostering development of novel strategies
for disease prevention, early intervention, immune surveillance, metastasis suppression, and therapeutics."	Address;Administrative Coordination;Advocate;Area;Award;Bioinformatics;Biological;Biological Specimen database;Biometry;Cancer Model;Cataloging;Clinical;Collaborations;Collection;Communication;Communities;Complement;Congresses;Data;Data Analyses;Data Analytics;Databases;Development;Disease;Disease model;Early Diagnosis;Early Intervention;Ensure;Epigenetic Process;Fostering;Funding;Funding Opportunities;Generations;Genetic Databases;Genetically Engineered Mouse;Goals;Grant;Growth;Health;Human;Immunologic Surveillance;Immunologics;Individual;Institution;Intervention;Knowledge;Leadership;Maintenance;Malignant Neoplasms;Metastasis Suppression;Modeling;Molecular and Cellular Biology;Mus;Oncogenic;Pathology;Patient-Focused Outcomes;Patients;Peer Review;Prevention;Prevention strategy;Principal Investigator;Proteomics;Publications;Research;Research Personnel;Resource Sharing;Resources;Role;Secure;Societies;Structure;Sum;Teleconferences;Therapeutic;Therapeutic Human Experimentation;Universities;University of Texas M D Anderson Cancer Center;Utah;Work;anticancer research;cancer immunotherapy;central database;clinical translation;cohort;comparative;design;disorder prevention;improved;in vitro Model;in vivo;innovation;insight;lung small cell carcinoma;meetings;member;novel strategies;novel therapeutics;patient derived xenograft model;pre-clinical;repository;success;tissue resource;transcriptomics;translational clinical trial;tumor;virtual;web site	SLOAN-KETTERING INST CAN RESEARCH	NEW YORK	NY	UNITED STATES	Lauren Averett Byers, John D. Minna, Trudy Gale Oliver, Charles M Rudin	Peter Ujhazy	1654600	1654600	2022-06-24T12:06:00Z	2022-06-24T12:06:00Z	2027-05-31T12:05:00Z	PAR-21-346	nofo_PAR21-346
5U01CA235625-05	U01CA235625	10641667	2023	Employing CRISPR inactivation screening and in vivo models towards improving treatments for SCLC	"SUMMARY
With a lack of druggable oncogenic mutations in small cell lung cancer (SCLC) and no approved targeted
therapies, we need to identify new treatment approaches for SCLC. In this proposal, we apply whole genome
CRISPR inactivation screens to identify genes that are essential for SCLC broadly, or for key genetically defined
subsets. We then determine whether pharmacologic inhibition of identified hits also results in selective killing of
SCLC cells. We apply in vivo systems including patient derived xenograft (PDX) and genetically engineered
mouse models to test pharmacologic inhibitors of key targets identified in these genetic screens. Aim 1 will focus
on a pathway that we already identified using CRISPR inactivation screens to be essential for Rb/p53-mutant
SCLC cells. Components of a NEDD8/RBX1 pathway, controlling Cullin activity and protein ubiquitylation, were
essential for SCLC cells. Pharmacologic inhibition of NEDD8 activating enzyme (NAE) using MLN4924 in patient
derived xenograft (PDX) models confirmed reliance of SCLC cells on this pathway. Excitingly, we identified
examples of exceptional responses to MLN4924 in some PDX models. Aim 1: Apply in vivo models to direct
NEDD8 inhibition to subsets of SCLC most likely to respond. Here, we explore the potential for inhibiting
the NEDD8 pathway in SCLC. We will combine NAE inhibition with cisplatin-etoposide chemotherapy and
determine whether durable responses result. Some SCLC PDX models exhibited exquisite sensitivity to NAE
inhibition; we will identify underlying mechanisms and genetic features of super-responding PDX models that
could be used to help predict exceptional responders. We will determine whether NAE inhibition should be
directed to all SCLC patients, or to key subsets, and whether this approach augments response to chemotherapy.
MLN4924 is already being tested in clinical trials for other cancer types and this work could rapidly lead to clinical
trials in SCLC. Aim 2: Apply CRISPR inactivation screens to identify new therapeutic targets for SCLC.
This Aim will extend our CRISPR inactivation screens to include mouse SCLC cell lines with key driver mutations
beyond Rb/p53, including Pten, Crebbp and Mycl. Our approach takes advantage of the fact that while human
SCLC has an extremely high mutational burden, leading to extensive heterogeneity among SCLC with a given
driver mutation, mouse SCLC with defined driver alterations are more homogenous, increasing signal to noise
in identifying vulnerabilities. We will identify dependencies in genetically-defined subsets of SCLC and will test
inhibitors of identified druggable targets in PDX and GEM models that harbor defined genetic alterations. We
leverage available mouse models and derived cell lines, along with a bank of genetically annotated PDX models,
studied in vivo and ex vivo, to identify and evaluate completely new ways to target key genetic subsets of SCLC."	Biology;Cancer Model;Cancer Patient;Cancer cell line;Cell Death;Cell Line;Cisplatin;Clinical Trials;Clustered Regularly Interspaced Short Palindromic Repeats;Cullin Proteins;Dependence;Enzyme Inhibition;Enzymes;Epithelial;Essential Genes;Etoposide;Exhibits;Gene Deletion;Genes;Genetic;Genetic Models;Genetic Screening;Genetic Transcription;Genetically Engineered Mouse;Genotype;Goals;Heterogeneity;Human;Lead;Link;Lung;MYCL1 gene;Modeling;Molecular;Mus;Mutate;Mutation;Neuroendocrine Tumors;Noise;Oncogenic;Pathway interactions;Patients;Proteins;RBX1 gene;Signal Transduction;System;TP53 gene;Testing;Therapeutic;Tumor Volume;Work;cancer initiation;cancer type;chemotherapy;driver mutation;drug sensitivity;druggable target;efficacy testing;exceptional responders;gene function;improved;in vivo;in vivo Model;inhibitor;knock-down;lung cancer cell;mouse model;mutant;neuroendocrine differentiation;new therapeutic target;novel;novel strategies;novel therapeutic intervention;novel therapeutics;overexpression;patient derived xenograft model;pharmacologic;programs;response;screening;small cell lung carcinoma;small molecule inhibitor;targeted treatment;tumor;whole genome	FRED HUTCHINSON CANCER CENTER	Seattle	WA	UNITED STATES	David Macpherson	Suzanne L Forry	506274	506274	2023-02-28T12:02:00Z	2019-03-08T12:03:00Z	2024-02-29T12:02:00Z	PAR-16-049	nofo_PAR-16-049
5U01CA242919-05	U01CA242919	10693821	2023	Exploiting POU2F3 addiction in the tuft cell variant of small cell lung cancer	"Project Summary
Small cell lung cancer (SCLC) is the most aggressive form of lung cancer, which is associated with a high mitotic
rate, early metastatic spread, and a rapid evolution of chemotherapy resistance. We recently discovered a novel
form of SCLC that resembles the tuft cell lineage, which can be distinguished from the classical neuroendocrine
form of this disease through immunohistochemical staining of POU2F3. Importantly, we have identified several
molecular vulnerabilities that are specific to the variant form of this disease. In this research proposal, we seek
to advance personalized therapies that exploit the unique lineage program present in the tuft cell variant of SCLC.
Our innovative functional genomics strategy has already uncovered actionable dependencies that are unique to
tuft cell variant of SCLC, such as the kinase IGF1R. In addition, we discovered a profound addiction of tuft cell
variant SCLC tumors to POU2F3. Here we will investigate the molecular basis of POU2F3 addiction in SCLC,
with the explicit intent to develop small molecules that interfere with POU2F3 function. The first Aim of this
proposal will build upon the extensive epigenomic analyses we have performed in SCLC, which has defined a
unique enhancer landscape sustained by POU2F3 in this disease. We will now employ two independent
functional approaches to elucidate the critical POU2F3 binding sites/enhancers in the genome of SCLC cells,
which will be leveraged to pinpoint the critical components of the tuft cell lineage circuit that might be targeted
therapeutically. The second Aim will evaluate POU2F3 cofactors, which we have already nominated via an
innovative ChIP-SICAP-mass spectrometry analysis of endogenous POU2F3 binding sites. We will perform
CRISPR exon scanning and biochemical analysis of each cofactor to define the critical POU2F3:cofactor
interactions that selectively support this malignancy. The final Aim of this proposal will employ functional
genomics to devise drug combinations with the IGF1R inhibitor linsitinib that are rational and exploit synthetic-
lethal genetic interactions. We will also employ our latest CRISPR innovation, homolog co-targeting CRISPR
screens, to expose redundant kinase vulnerabilities that are linked with neuroendocrine versus tuft cell variants
of SCLC. In summary, we estimate that the tuft cell-like variant is present in ~18% of SCLC cases, which
corresponds to approximately 5,000 newly diagnosed SCLC cases and approximately 3,500 deaths in the United
States alone each year. Hence, the proposed research could lead to a sustained impact that affects a large
patient population for which novel medicines are desperately needed."	Affect;Avena sativa;Basic Science;Binding;Binding Sites;Biochemical;CRISPR screen;Cancer cell line;Cell Lineage;Cells;Cellular Morphology;Cessation of life;Characteristics;Chemoresistance;Chromatin;Clustered Regularly Interspaced Short Palindromic Repeats;Combined Modality Therapy;Complex;Data;Dependence;Disease;Drug Combinations;Elements;Enhancers;Epigenetic Process;Epithelial;Evolution;Exons;Exposure to;Gastrointestinal tract structure;Genes;Genetic;Genetic Screening;Genome;Genomic approach;Goals;Growth;Homologous Gene;Human;Insulin-Like-Growth Factor I Receptor;Libraries;Link;Lung;Lung Neuroendocrine Neoplasm;Maintenance;Malignant Neoplasms;Malignant neoplasm of lung;Maps;Mass Spectrum Analysis;Medicine;Methods;Mitotic;Molecular;Neuroendocrine Cell;Neurosecretory Systems;Newly Diagnosed;Phosphotransferases;Proteins;Publishing;Regulatory Element;Research;Research Proposals;Respiratory System;Sampling;Scanning;Sensory;Signal Transduction;Stains;Structure;Techniques;Technology;Therapeutic Intervention;Tumor Subtype;United States;Variant;Work;addiction;cell type;clinical translation;cofactor;drug discovery;epigenomics;experimental study;functional genomics;genomic platform;inhibitor;innovation;lung cancer cell;novel;patient population;personalized medicine;preclinical study;programs;small cell lung carcinoma;small molecule;targeted treatment;transcription factor;tumor	COLD SPRING HARBOR LABORATORY	COLD SPRING HARBOR	NY	UNITED STATES	Christopher Vakoc	Suzanne L Forry	430416	430416	2023-08-01T12:08:00Z	2019-08-01T12:08:00Z	2024-07-31T12:07:00Z	PAR-16-049	nofo_PAR-16-049
6U01CA235625-04	U01CA235625	10360437	2022	Employing CRISPR inactivation screening and in vivo models towards improving treatments for SCLC	"SUMMARY
With a lack of druggable oncogenic mutations in small cell lung cancer (SCLC) and no approved targeted
therapies, we need to identify new treatment approaches for SCLC. In this proposal, we apply whole genome
CRISPR inactivation screens to identify genes that are essential for SCLC broadly, or for key genetically defined
subsets. We then determine whether pharmacologic inhibition of identified hits also results in selective killing of
SCLC cells. We apply in vivo systems including patient derived xenograft (PDX) and genetically engineered
mouse models to test pharmacologic inhibitors of key targets identified in these genetic screens. Aim 1 will focus
on a pathway that we already identified using CRISPR inactivation screens to be essential for Rb/p53-mutant
SCLC cells. Components of a NEDD8/RBX1 pathway, controlling Cullin activity and protein ubiquitylation, were
essential for SCLC cells. Pharmacologic inhibition of NEDD8 activating enzyme (NAE) using MLN4924 in patient
derived xenograft (PDX) models confirmed reliance of SCLC cells on this pathway. Excitingly, we identified
examples of exceptional responses to MLN4924 in some PDX models. Aim 1: Apply in vivo models to direct
NEDD8 inhibition to subsets of SCLC most likely to respond. Here, we explore the potential for inhibiting
the NEDD8 pathway in SCLC. We will combine NAE inhibition with cisplatin-etoposide chemotherapy and
determine whether durable responses result. Some SCLC PDX models exhibited exquisite sensitivity to NAE
inhibition; we will identify underlying mechanisms and genetic features of super-responding PDX models that
could be used to help predict exceptional responders. We will determine whether NAE inhibition should be
directed to all SCLC patients, or to key subsets, and whether this approach augments response to chemotherapy.
MLN4924 is already being tested in clinical trials for other cancer types and this work could rapidly lead to clinical
trials in SCLC. Aim 2: Apply CRISPR inactivation screens to identify new therapeutic targets for SCLC.
This Aim will extend our CRISPR inactivation screens to include mouse SCLC cell lines with key driver mutations
beyond Rb/p53, including Pten, Crebbp and Mycl. Our approach takes advantage of the fact that while human
SCLC has an extremely high mutational burden, leading to extensive heterogeneity among SCLC with a given
driver mutation, mouse SCLC with defined driver alterations are more homogenous, increasing signal to noise
in identifying vulnerabilities. We will identify dependencies in genetically-defined subsets of SCLC and will test
inhibitors of identified druggable targets in PDX and GEM models that harbor defined genetic alterations. We
leverage available mouse models and derived cell lines, along with a bank of genetically annotated PDX models,
studied in vivo and ex vivo, to identify and evaluate completely new ways to target key genetic subsets of SCLC."	Biology;Cancer Model;Cancer Patient;Cancer cell line;Cell Death;Cell Line;Cisplatin;Clinical Trials;Clustered Regularly Interspaced Short Palindromic Repeats;Cullin Proteins;Dependence;Enzyme Inhibition;Enzymes;Epithelial;Essential Genes;Etoposide;Exhibits;Gene Deletion;Genes;Genetic;Genetic Models;Genetic Screening;Genetic Transcription;Genetically Engineered Mouse;Genotype;Goals;Heterogeneity;Human;Lead;Link;Lung;MYCL1 gene;Modeling;Molecular;Mus;Mutate;Mutation;Neuroendocrine Tumors;Noise;Oncogenic;Pathway interactions;Patients;Pharmacology;Proteins;RBX1 gene;Signal Transduction;System;TP53 gene;Testing;Therapeutic;Tumor Cell Line;Tumor Volume;Work;base;cancer type;chemotherapy;driver mutation;drug sensitivity;druggable target;efficacy testing;exceptional responders;gene function;improved;in vivo;in vivo Model;inhibitor;knock-down;lung cancer cell;lung small cell carcinoma;mouse model;mutant;neuroendocrine differentiation;new therapeutic target;novel;novel strategies;novel therapeutics;overexpression;patient derived xenograft model;programs;response;screening;small molecule inhibitor;targeted treatment;tumor;whole genome	FRED HUTCHINSON CANCER CENTER	Seattle	WA	UNITED STATES	David Macpherson	Suzanne L Forry	506274	506274	2022-06-09T12:06:00Z	2019-03-08T12:03:00Z	2024-02-28T12:02:00Z	PAR-16-049	nofo_PAR-16-049
