project_num	core_project_num	appl_id	fiscal_year	project_title	abstract_text	pref_terms	org_name	org_city	org_state	org_country	principal_investigators	program_officers	award_amount	agency_ic_fundings	award_notice_date	project_start_date	project_end_date	full_foa	api_source_search
1U54CA243124-01	U54CA243124	9834651	2019	Experimental and preclinical modeling of NUP98-rearranged acute leukemia	"PROJECT SUMMARY - Overview
Fusion oncoproteins (FO) arising from the rearrangement of Nucleoporin 98 (NUP98) to a diverse range of
partner genes are a hallmark of multiple subtypes of high risk myeloid malignancies in children and adolescents,
including acute erythroleukemia and acute megakaryoblastic leukemia. Such leukemias are associated with poor
outcome, and more effective therapies are required. The long-term goal of this Center for Experimental and
Preclinical Modeling of NUP98 Leukemia is to determine the molecular role, and potential vulnerabilities, of
NUP98-fusion oncoproteins in leukemia through the development and interrogation of human and mouse model
systems, and to develop and test novel therapeutic approaches. The Center has assembled a consortium of
investigators with complementary expertise in genomic characterization, leukemia modeling, chromatin biology,
structural biology and preclinical modeling. The Center is led by Dr Charles Mullighan of St Jude Children’s
Research Hospital together with Project Co-Leaders Drs Scott Armstrong (Dana Farber Cancer Institute),
Taosheng Chen (St Jude), Alex Kentsis (Memorial Sloan Kettering Cancer Institute), Jeffery Klco (St Jude) and
Richard Kriwacki (St Jude). These investigators will co-Lead four projects performing experimental modeling
(Project 1), investigating chromatin biology (Project 2), phase separation (Project 3) and drug development
(Project 4) that will address the following questions and unmet needs: (1) to define how NUP98 fusions drive
leukemogenesis using complementary, integrative engineered models and proteomic, transcriptomic and
epigenomic profiles; (2) to develop genetically faithful engineered mouse, human and xenograft models of
NUP98 leukemia for mechanistic interrogation and preclinical modeling; (3) to define the macromolecular
chromatin and protein complexes assembled by NUP98 FOs; (4) to define the role of phase separation in NUP98
FO leukemogenesis; (5) to define the dependencies and vulnerabilities of NUP98-rearranged leukemic cells;
and (6) to develop more effective therapeutic strategies for NUP98-rearranged leukemia. The Center is
supported by an Administrative Core A that with an External Advisory Board will oversee project progress
interaction and reporting, a Genome Editing Core B led by Dr David Chen (City of Hope) that provides expertise
and support for CRISPR/Cas9 genome editing scans and screens; and a Chemistry Core C led by Dr Zoran
Rankovic (St Jude) that supports chemical library screen and drug design and development. This highly
integrated, interactive and synergistic Center will provide fundamental insights into the mechanisms of
oncogenesis of the different classes of NUP98 FO, and new therapeutic modalities that will be validated in
preclinical models and translated into human clinical trials. All data and resources will be made freely available
by websites, data deposition, and establishment of resource and genomic data portals to the FusOnC2
consortium and broad scientific community."	Acute;Acute Erythroblastic Leukemia;Acute Megakaryocytic Leukemias;Acute leukemia;Address;Adolescent;Biological Models;Biology;CRISPR/Cas technology;Cancer Biology;Chemicals;Chemistry;Child;Childhood Leukemia;Chimeric Proteins;Chromatin;Cities;Clinical Trials;Communities;Congresses;Core Facility;Dana-Farber Cancer Institute;Dependence;Development;Drug Design;Engineering;Erythroid;Experimental Models;FLT3 gene;Fusion Oncogene Proteins;Genes;Genomics;Goals;HOXA9 gene;Homeobox;Human;In Vitro;Institutes;Lead;Leukemic Cell;Malignant Childhood Neoplasm;Malignant Neoplasms;Mediating;Modality;Modeling;Molecular;Morphology;Mus;Mutation;Myeloproliferative disease;Nuclear Pore Complex Proteins;Outcome;Phase;Pre-Clinical Model;Proteins;Proteomics;RB1 gene;Reporting;Research Personnel;Resources;Role;Saint Jude Children&apos;s Research Hospital;Scanning;Structure;Testing;Therapeutic;Transcriptional Regulation;Translating;Treatment Efficacy;Validation;WT1 gene;Xenograft Model;Zoran;base;chromatin protein;clinical phenotype;data portal;data resource;data submission;drug development;drug discovery;effective therapy;epigenomics;genome editing;genomic data;high risk;human model;improved outcome;in vivo;insight;leukemia;leukemogenesis;mouse model;novel therapeutic intervention;novel therapeutics;protein complex;response;small molecule inhibitor;small molecule libraries;structural biology;transcriptomics;tumorigenesis;web site	ST. JUDE CHILDREN'S RESEARCH HOSPITAL	MEMPHIS	TN	UNITED STATES	Charles G. Mullighan	Chamelli Jhappan	9965625	9965625	2019-09-19T12:09:00Z	2019-09-19T12:09:00Z	2024-08-31T12:08:00Z	RFA-CA-19-016	nofo_RFA-CA-19-016
1U54CA231649-01A1	U54CA231649	9834547	2019	Targeting EWSR1-FLI1 through Functional, Structural and Chemical Approaches	"Ewing sarcoma is the second most common bone and soft tissue malignancy in children and adolescents. The
five-year survival of Ewing sarcoma patients is 70%, and falls to less than 20% for those with metastatic
disease, a situation that has not improved despite many years of increasingly intensive chemotherapy
regimens. Survivors of Ewing sarcoma often suffer long-term deleterious effects of treatment. An immediate
need exists for the development of effective, targeted therapies with decreased toxicity. Molecularly, Ewing
sarcoma is characterized by one of several reciprocal chromosomal translocations that fuse a FET family
protein with an ETS transcription factor, the most common of which is EWSR1-FLI1. The EWSR1-FLI1 fusion
protein is completely specific to Ewing sarcoma tumor cells, and thus presents an ideal target for novel
therapeutics. To date, however, no such targeted therapy has become clinically available, owing to 4 major
knowledge gaps. First, there is a dearth of robust in vitro model systems for functional studies of EWSR1-FLI1.
Knockdown studies in Ewing sarcoma cell lines can give inconsistent results, and few primary cell types
tolerate exogenous EWSR1-FLI1 expression. Second, the protein encoded by the EWSR1-FLI1 fusion is a
transcription factor, and there is widespread perception that such proteins are “undruggable”. Third, lead
candidates of small-molecule screens reported to date have either not been shown to have a mechanistic link
to EWSR1-FLI1, or fail to replicate the phenotype of Ewing sarcoma cells depleted of EWSR1-FLI1 activity.
Fourth, the field has lacked relevant animal models for functional genomics and preclinical testing. Developing
targeted therapy for Ewing sarcoma will require an integrated approach executed by an experienced team. Our
strategy is based on several fundamentals, namely 1) systems to specifically deplete and reconstitute the
EWSR1-FLI1 protein in cells; 2) an understanding of the structural biochemistry of low-complexity (LC)
domains found in EWSR1 and related proteins; and 3) novel in vivo models of Ewing sarcoma for functional
genomics and drug testing. Standing on this foundation, we will perform biochemical and genetic experiments
to identify the binding partners and functional effectors of EWSR1-FLI1 and dissect its mechanisms of
transcriptional activation. We will use our experimental systems to conduct phenotypic and target-based high-
throughput screens. Finally, we are well-positioned to perform the work required to transform a compound with
promising initial activity into a preclinical drug lead. Our approach to drug discovery is built upon medicinal
chemistry coupled with secondary assays that maximize potency and specificity of lead compounds. We will
perform target identification for lead compounds using strategies our team has successfully used for several
agents currently in active preclinical development. A dedicated preclinical pharmacology core, highly integrated
with the projects and with the high throughput screening core and medicinal chemistry core, will ensure
optimization of delivery, PK/PD and toxicity properties of the most promising lead compounds."	Adolescent;Adolescent and Young Adult;Animal Model;Antineoplastic Agents;Binding;Biochemical;Biochemical Genetics;Biochemistry;Biological Assay;Biological Models;Biology;Biophysics;Bone Tissue;Cell Line;Cell Survival;Cells;Cellular Assay;Chemicals;Chemotherapy-Oncologic Procedure;Child;Child Care;Chimeric Proteins;Chromosomal translocation;Clinical;Collaborations;Coupled;DNA Binding Domain;Development;Disease;Distal;EWSR1 gene;Enhancers;Ensure;Ewings sarcoma;FLI1 Transcription Factor;FLI1 gene;Foundations;Fusion Oncogene Proteins;Genes;Genetic;Genetic Transcription;Genomic approach;Goals;Knowledge;Lead;Link;Malignant Bone Neoplasm;Malignant Neoplasms;Modality;Molecular;Oncogenic;Oncologist;Patients;Perception;Pharmaceutical Chemistry;Pharmaceutical Preparations;Pharmacology;Phenotype;Positioning Attribute;Preclinical Testing;Property;Protein Chemistry;Protein Family;Proteins;Proteomics;Reporting;Research;Resources;Role;Specificity;Structural Biochemistry;Structural Protein;Structure;Survivors;System;Tertiary Protein Structure;Toxic effect;Transcription Factor 3;Transcriptional Activation;Work;base;cell type;drug discovery;drug testing;experience;experimental study;falls;functional genomics;high throughput screening;improved;in vitro Model;in vivo Model;inhibitor/antagonist;innovation;knock-down;lead candidate;neoplastic cell;new therapeutic target;novel;novel therapeutics;pharmacokinetics and pharmacodynamics;pre-clinical;preclinical development;promoter;protein structure;reconstitution;sarcoma;screening;small molecule;small molecule libraries;soft tissue;structural biology;t(11;22)(q24;q12);targeted treatment;transcription factor;treatment effect	UT SOUTHWESTERN MEDICAL CENTER	DALLAS	TX	UNITED STATES	James F Amatruda, David Glenn Mcfadden	Keren L Witkin	10042149	10042149	2019-09-16T12:09:00Z	2019-09-16T12:09:00Z	2024-08-31T12:08:00Z	RFA-CA-19-016	nofo_RFA-CA-19-016
1U54CA243125-01	U54CA243125	9834606	2019	Biology and therapy of C11orf95-RELA fusion-driven ependymoma	"ABSTRACT/SUMMARY – OVERALL (HOLLAND)
Due to a chromothripsis event on chromosome 11, the majority of supratentorial ependymomas generate and
express the gene fusion C11orf95-RELA fusion (RELAFus). The goal of the U54 titled “Biology and therapy of
C11orf95-RELA fusion-driven ependymoma is to understand the biology of this fusion protein and the two
components that make up the fusion and determine the requirements for continued expression of this fusion
protein and what pathways downstream are critical for oncogenesis. We will use a combination of novel mouse
models and human neuro stem cell systems with readouts of single cell analysis, immunology, tumor
microenvironment, systems biology, and data visualization. In addition to the administrative core, the grant has
three main Projects, a data visualization and sharing core. The research projects include, Project 1) Mechanisms
and models of C11or95 and C11or95-RELA fusions (RELAFus), Project 2) Genetic interrogation of therapeutic
vulnerabilities for C11orf95-RELA fusion, and Project 3) Identifying small molecules with therapeutic effects in
RELAFus -driven EPN and testing them in preclinical genetically engineered models of EPN."	Acute;Algorithms;Animals;Binding;Biological Assay;Biological Models;Biology;Brain Neoplasms;Budgets;California;Cancer Biology;Chemicals;Chemistry;Chimeric Proteins;Chromosomes, Human, Pair 11;Clinical;Collaborations;Communication;Communities;Core Grant;Data;Development;Ependymoma;Evaluation;Event;Fred Hutchinson Cancer Research Center;Fusion Protein Expression;Gene Fusion;Genetic;Genetic Engineering;Genomics;Goals;Grant;Human;Imagery;Immune;Immunology;Individual;Knockout Mice;Knowledge;Laboratories;Logistics;Malignant Childhood Neoplasm;Malignant Neoplasms;Methods;Modeling;Modification;Mus;Pathway interactions;Pharmaceutical Preparations;Phenotype;Phosphotransferases;Proteins;RELA gene;Recording of previous events;Reporting;Reproducibility;Research;Research Personnel;Research Project Grants;Resource Sharing;Role;San Francisco;Stem cells;Supratentorial;System;Systems Biology;Testing;Therapeutic;Therapeutic Effect;Transgenic Mice;Universities;Variant;base;chromothripsis;data sharing;data visualization;fusion gene;in vivo;mouse model;nerve stem cell;novel;novel therapeutic intervention;novel therapeutics;pre-clinical;preclinical trial;relating to nervous system;single cell analysis;small molecule;small molecule inhibitor;tumor;tumor microenvironment;tumorigenesis	FRED HUTCHINSON CANCER RESEARCH CENTER	SEATTLE	WA	UNITED STATES	Eric C. Holland	Chamelli Jhappan	4906170	4906170	2019-09-19T12:09:00Z	2019-09-19T12:09:00Z	2022-03-31T12:03:00Z	RFA-CA-19-016	nofo_RFA-CA-19-016
