project_num	core_project_num	appl_id	fiscal_year	project_title	abstract_text	pref_terms	org_name	org_city	org_state	org_country	principal_investigators	program_officers	award_amount	agency_ic_fundings	award_notice_date	project_start_date	project_end_date	full_foa	api_source_search
1U54CA231637-01	U54CA231637	9600132	2018	The Center for Therapeutic Targeting of EWS-oncoproteins	"PROJECT SUMMARY: Overall
The primary scientific focus of this Center is to understand the molecular underpinnings of EWS-ETS driven
Ewing sarcoma and to investigate novel treatments and therapeutic mechanisms to improve outcomes for
pediatric patients with this aggressive disease. Translation of molecular understanding of sarcoma
pathophysiology into effective new drugs in the clinic is a complex, risky proposition that requires the coordinated
efforts of a talented team of individuals with complementary skills. This group brings expertise in Ewing sarcoma
biology and the EWS-ETS oncoproteins, epigenetics and transcription, structural biology, computational biology,
chemical biology and drug development, mouse models, preclinical experimental therapeutics, and clinical trials
development. A Center mechanism is essential to the success of this proposal. No one institution nor individual
can bring mastery of the diversity of approaches, technologies, and scientific domains needed to achieve the
goals of this proposal. We have elected to focus on understanding the fundamental inner workings of Ewing
sarcoma from its transcriptional circuits, to the direct protein interactions with EWS-FLI1, to the direct and
immediate effects of EWS-FLI1 degradation. Moreover, a strong emphasis of this proposal is on target
identification and preclinical validation, critical steps in the process of bringing forward therapies with optimal
chances for success in the clinic. The team that is assembled has all of the component pieces needed for
success. Our Center includes outstanding basic cancer biologists, chemists, computational biologists, and
translational researchers, and five pediatric oncologists. Thus, the proposed Center can catalyze basic discovery
and clinical translation by leveraging basic and clinical research talent within the Center and our strong ties to
outside academic and industrial partners."	Adolescent and Young Adult;Automobile Driving;Basic Science;Biological;Biology;CRISPR/Cas technology;Cells;Chemicals;Chemistry;Child;Chimeric Proteins;Chromatin;Clinic;Clinical Research;Collection;Complex;Computational Biology;Cytotoxic Chemotherapy;DNA Binding Domain;Development;Disease;ETS Family Protein;EWS-FLI1 fusion protein;Epigenetic Process;Ewings sarcoma;FLI1 Transcription Factor;FLI1 gene;Functional disorder;Fusion Oncogene Proteins;Gene Abnormality;Gene Expression;Genes;Genetic Transcription;Genomics;Goals;Human;Individual;Industrialization;Institution;Investigational Therapies;Knowledge;Lead;Leadership;Localized Disease;Maintenance;Malignant Childhood Neoplasm;Malignant Neoplasms;Modeling;Molecular;Oncogenic;Oncoproteins;Output;Pathogenesis;Patients;Pediatric Oncologist;Pharmaceutical Preparations;Process;Proteins;Proteomics;Recurrent disease;Research;Research Personnel;Role;Science;Structural Chemistry;Talents;Technology;Tertiary Protein Structure;Therapeutic;Therapeutic Clinical Trial;Transcriptional Activation Domain;Translational Research;Translations;Validation;Xenograft Model;addiction;bone;clinical investigation;clinical translation;cohesion;design;drug development;epigenomics;experience;improved outcome;inhibitor/antagonist;insight;leukemia;malignant state;member;mouse model;novel;novel therapeutic intervention;novel therapeutics;pediatric patients;pre-clinical;preclinical study;programs;protein complex;sarcoma;skills;small molecule;structural biology;success;targeted treatment;therapeutic target;tool;transcription factor;translational scientist;tumor;tumorigenesis	DANA-FARBER CANCER INST	BOSTON	MA	UNITED STATES	Scott A Armstrong, Kimberly Stegmaier	Keren L Witkin	12500000	12500000	2018-09-10T12:09:00Z	2018-09-10T12:09:00Z	2023-06-30T12:06:00Z	RFA-CA-17-049	nofo_RFA-CA-17-049
1U54CA231641-01	U54CA231641	9600275	2018	An integrated approach to analyze and target EWS/FLI in Ewing sarcoma	"Overall Section Summary/Abstract
The overarching goal of our FusOnC2 TEST (Targeting the Ewing Sarcoma Translocation) Center is to develop a new mechanistic understanding of EWS/FLI that will allow for the development of new therapeutic approaches for Ewing sarcoma based on inhibiting EWS/FLI.  EWS/FLI is an aberrant oncogenic transcription factor formed by the t(11;22)(q24;q12) chromosomal translocation that is the driver oncoprotein of this tumor.  Multiple independent studies demonstrate a critical dependence of Ewing sarcoma cells on EWS/FLI such that blockade of the translocation is associated with a loss of proliferation, loss of cell cycle progression and ultimately reversal of oncogenic transformation.  Thus, most investigators believe that inhibition of EWS/FLI in the clinic would be the best way to treat patients with Ewing sarcoma.  

Traditional chemical design of EWS/FLI inhibitors has proven challenging because the molecule does not contain traditionally “druggable” pockets.  We therefore hypothesize that a deeper scientific understanding of EWS/FLI transcriptional function in Ewing sarcoma will allow for identification of new agents.

The FusOnC2 TEST Center will focus on two critical molecular features of EWS/FLI required for its transcriptional and oncogenic function:  (i) binding of EWS/FLI to GGAA-microsatellites and related DNA response elements, and (ii) EWS/FLI self-association activities to form “hubs” that coordinate protein-interactions through low-complexity domains to mediate transcriptional function.

Targeting EWS/FLI requires diverse expertise to be focused on this problem.  The TEST Center is designed to facilitate both independent and highly-focused studies on critical components of EWS/FLI function, while at the same time interacting with the entire FusOnC2 consortium to share new knowledge, techniques, and expertise that will help facilitate the development of new therapeutic approaches to Ewing sarcoma.  We believe that the TEST Center will contribute greatly to the overall success of the FusOnC2 Consortium, and help to change the paradigm for how new therapies are developed for pediatric translocation-associated cancers."	Area;Back;Basic Science;Binding;Biochemistry;Biological Markers;Biological Models;Cell Cycle Progression;Cells;Chemicals;Childhood;Chimeric Proteins;Chromatin;Chromosomal translocation;Clinic;Clinical;Collaborations;DNA;Dependence;Development;Engineering;Ensure;Environment;Ewings sarcoma;Gene Expression;Genetic Transcription;Genomics;Goals;Hand;Institution;Knowledge;Laboratories;Lead;Malignant Childhood Neoplasm;Malignant Neoplasms;Mediating;Microsatellite Repeats;Modeling;Molecular;New Agents;Oncogenic;Oncoproteins;Patients;Pediatric Oncology Group;Persons;Pharmaceutical Chemistry;Pharmaceutical Preparations;Pharmacology;Phase;Positioning Attribute;Property;Proteins;Research;Research Personnel;Research Project Grants;Response Elements;Structure;Techniques;Testing;Therapeutic;Therapeutic Agents;Time;Toxic effect;Translating;base;cellular imaging;clinical implementation;clinical translation;design;experience;inhibitor/antagonist;innovation;meetings;member;novel therapeutic intervention;novel therapeutics;pre-clinical;preclinical development;programs;response;screening;skills;structural biology;success;synergism;t(11;22)(q24;q12);targeted agent;therapeutic development;therapy development;transcription factor;tumor	RESEARCH INST NATIONWIDE CHILDREN'S HOSP	COLUMBUS	OH	UNITED STATES	Stephen L. Lessnick	Keren L Witkin	6163485	6163485	2018-09-19T12:09:00Z	2018-09-18T12:09:00Z	2023-06-30T12:06:00Z	RFA-CA-17-049	nofo_RFA-CA-17-049
1U54CA231638-01	U54CA231638	9600147	2018	The Center for Synovial Sarcoma Biology and Therapeutics	"The Center for Synovial Sarcoma Biology and Therapeutics 
Abstract 
The overarching goal of this FusOnC2 Center for Synovial Sarcoma Biology and Therapeutics is to develop and execute a comprehensive, multidisciplinary set of approaches rooted in protein biochemistry and structural biology to define the mechanistic underpinnings of synovial sarcoma and unmask opportunities for therapeutic development. This Center’s mission is tightly aligned with that of the larger Consortium on Fusion Oncoproteins in Childhood Cancers and the Beau Biden Cancer Moonshot Initiative. A major impetus for the development of this Consortium has been the growing knowledge that fusion oncoproteins that are pathognomonic for specific cancer types often function via disruption of the structure and/or activity of protein complexes that govern chromatin architecture and hence gene control. We have shown that at least two of the fusion oncoproteins highlighted as major areas of emphasis within the Consortium, SS18-SSX and EWS-FLI1, bind and act via BAF complexes to drive cancer-specific oncogenic gene expression. Importantly, genetic studies across human cancer types have indicated that genes encoding encoding mSWI/SNF complex subunits are among the most frequently mutated, at over 20% of all human cancers, further underscoring the need for a detailed understanding of BAF complex structure, topology and mechanisms on chromatin. 
Our multi-institutional collaborative network seeks to comprehensively interrogate biologic mechanisms underpinning the function of the SS18-SSX oncogenic fusion protein in synovial sarcoma and to use the approaches and the results generated to launch targeted therapeutic discovery campaigns that are directly linked to the mechanisms identified. Specifically, our approach encompasses three major areas: (1) BAF complex genomic targeting, gene regulation, and chromatin state interactions, including interactions with other chromatin regulators; (2) Understanding the role of the wild-type SS18 protein, its protein-level regulation, and mechanisms by which its stabilization can reverse SS18-SSX-mediated BAF complex activity and be exploited for therapeutic benefit; (3) Mechanistically characterizing synovial sarcoma-specific vulnerabilities, centered in chromatin-bound protein complexes and related pathways. The highly integrative nature of the PI-directed research projects and expertise within collaborator laboratories provide the strongest possible likelihood that the aims will be successfully achieved and that novel therapeutic strategies will emerge from this Center."	ATAC-seq;Academia;Architecture;Area;Binding;Binding Proteins;Biochemical;Biochemistry;Biological Assay;Biology;CRISPR screen;Cell Line;Cells;ChIP-seq;Chimeric Proteins;Chromatin;Collaborations;Communities;Complex;DNA;Data;Development;Discipline;Disease;EWS-FLI1 fusion protein;Fusion Oncogene Proteins;Gene Expression;Gene Expression Regulation;Genes;Genetic;Genetic study;Genomics;Goals;Human;Individual;Industry;Knowledge;Laboratories;Lesion;Link;Malignant Childhood Neoplasm;Malignant Neoplasms;Mediating;Mission;Molecular;Mutate;Nature;Nucleosomes;Oncogenic;Participant;Pathway interactions;Peptides;Plant Roots;Protein Biochemistry;Proteins;Proteomics;Regulation;Research Infrastructure;Research Project Grants;Roentgen Rays;Role;Sampling;Scientist;Screening Result;Structure;Tail;Therapeutic;Translational Research;base;cancer type;combat;data portal;design;genome-wide;high throughput screening;innovation;multidisciplinary;novel;novel therapeutics;protein complex;screening;single-cell RNA sequencing;small molecule;small molecule inhibitor;soft tissue;structural biology;synovial sarcoma;targeted treatment;therapeutic development;therapeutic target;tool;transcriptome sequencing;tumorigenesis;web site	DANA-FARBER CANCER INST	BOSTON	MA	UNITED STATES	Cigall Kadoch, Ali Shilatifard	Keren L Witkin	5251652	5251652	2018-09-18T12:09:00Z	2018-09-18T12:09:00Z	2023-06-30T12:06:00Z	RFA-CA-17-049	nofo_RFA-CA-17-049
1U54CA231652-01	U54CA231652	9600594	2018	Targeting SS18-SSX biology in synovial sarcomagenesis	"Overall: PROJECT SUMMARY/ABSTRACT
This application responds to RFA-CA-17-049 by proposing the establishment of a center distributed across
three institutions with labs all focusing on the biology of the SS18-SSX (formerly called SYT-SSX) fusion
oncogene. Among the FusOnC2 consortium cancers of interest, synovial sarcoma has the highest incidence in
the United States and worldwide, but has been a specifically underserved malignancy due to its predilection for
the adolescent and young adult population and its relatively poor responsiveness to systemic therapy,
compared to other pediatric sarcomas that also associate with fusion oncogenes. While much of the biology of
SS18-SSX remains unknown and synovial sarcoma patients represent a clearly underserved, orphan-disease
population, there are two principles at the extremes of the cancer biology spectrum that are well established.
First, SS18-SSX has proven the capacity to recapitulate synovial sarcomagenesis faithfully in the mouse
without the need of introduced or stochastically acquired secondary genetic changes, second SS18-SSX has
biochemically demonstrated interactions with an important chromatin remodeling complex called SWI/SNF or
BAF. This application proposes to build three research projects focused on the cell biology of transformation,
genome-wide chromatin biology and SWI/SNF (BAF) complex componentry biology, each related to SS18-
SSX. These discovery biology and therapeutic target identification efforts will be supported by two shared
resource cores that will provide human validation of therapeutic targets and preclinical testing of therapeutic
strategies. The group of investigators has developed as an organically assembled network of collaborations,
built over the last decade, during which time each project has gathered substantial preliminary data using a
variety of functional screens, a newly identified cell of origin, the ability to track SS18-SSX genome wide
localization and protein interactions, a powerful system to produce and evaluate recombinant SWI/SNF (BAF)
complexes with variable componentry, and powerful mouse genetic models of synovial sarcoma—including
spontaneous development of metastatic disease. Preliminary data are sufficiently robust to recommend
therapeutic strategies immediately from each research project for the cores to validate and evaluate in clinically
relevant mouse models and quantitative molecular imaging."	Adolescent and Young Adult;Automobile Driving;Biochemical;Biochemistry;Biological Assay;Biology;Cancer Biology;Cells;Cellular biology;Characteristics;Chromatin;Chromatin Remodeling Factor;Chromosomal translocation;Clinic;Clinical;Collaborations;Complex;Core Facility;Data;Dependence;Development;Disease;Dissection;Epigenetic Process;Foundations;Fusion Oncogene Proteins;Gene Targeting;Genetic;Genetic Models;Genetic Transcription;Genome;Human;Incidence;Institution;Interdisciplinary Study;Knowledge;Lead;Location;Malignant Childhood Neoplasm;Malignant Neoplasms;Mediating;Modeling;Modification;Molecular;Mus;Mutation;Oncogenes;Oncogenic;Oncoproteins;Patients;Population;Preclinical Testing;Proteins;Rare Diseases;Recombinants;Research;Research Personnel;Research Project Grants;Resource Sharing;SMARCA4 gene;SWI/SNF Family Complex;Soft tissue sarcoma;Specimen;Sucrose;System;Systemic Therapy;Testing;Therapeutic;Time;Translations;United States;Validation;Xenograft Model;cancer care;cancer type;childhood sarcoma;clinically relevant;curative treatments;genome-wide;high risk;imaging modality;improved;in vivo;in vivo Model;interest;member;molecular imaging;mouse model;protein complex;response;synovial sarcoma;therapeutic evaluation;therapeutic target;treatment strategy;tumor;tumorigenesis	UNIVERSITY OF UTAH	SALT LAKE CITY	UT	UNITED STATES	Kevin Bruce Jones	Keren L Witkin	11520799	11520799	2018-09-14T12:09:00Z	2018-09-14T12:09:00Z	2024-06-30T12:06:00Z	RFA-CA-17-049	nofo_RFA-CA-17-049
3U54CA243125-02S1	U54CA243125	10646671	2022	Biology and therapy of C11orf95-RELA fusion-driven ependymoma	"ABSTRACT/SUMMARY – OVERALL (HOLLAND)
Due to a chromothripsis event on chromosome 11, the majority of supratentorial ependymomas generate and
express the gene fusion C11orf95-RELA fusion (RELAFus). The goal of the U54 titled “Biology and therapy of
C11orf95-RELA fusion-driven ependymoma is to understand the biology of this fusion protein and the two
components that make up the fusion and determine the requirements for continued expression of this fusion
protein and what pathways downstream are critical for oncogenesis. We will use a combination of novel mouse
models and human neuro stem cell systems with readouts of single cell analysis, immunology, tumor
microenvironment, systems biology, and data visualization. In addition to the administrative core, the grant has
three main Projects, a data visualization and sharing core. The research projects include, Project 1) Mechanisms
and models of C11or95 and C11or95-RELA fusions (RELAFus), Project 2) Genetic interrogation of therapeutic
vulnerabilities for C11orf95-RELA fusion, and Project 3) Identifying small molecules with therapeutic effects in
RELAFus -driven EPN and testing them in preclinical genetically engineered models of EPN."	Acute;Algorithms;Animals;Binding;Biological Assay;Biological Models;Biology;Brain Neoplasms;Budgets;California;Cancer Biology;Chemicals;Chemistry;Chimeric Proteins;Chromosome 11;Clinical;Collaborations;Communication;Communities;Core Grant;Data;Development;Ependymoma;Evaluation;Event;Fred Hutchinson Cancer Research Center;Fusion Protein Expression;Gene Fusion;Genetic;Genetic Engineering;Genomics;Goals;Grant;Human;Immunocompetent;Immunology;Individual;Knockout Mice;Knowledge;Laboratories;Logistics;Malignant Childhood Neoplasm;Malignant Neoplasms;Methods;Modeling;Modification;Mus;Pathway interactions;Phenotype;Phosphotransferases;Proteins;RELA gene;Recording of previous events;Reporting;Reproducibility;Research;Research Personnel;Research Project Grants;Resource Sharing;Role;San Francisco;Supratentorial;System;Systems Biology;Testing;Therapeutic;Therapeutic Effect;Transgenic Mice;Universities;Variant;Visualization;base;chromothripsis;data sharing;data visualization;drug repurposing;fusion gene;in vivo;mouse model;nerve stem cell;novel;novel therapeutic intervention;novel therapeutics;pre-clinical;preclinical trial;relating to nervous system;single cell analysis;small molecule;small molecule inhibitor;stem cells;tumor;tumor microenvironment;tumorigenesis	FRED HUTCHINSON CANCER CENTER	Seattle	WA	UNITED STATES	Eric C. Holland	Chamelli Jhappan	125104	125104	2022-06-16T12:06:00Z	2019-09-19T12:09:00Z	2024-08-31T12:08:00Z	RFA-CA-19-016	nofo_RFA-CA-19-016
3U54CA243124-01S1	U54CA243124	10228882	2020	Experimental and preclinical modeling of NUP98-rearranged acute leukemia	"PROJECT SUMMARY - Overview
Fusion oncoproteins (FO) arising from the rearrangement of Nucleoporin 98 (NUP98) to a diverse range of
partner genes are a hallmark of multiple subtypes of high risk myeloid malignancies in children and adolescents,
including acute erythroleukemia and acute megakaryoblastic leukemia. Such leukemias are associated with poor
outcome, and more effective therapies are required. The long-term goal of this Center for Experimental and
Preclinical Modeling of NUP98 Leukemia is to determine the molecular role, and potential vulnerabilities, of
NUP98-fusion oncoproteins in leukemia through the development and interrogation of human and mouse model
systems, and to develop and test novel therapeutic approaches. The Center has assembled a consortium of
investigators with complementary expertise in genomic characterization, leukemia modeling, chromatin biology,
structural biology and preclinical modeling. The Center is led by Dr Charles Mullighan of St Jude Children’s
Research Hospital together with Project Co-Leaders Drs Scott Armstrong (Dana Farber Cancer Institute),
Taosheng Chen (St Jude), Alex Kentsis (Memorial Sloan Kettering Cancer Institute), Jeffery Klco (St Jude) and
Richard Kriwacki (St Jude). These investigators will co-Lead four projects performing experimental modeling
(Project 1), investigating chromatin biology (Project 2), phase separation (Project 3) and drug development
(Project 4) that will address the following questions and unmet needs: (1) to define how NUP98 fusions drive
leukemogenesis using complementary, integrative engineered models and proteomic, transcriptomic and
epigenomic profiles; (2) to develop genetically faithful engineered mouse, human and xenograft models of
NUP98 leukemia for mechanistic interrogation and preclinical modeling; (3) to define the macromolecular
chromatin and protein complexes assembled by NUP98 FOs; (4) to define the role of phase separation in NUP98
FO leukemogenesis; (5) to define the dependencies and vulnerabilities of NUP98-rearranged leukemic cells;
and (6) to develop more effective therapeutic strategies for NUP98-rearranged leukemia. The Center is
supported by an Administrative Core A that with an External Advisory Board will oversee project progress
interaction and reporting, a Genome Editing Core B led by Dr David Chen (City of Hope) that provides expertise
and support for CRISPR/Cas9 genome editing scans and screens; and a Chemistry Core C led by Dr Zoran
Rankovic (St Jude) that supports chemical library screen and drug design and development. This highly
integrated, interactive and synergistic Center will provide fundamental insights into the mechanisms of
oncogenesis of the different classes of NUP98 FO, and new therapeutic modalities that will be validated in
preclinical models and translated into human clinical trials. All data and resources will be made freely available
by websites, data deposition, and establishment of resource and genomic data portals to the FusOnC2
consortium and broad scientific community."	Acute;Acute Erythroblastic Leukemia;Acute Megakaryocytic Leukemias;Acute leukemia;Address;Adolescent;Biological Models;Biology;CRISPR/Cas technology;Cancer Biology;Chemicals;Chemistry;Child;Childhood Leukemia;Chimeric Proteins;Chromatin;Cities;Clinical Trials;Communities;Congresses;Core Facility;Dana-Farber Cancer Institute;Dependence;Development;Drug Design;Engineering;Erythroid;Experimental Models;FLT3 gene;Fusion Oncogene Proteins;Genes;Genomics;Goals;HOXA9 gene;Homeobox;Human;In Vitro;Institutes;Lead;Leukemic Cell;Malignant Childhood Neoplasm;Malignant Neoplasms;Mediating;Modality;Modeling;Molecular;Morphology;Mus;Mutation;Myeloproliferative disease;Nuclear Pore Complex Proteins;Outcome;Phase;Pre-Clinical Model;Proteins;Proteomics;RB1 gene;Reporting;Research Personnel;Resources;Role;Saint Jude Children&apos;s Research Hospital;Scanning;Structure;Testing;Therapeutic;Transcriptional Regulation;Translating;Treatment Efficacy;Validation;WT1 gene;Xenograft Model;Zoran;base;chromatin protein;clinical phenotype;data portal;data resource;data submission;drug development;drug discovery;effective therapy;epigenomics;genome editing;genomic data;high risk;human model;improved outcome;in vivo;insight;leukemia;leukemogenesis;mouse model;novel therapeutic intervention;novel therapeutics;protein complex;response;small molecule inhibitor;small molecule libraries;structural biology;transcriptomics;tumorigenesis;web site	ST. JUDE CHILDREN'S RESEARCH HOSPITAL	MEMPHIS	TN	UNITED STATES	Charles G. Mullighan	Chamelli Jhappan	159625	159625	2020-08-19T12:08:00Z	2019-09-19T12:09:00Z	2024-08-31T12:08:00Z	RFA-CA-19-016	nofo_RFA-CA-19-016
