project_num	core_project_num	appl_id	fiscal_year	project_title	abstract_text	pref_terms	org_name	org_city	org_state	org_country	principal_investigators	program_officers	award_amount	agency_ic_fundings	award_notice_date	project_start_date	project_end_date	full_foa	api_source_search
3U54CA231630-01A1S1	U54CA231630	10221081	2020	Defining and targeting the molecular vulnerabilities of the PAX3-FOXO1 protein in rhabdomyosarcoma	"ABSTRACT – Overall (revised)
Fusion-positive alveolar rhabdomyosarcoma (ARMS) remains one of the most fatal but least understood cancers of childhood. The driving oncoprotein in ARMS is the PAX3-FOXO1 fusion protein, a chimeric transcription factor that hijacks normal gene expression and chromatin state. Five-year survival for children with PAX3-FOXO1- positive ARMS is ~30% for all-comers, and <10% when metastatic. Despite the discovery of PAX3-FOXO1 in 1993, treatment strategies for affected children remain unchanged. This deficiency stems equally from a lack of understanding of the basic biology of the disease and an inability to directly target the fusion protein. No systematic or comprehensive approach has been undertaken to identify the proteins and regulatory elements required to support PAX3-FOXO1-mediated tumorigenesis. As a result, the field has been limited to a patchwork of data with no unified scientific strategy. To overcome this, this FusOnC2 Center has an innovative team and dynamic environment in which data interpretation is informed by complementary technological approaches and by biological and clinical knowledge. This comprehensive approach will transform understanding of PAX3-FOXO1-mediated oncogenesis and create opportunities for therapeutic intervention. The Center’s overarching goal is to advance the therapeutic tractability of the PAX3-FOXO1 fusion protein in ARMS by comprehensively identifying the druggable co-regulators, modulators, and intrinsic activities of PAX3-FOXO1. To accomplish this goal, the Center includes two complementary Projects, each led by expert RMS biologists paired with specialists in pioneering experimental approaches undertaking the most cutting-edge research in cancer biology, genomics, proteomics, structural biology, and medicinal chemistry. The Projects will be supported by RMS investigators within each project who will provide curated RMS cell lines, unique human primary RMS tumor cells, and murine models to enable rapid in vitro and in vivo validation and cross-prioritization of targets. An Administrative Core will integrate and coordinate the Center components, providing leadership and oversight, and promoting cross-pollination of ideas and resources. The Overall Specific Aims are to: (1) define and target the PAX3-FOXO1 interactome; and (2) perform chemical probe discovery for PAX3-FOXO1 to create additional tools for investigating the fundamental biology and tractability of PAX3-FOXO1 and fusion-positive RMS. Approaches used include proximity labeling, saturation mutagenesis, single and combinatorial CRISPR screens, high-throughput phenotypic assays, and mechanistically unbiased approaches to chemical probe discovery using novel high-throughput binding assays. We will use information gleaned to prioritize targets and agents for validation and to inform compound optimization and PROTAC preparation. This Center’s strengths and resources will synergize with the FusOnC2 Consortium, speeding development of knowledge generalizable to the biology of multiple fusion oncoproteins in childhood cancers, accelerating advances in clinical care."	Affect;Alveolar Rhabdomyosarcoma;Animal Model;Automobile Driving;Belief;Binding;Biological;Biological Assay;Biology;CRISPR screen;Cancer Biology;Cell Line;Cell model;Chemicals;Child;Chimeric Proteins;Chromatin;Clinical;Code;Collaborations;Data;Data Analyses;Dependence;Development;Disease;Elements;Environment;FOXO1A gene;Fusion Oncogene Proteins;Gene Expression;Gene Proteins;Genes;Genetic;Genetic Screening;Genetic Transcription;Genetically Engineered Mouse;Genomics;Glean;Goals;Human;In Vitro;Institution;Knowledge;Label;Lead;Leadership;Malignant Childhood Neoplasm;Mediating;Molecular Genetics;Molecular Target;Mutagenesis;Oncogenic;Oncoproteins;PAX3 gene;Pharmaceutical Chemistry;Pharmacology;Phenotype;Preparation;Protac;Proteins;Proteomics;Regulatory Element;Research;Research Personnel;Resolution;Resources;Rhabdomyosarcoma;Specialist;Speed;Structure;Structure-Activity Relationship;Techniques;Therapeutic;Therapeutic Intervention;Untranslated RNA;Validation;cellular engineering;clinical care;combinatorial;druggable target;epigenomics;genome-wide;improved;in vivo;innovation;insight;mouse model;multidisciplinary;neoplastic cell;novel;pre-clinical;public health relevance;small molecule;stem;structural biology;targeted agent;tool;transcription factor;transcriptomics;treatment strategy;tumor;tumorigenesis;tumorigenic	DUKE UNIVERSITY	DURHAM	NC	UNITED STATES	Christopher M Counter, Corinne Mary Linardic	Keren L Witkin	38133	38133	2020-08-11T12:08:00Z	2020-08-11T12:08:00Z	2024-08-31T12:08:00Z	RFA-CA-19-016	nofo_RFA-CA-19-016
3U54CA243124-01S2	U54CA243124	10230523	2020	Experimental and preclinical modeling of NUP98-rearranged acute leukemia	"PROJECT SUMMARY - Overview
Fusion oncoproteins (FO) arising from the rearrangement of Nucleoporin 98 (NUP98) to a diverse range of
partner genes are a hallmark of multiple subtypes of high risk myeloid malignancies in children and adolescents,
including acute erythroleukemia and acute megakaryoblastic leukemia. Such leukemias are associated with poor
outcome, and more effective therapies are required. The long-term goal of this Center for Experimental and
Preclinical Modeling of NUP98 Leukemia is to determine the molecular role, and potential vulnerabilities, of
NUP98-fusion oncoproteins in leukemia through the development and interrogation of human and mouse model
systems, and to develop and test novel therapeutic approaches. The Center has assembled a consortium of
investigators with complementary expertise in genomic characterization, leukemia modeling, chromatin biology,
structural biology and preclinical modeling. The Center is led by Dr Charles Mullighan of St Jude Children’s
Research Hospital together with Project Co-Leaders Drs Scott Armstrong (Dana Farber Cancer Institute),
Taosheng Chen (St Jude), Alex Kentsis (Memorial Sloan Kettering Cancer Institute), Jeffery Klco (St Jude) and
Richard Kriwacki (St Jude). These investigators will co-Lead four projects performing experimental modeling
(Project 1), investigating chromatin biology (Project 2), phase separation (Project 3) and drug development
(Project 4) that will address the following questions and unmet needs: (1) to define how NUP98 fusions drive
leukemogenesis using complementary, integrative engineered models and proteomic, transcriptomic and
epigenomic profiles; (2) to develop genetically faithful engineered mouse, human and xenograft models of
NUP98 leukemia for mechanistic interrogation and preclinical modeling; (3) to define the macromolecular
chromatin and protein complexes assembled by NUP98 FOs; (4) to define the role of phase separation in NUP98
FO leukemogenesis; (5) to define the dependencies and vulnerabilities of NUP98-rearranged leukemic cells;
and (6) to develop more effective therapeutic strategies for NUP98-rearranged leukemia. The Center is
supported by an Administrative Core A that with an External Advisory Board will oversee project progress
interaction and reporting, a Genome Editing Core B led by Dr David Chen (City of Hope) that provides expertise
and support for CRISPR/Cas9 genome editing scans and screens; and a Chemistry Core C led by Dr Zoran
Rankovic (St Jude) that supports chemical library screen and drug design and development. This highly
integrated, interactive and synergistic Center will provide fundamental insights into the mechanisms of
oncogenesis of the different classes of NUP98 FO, and new therapeutic modalities that will be validated in
preclinical models and translated into human clinical trials. All data and resources will be made freely available
by websites, data deposition, and establishment of resource and genomic data portals to the FusOnC2
consortium and broad scientific community."	Acute;Acute Erythroblastic Leukemia;Acute Megakaryocytic Leukemias;Acute leukemia;Address;Adolescent;Biological Models;Biology;CRISPR/Cas technology;Cancer Biology;Chemicals;Chemistry;Child;Childhood Leukemia;Chimeric Proteins;Chromatin;Cities;Clinical Trials;Communities;Congresses;Core Facility;Dana-Farber Cancer Institute;Dependence;Development;Drug Design;Engineering;Erythroid;Experimental Models;FLT3 gene;Fusion Oncogene Proteins;Genes;Genomics;Goals;HOXA9 gene;Homeobox;Human;In Vitro;Institutes;Lead;Leukemic Cell;Malignant Childhood Neoplasm;Malignant Neoplasms;Mediating;Modality;Modeling;Molecular;Morphology;Mus;Mutation;Myeloproliferative disease;Nuclear Pore Complex Proteins;Outcome;Phase;Pre-Clinical Model;Proteins;Proteomics;RB1 gene;Reporting;Research Personnel;Resources;Role;Saint Jude Children&apos;s Research Hospital;Scanning;Structure;Testing;Therapeutic;Transcriptional Regulation;Translating;Treatment Efficacy;Validation;WT1 gene;Xenograft Model;Zoran;base;chromatin protein;clinical phenotype;data portal;data resource;data submission;drug development;drug discovery;effective therapy;epigenomics;genome editing;genomic data;high risk;human model;improved outcome;in vivo;insight;leukemia;leukemogenesis;mouse model;novel therapeutic intervention;novel therapeutics;protein complex;response;small molecule inhibitor;small molecule libraries;structural biology;transcriptomics;tumorigenesis;web site	ST. JUDE CHILDREN'S RESEARCH HOSPITAL	MEMPHIS	TN	UNITED STATES	Charles G. Mullighan	Chamelli Jhappan	179500	179500	2020-08-20T12:08:00Z	2019-09-19T12:09:00Z	2024-08-31T12:08:00Z	RFA-CA-19-016	nofo_RFA-CA-19-016
3U54CA231630-01A1S2	U54CA231630	10221086	2020	Defining and targeting the molecular vulnerabilities of the PAX3-FOXO1 protein in rhabdomyosarcoma	"ABSTRACT – Overall (revised)
Fusion-positive alveolar rhabdomyosarcoma (ARMS) remains one of the most fatal but least understood cancers of childhood. The driving oncoprotein in ARMS is the PAX3-FOXO1 fusion protein, a chimeric transcription factor that hijacks normal gene expression and chromatin state. Five-year survival for children with PAX3-FOXO1- positive ARMS is ~30% for all-comers, and <10% when metastatic. Despite the discovery of PAX3-FOXO1 in 1993, treatment strategies for affected children remain unchanged. This deficiency stems equally from a lack of understanding of the basic biology of the disease and an inability to directly target the fusion protein. No systematic or comprehensive approach has been undertaken to identify the proteins and regulatory elements required to support PAX3-FOXO1-mediated tumorigenesis. As a result, the field has been limited to a patchwork of data with no unified scientific strategy. To overcome this, this FusOnC2 Center has an innovative team and dynamic environment in which data interpretation is informed by complementary technological approaches and by biological and clinical knowledge. This comprehensive approach will transform understanding of PAX3-FOXO1-mediated oncogenesis and create opportunities for therapeutic intervention. The Center’s overarching goal is to advance the therapeutic tractability of the PAX3-FOXO1 fusion protein in ARMS by comprehensively identifying the druggable co-regulators, modulators, and intrinsic activities of PAX3-FOXO1. To accomplish this goal, the Center includes two complementary Projects, each led by expert RMS biologists paired with specialists in pioneering experimental approaches undertaking the most cutting-edge research in cancer biology, genomics, proteomics, structural biology, and medicinal chemistry. The Projects will be supported by RMS investigators within each project who will provide curated RMS cell lines, unique human primary RMS tumor cells, and murine models to enable rapid in vitro and in vivo validation and cross-prioritization of targets. An Administrative Core will integrate and coordinate the Center components, providing leadership and oversight, and promoting cross-pollination of ideas and resources. The Overall Specific Aims are to: (1) define and target the PAX3-FOXO1 interactome; and (2) perform chemical probe discovery for PAX3-FOXO1 to create additional tools for investigating the fundamental biology and tractability of PAX3-FOXO1 and fusion-positive RMS. Approaches used include proximity labeling, saturation mutagenesis, single and combinatorial CRISPR screens, high-throughput phenotypic assays, and mechanistically unbiased approaches to chemical probe discovery using novel high-throughput binding assays. We will use information gleaned to prioritize targets and agents for validation and to inform compound optimization and PROTAC preparation. This Center’s strengths and resources will synergize with the FusOnC2 Consortium, speeding development of knowledge generalizable to the biology of multiple fusion oncoproteins in childhood cancers, accelerating advances in clinical care."	Affect;Alveolar Rhabdomyosarcoma;Animal Model;Automobile Driving;Belief;Binding;Biological;Biological Assay;Biology;CRISPR screen;Cancer Biology;Cell Line;Cell model;Chemicals;Child;Chimeric Proteins;Chromatin;Clinical;Code;Collaborations;Data;Data Analyses;Dependence;Development;Disease;Elements;Environment;FOXO1A gene;Fusion Oncogene Proteins;Gene Expression;Gene Proteins;Genes;Genetic;Genetic Screening;Genetic Transcription;Genetically Engineered Mouse;Genomics;Glean;Goals;Human;In Vitro;Institution;Knowledge;Label;Lead;Leadership;Malignant Childhood Neoplasm;Mediating;Molecular Genetics;Molecular Target;Mutagenesis;Oncogenic;Oncoproteins;PAX3 gene;Pharmaceutical Chemistry;Pharmacology;Phenotype;Preparation;Protac;Proteins;Proteomics;Regulatory Element;Research;Research Personnel;Resolution;Resources;Rhabdomyosarcoma;Specialist;Speed;Structure;Structure-Activity Relationship;Techniques;Therapeutic;Therapeutic Intervention;Untranslated RNA;Validation;cellular engineering;clinical care;combinatorial;druggable target;epigenomics;genome-wide;improved;in vivo;innovation;insight;mouse model;multidisciplinary;neoplastic cell;novel;pre-clinical;public health relevance;small molecule;stem;structural biology;targeted agent;tool;transcription factor;transcriptomics;treatment strategy;tumor;tumorigenesis;tumorigenic	DUKE UNIVERSITY	DURHAM	NC	UNITED STATES	Christopher M Counter, Corinne Mary Linardic	Keren L Witkin	80500	80500	2020-08-12T12:08:00Z	2020-08-12T12:08:00Z	2024-08-31T12:08:00Z	RFA-CA-19-016	nofo_RFA-CA-19-016
3U54CA243126-01S1	U54CA243126	10221308	2020	Center for therapeutic targeting of the Fusion Oncoprotein of Fibrolamellar Hepatocellular Carcinoma	"Project Summary / Abstract
Fibrolamellar hepatocellular carcinoma (FLC) is a usually lethal primary tumor in children, adolescents and young adults. The primary tumor is initiated and driven by a single alteration in the DNA: A deletion of ~400kb that results in a fusion gene between the heat shock co-chaperone DNAJB1 and the catalytic subunit of protein kinase A, PRKACA. If the tumor is limited to the liver, then surgery is the accepted therapy. However, if the tumor has metastasized, there is no accepted therapy. This project will determine how the fusion oncoprotein leads to pathogenesis and will develop therapeutics targeted to the fusion oncoprotein. Pathogenesis is being probed by examining what is different about the fusion oncoprotein that causes changes in the cell. Therapeutics will target the fusion oncoprotein through small molecules to block activity, or small molecules to send it to the proteasome, or small molecules for allosteric inhibition."	Adolescent and Young Adult;Affect;Age;Antisense Oligonucleotides;Belief;Benchmarking;Biocompatible Materials;Biological Models;Catalytic Domain;Cells;Child;Chimeric Proteins;Communities;Cyclic AMP-Dependent Protein Kinases;DNA;Failure;Fibrolamellar Hepatocellular Carcinoma;Fusion Oncogene Proteins;Genes;Genetic;Genome;Goals;Heat-Shock Response;Human;Individual;Liver;Malignant Childhood Neoplasm;Malignant Neoplasms;Malignant neoplasm of liver;Messenger RNA;Molecular Chaperones;Neoplasm Metastasis;Oncoproteins;Operative Surgical Procedures;Organ;PRKACA gene;Pathogenesis;Patients;Pediatric Neoplasm;Population;Primary Neoplasm;Proteins;Proteome;Research Personnel;Somatic Mutation;Testing;Therapeutic;Transcript;Work;combat;design;fusion gene;human genome sequencing;knock-down;multicatalytic endopeptidase complex;patient population;small molecule;targeted treatment;therapeutic development;therapeutic evaluation;therapeutic target;transcriptome;tumor	ROCKEFELLER UNIVERSITY	NEW YORK	NY	UNITED STATES	Sanford M Simon	Weiwei Chen	189125	189125	2020-08-31T12:08:00Z	2019-09-20T12:09:00Z	2024-08-31T12:08:00Z	RFA-CA-19-016	nofo_RFA-CA-19-016
1U54CA231630-01A1	U54CA231630	9833682	2019	Defining and targeting the molecular vulnerabilities of the PAX3-FOXO1 protein in rhabdomyosarcoma	"ABSTRACT – Overall (revised)
Fusion-positive alveolar rhabdomyosarcoma (ARMS) remains one of the most fatal but least understood cancers of childhood. The driving oncoprotein in ARMS is the PAX3-FOXO1 fusion protein, a chimeric transcription factor that hijacks normal gene expression and chromatin state. Five-year survival for children with PAX3-FOXO1- positive ARMS is ~30% for all-comers, and <10% when metastatic. Despite the discovery of PAX3-FOXO1 in 1993, treatment strategies for affected children remain unchanged. This deficiency stems equally from a lack of understanding of the basic biology of the disease and an inability to directly target the fusion protein. No systematic or comprehensive approach has been undertaken to identify the proteins and regulatory elements required to support PAX3-FOXO1-mediated tumorigenesis. As a result, the field has been limited to a patchwork of data with no unified scientific strategy. To overcome this, this FusOnC2 Center has an innovative team and dynamic environment in which data interpretation is informed by complementary technological approaches and by biological and clinical knowledge. This comprehensive approach will transform understanding of PAX3-FOXO1-mediated oncogenesis and create opportunities for therapeutic intervention. The Center’s overarching goal is to advance the therapeutic tractability of the PAX3-FOXO1 fusion protein in ARMS by comprehensively identifying the druggable co-regulators, modulators, and intrinsic activities of PAX3-FOXO1. To accomplish this goal, the Center includes two complementary Projects, each led by expert RMS biologists paired with specialists in pioneering experimental approaches undertaking the most cutting-edge research in cancer biology, genomics, proteomics, structural biology, and medicinal chemistry. The Projects will be supported by RMS investigators within each project who will provide curated RMS cell lines, unique human primary RMS tumor cells, and murine models to enable rapid in vitro and in vivo validation and cross-prioritization of targets. An Administrative Core will integrate and coordinate the Center components, providing leadership and oversight, and promoting cross-pollination of ideas and resources. The Overall Specific Aims are to: (1) define and target the PAX3-FOXO1 interactome; and (2) perform chemical probe discovery for PAX3-FOXO1 to create additional tools for investigating the fundamental biology and tractability of PAX3-FOXO1 and fusion-positive RMS. Approaches used include proximity labeling, saturation mutagenesis, single and combinatorial CRISPR screens, high-throughput phenotypic assays, and mechanistically unbiased approaches to chemical probe discovery using novel high-throughput binding assays. We will use information gleaned to prioritize targets and agents for validation and to inform compound optimization and PROTAC preparation. This Center’s strengths and resources will synergize with the FusOnC2 Consortium, speeding development of knowledge generalizable to the biology of multiple fusion oncoproteins in childhood cancers, accelerating advances in clinical care."	Affect;Alveolar Rhabdomyosarcoma;Animal Model;Automobile Driving;Belief;Binding;Biological;Biological Assay;Biology;CRISPR screen;Cancer Biology;Cell Line;Cell model;Chemicals;Child;Chimera organism;Chimeric Proteins;Chromatin;Clinical;Code;Collaborations;Data;Data Analyses;Dependence;Development;Disease;Elements;Environment;FOXO1A gene;Fusion Oncogene Proteins;Gene Expression;Gene Proteins;Genes;Genetic;Genetic Screening;Genetic Transcription;Genetically Engineered Mouse;Genomics;Glean;Goals;Human;In Vitro;Institution;Knowledge;Label;Lead;Leadership;Malignant Childhood Neoplasm;Mediating;Molecular Genetics;Molecular Target;Mutagenesis;Oncogenic;Oncoproteins;PAX3 gene;Pharmaceutical Chemistry;Pharmacology;Phenotype;Preparation;Proteins;Proteolysis;Proteomics;Regulatory Element;Research;Research Personnel;Resolution;Resources;Rhabdomyosarcoma;Specialist;Speed;Structure;Structure-Activity Relationship;Techniques;Therapeutic;Therapeutic Intervention;Untranslated RNA;Validation;cellular engineering;clinical care;combinatorial;druggable target;epigenomics;genome-wide;improved;in vivo;innovation;insight;mouse model;multidisciplinary;neoplastic cell;novel;pre-clinical;public health relevance;small molecule;stem;structural biology;targeted agent;tool;transcription factor;transcriptomics;treatment strategy;tumor;tumorigenesis;tumorigenic	DUKE UNIVERSITY	DURHAM	NC	UNITED STATES	Christopher M Counter, Corinne Mary Linardic	Keren L Witkin	5849947	5849947	2019-09-17T12:09:00Z	2019-09-17T12:09:00Z	2024-08-31T12:08:00Z	RFA-CA-19-016	nofo_RFA-CA-19-016
6U54CA243125-02	U54CA243125	10603048	2019	Biology and therapy of C11orf95-RELA fusion-driven ependymoma	"ABSTRACT/SUMMARY – OVERALL (HOLLAND)
Due to a chromothripsis event on chromosome 11, the majority of supratentorial ependymomas generate and
express the gene fusion C11orf95-RELA fusion (RELAFus). The goal of the U54 titled “Biology and therapy of
C11orf95-RELA fusion-driven ependymoma is to understand the biology of this fusion protein and the two
components that make up the fusion and determine the requirements for continued expression of this fusion
protein and what pathways downstream are critical for oncogenesis. We will use a combination of novel mouse
models and human neuro stem cell systems with readouts of single cell analysis, immunology, tumor
microenvironment, systems biology, and data visualization. In addition to the administrative core, the grant has
three main Projects, a data visualization and sharing core. The research projects include, Project 1) Mechanisms
and models of C11or95 and C11or95-RELA fusions (RELAFus), Project 2) Genetic interrogation of therapeutic
vulnerabilities for C11orf95-RELA fusion, and Project 3) Identifying small molecules with therapeutic effects in
RELAFus -driven EPN and testing them in preclinical genetically engineered models of EPN."		FRED HUTCHINSON CANCER CENTER	Seattle	WA	UNITED STATES	Eric C. Holland	Chamelli Jhappan	1092169	1092169	2022-05-27T12:05:00Z	2019-09-19T12:09:00Z	2024-08-31T12:08:00Z	RFA-CA-19-016	nofo_RFA-CA-19-016
1U54CA243126-01	U54CA243126	9834349	2019	Center for therapeutic targeting of the Fusion Oncoprotein of Fibrolamellar Hepatocellular Carcinoma	"Project Summary / Abstract
Fibrolamellar hepatocellular carcinoma (FLC) is a usually lethal primary tumor in children, adolescents and young adults. The primary tumor is initiated and driven by a single alteration in the DNA: A deletion of ~400kb that results in a fusion gene between the heat shock co-chaperone DNAJB1 and the catalytic subunit of protein kinase A, PRKACA. If the tumor is limited to the liver, then surgery is the accepted therapy. However, if the tumor has metastasized, there is no accepted therapy. This project will determine how the fusion oncoprotein leads to pathogenesis and will develop therapeutics targeted to the fusion oncoprotein. Pathogenesis is being probed by examining what is different about the fusion oncoprotein that causes changes in the cell. Therapeutics will target the fusion oncoprotein through small molecules to block activity, or small molecules to send it to the proteasome, or small molecules for allosteric inhibition."	Adolescent and Young Adult;Affect;Age;Antisense Oligonucleotides;Belief;Benchmarking;Biocompatible Materials;Biological Models;Catalytic Domain;Cells;Child;Chimeric Proteins;Communities;Cyclic AMP-Dependent Protein Kinases;DNA;Failure;Fibrolamellar Hepatocellular Carcinoma;Fusion Oncogene Proteins;Genes;Genetic;Genome;Goals;Heat-Shock Response;Human;Individual;Liver;Malignant Childhood Neoplasm;Malignant Neoplasms;Malignant neoplasm of liver;Messenger RNA;Molecular Chaperones;Neoplasm Metastasis;Oncoproteins;Operative Surgical Procedures;Organ;PRKACA gene;Pathogenesis;Patients;Pediatric Neoplasm;Population;Primary Neoplasm;Proteins;Proteome;Research Personnel;Somatic Mutation;Testing;Therapeutic;Transcript;Work;combat;design;fusion gene;human genome sequencing;knock-down;multicatalytic endopeptidase complex;patient population;small molecule;targeted treatment;therapeutic development;therapeutic evaluation;therapeutic target;transcriptome;tumor	ROCKEFELLER UNIVERSITY	NEW YORK	NY	UNITED STATES	Sanford M Simon	Weiwei Chen	5000000	5000000	2019-09-20T12:09:00Z	2019-09-20T12:09:00Z	2024-08-31T12:08:00Z	RFA-CA-19-016	nofo_RFA-CA-19-016
